2013_073403|semvalorlegal|Awards|No dia 20 de cada mês, no cartão vale alimentação no valor de R$ 57,00 ( cinquenta e sete ) reais aqueles funcionários que não tiverem ausencia superior a 4 h no mes, desde que estas horas estejam devidamente atestadas. Paragrafo Primeiro : o premio assiduidade pactuado pelo presente instrumento não incorporará aos salários,nem tampouco haverá incidencia de INSS ou quaisquer encargos trabalhistas. |dia cartão vale alimentação cinquenta real funcionário tiver ausencia superior h mes hora estar devidamente atestar paragrafo premio assiduidade pactuar presente instrumento incorporar salário tampouco haver incidencia inss qualquer encargo trabalhista|0.0|0.0|0.0|0.0|0.0|0.0|0.0|0.0|0.16464377857636645|0.0|0.0|0.0|0.0|0.0|0.0|0.0|0.0|0.0|0.0|0.0|0.0|0.0|0.0|0.0|0.0|0.0|0.0|0.0|0.16464377857636645|0.0|0.0|0.1818724508950719|0.0|0.0|0.0|0.0|0.1818724508950719|0.0|0.0|0.0|0.0|0.0|0.0|0.0|0.0|0.0|0.0|0.0|0.0|0.0|0.0|0.0|0.16464377857636645|0.0|0.0|0.0|0.0|0.0|0.0|0.0|0.20615490070061165|0.0|0.0|0.0|0.0|0.0|0.0|0.0|0.0|0.0|0.0|0.0|0.0|0.0|0.0|0.0|0.0|0.0|0.0|0.0|0.0|0.0|0.0|0.0|0.0|0.0|0.0|0.0|0.0|0.0|0.0|0.0|0.0|0.0|0.0|0.0|0.0|0.0|0.0|0.0|0.0|0.0|0.0|0.0|0.0|0.0|0.0|0.0|0.0|0.0|0.0|0.0|0.0|0.0|0.0|0.0|0.0|0.0|0.0|0.0|0.20615490070061165|0.0|0.0|0.15128018211427155|0.0|0.0|0.0|0.0|0.0|0.0|0.0|0.0|0.0|0.0|0.0|0.0|0.0|0.0|0.0|0.0|0.1818724508950719|0.0|0.0|0.0|0.0|0.0|0.0|0.0|0.1818724508950719|0.0|0.0|0.0|0.0|0.0|0.0|0.0|0.0|0.0|0.0|0.0|0.0|0.0|0.0|0.0|0.0|0.0|0.0|0.0|0.0|0.0|0.0|0.0|0.16464377857636645|0.0|0.0|0.0|0.0|0.0|0.0|0.0|0.0|0.1818724508950719|0.0|0.16464377857636645|0.0|0.0|0.0|0.0|0.0|0.0|0.20615490070061165|0.0|0.0|0.20615490070061165|0.0|0.0|0.0|0.0|0.0|0.20615490070061165|0.20615490070061165|0.0|0.0|0.0|0.0|0.0|0.0|0.0|0.0|0.0|0.0|0.0|0.0|0.0|0.0|0.0|0.0|0.0|0.0|0.0|0.0|0.0|0.0|0.0|0.0|0.0|0.0|0.0|0.0|0.0|0.1818724508950719|0.0|0.0|0.0|0.0|0.0|0.0|0.0|0.0|0.0|0.0|0.0|0.0|0.0|0.0|0.0|0.0|0.0|0.0|0.0|0.0|0.0|0.0|0.0|0.0|0.0|0.0|0.0|0.0|0.0|0.0|0.0|0.0|0.20615490070061165|0.0|0.0|0.0|0.16464377857636645|0.0|0.0|0.0|0.0|0.0|0.0|0.0|0.0|0.0|0.0|0.0|0.0|0.0|0.0|0.0|0.0|0.0|0.0|0.16464377857636645|0.15128018211427155|0.0|0.0|0.0|0.0|0.0|0.0|0.0|0.0|0.0|0.0|0.0|0.0|0.0|0.0|0.0|0.0|0.0|0.0|0.20615490070061165|0.0|0.0|0.0|0.0|0.0|0.0|0.12313265645212124|0.0|0.0|0.0|0.0|0.0|0.0|0.0|0.0|0.0|0.0|0.0|0.0|0.0|0.0|0.0|0.0|0.0|0.0|0.0|0.0|0.0|0.13112956980922277|0.0|0.0|0.0|0.0|0.0|0.0|0.0|0.0|0.0|0.0|0.0|0.0|0.0|0.20615490070061165|0.0|0.20615490070061165|0.0|0.0|0.20615490070061165|0.0|0.0|0.0|0.0|0.0|0.1818724508950719|0.0|0.0|0.0|0.0|0.0|0.0|0.0|0.0|0.1818724508950719|0.0|0.0|0.0|0.0|0.0|0.0|0.0|0.0|0.0
2013_073403|semvalorlegal|Awards|"As ausencias ( nem mesmo as 4 h compravadas) ao final do período ( junho / 13 a maio / 2014 ) receberão um  ""Plus"", que consiste em um crédito de mais  R$ 96,00 ( noventa e seis ) reais , no cartão alimentação. "|ausencia h compravada período junho maio receber plus consistir crédito novento real cartão alimentação|0.0|0.0|0.0|0.0|0.0|0.0|0.0|0.0|0.2427174839809632|0.0|0.0|0.0|0.0|0.0|0.0|0.0|0.0|0.0|0.0|0.0|0.0|0.0|0.0|0.0|0.0|0.0|0.0|0.0|0.0|0.0|0.0|0.0|0.0|0.0|0.0|0.0|0.26811595353557843|0.0|0.0|0.0|0.0|0.0|0.0|0.0|0.0|0.0|0.0|0.0|0.0|0.0|0.0|0.0|0.2427174839809632|0.0|0.0|0.0|0.0|0.0|0.0|0.0|0.0|0.0|0.0|0.0|0.0|0.0|0.0|0.0|0.0|0.30391308582115056|0.0|0.0|0.0|0.0|0.0|0.0|0.0|0.0|0.0|0.0|0.0|0.0|0.0|0.0|0.30391308582115056|0.0|0.0|0.0|0.0|0.0|0.0|0.0|0.0|0.0|0.0|0.0|0.0|0.30391308582115056|0.0|0.0|0.0|0.0|0.0|0.0|0.0|0.0|0.0|0.0|0.0|0.0|0.0|0.0|0.0|0.0|0.0|0.0|0.0|0.0|0.0|0.0|0.0|0.0|0.0|0.0|0.0|0.0|0.0|0.0|0.0|0.0|0.0|0.0|0.0|0.0|0.0|0.0|0.0|0.0|0.0|0.0|0.0|0.0|0.0|0.0|0.0|0.0|0.0|0.0|0.0|0.0|0.0|0.0|0.0|0.0|0.0|0.0|0.0|0.0|0.0|0.0|0.0|0.0|0.0|0.0|0.0|0.0|0.0|0.0|0.0|0.0|0.0|0.0|0.0|0.0|0.0|0.0|0.0|0.0|0.0|0.0|0.0|0.0|0.0|0.0|0.0|0.0|0.0|0.0|0.0|0.0|0.0|0.0|0.0|0.0|0.0|0.0|0.0|0.0|0.0|0.0|0.0|0.0|0.0|0.0|0.0|0.0|0.0|0.0|0.0|0.30391308582115056|0.0|0.0|0.0|0.0|0.0|0.0|0.0|0.0|0.0|0.0|0.30391308582115056|0.0|0.0|0.0|0.0|0.0|0.0|0.0|0.0|0.0|0.0|0.0|0.0|0.0|0.0|0.0|0.0|0.0|0.0|0.0|0.0|0.0|0.0|0.0|0.0|0.0|0.0|0.0|0.0|0.0|0.0|0.30391308582115056|0.0|0.0|0.0|0.0|0.0|0.0|0.0|0.0|0.0|0.0|0.0|0.0|0.0|0.0|0.0|0.0|0.0|0.0|0.0|0.0|0.0|0.0|0.0|0.30391308582115056|0.0|0.26811595353557843|0.0|0.0|0.0|0.0|0.0|0.0|0.0|0.0|0.0|0.0|0.0|0.0|0.0|0.0|0.0|0.0|0.0|0.0|0.0|0.0|0.0|0.0|0.0|0.0|0.0|0.0|0.0|0.0|0.0|0.0|0.0|0.0|0.0|0.0|0.0|0.18152188214077583|0.0|0.2427174839809632|0.0|0.0|0.0|0.0|0.0|0.0|0.0|0.0|0.0|0.0|0.0|0.0|0.0|0.0|0.0|0.0|0.0|0.0|0.0|0.0|0.0|0.0|0.0|0.0|0.0|0.0|0.0|0.0|0.0|0.0|0.0|0.0|0.0|0.0|0.0|0.0|0.0|0.0|0.0|0.0|0.0|0.0|0.0|0.0|0.0|0.0|0.0|0.0|0.0|0.0|0.0|0.0|0.0|0.0|0.0|0.0|0.0|0.0|0.0|0.0|0.0|0.0|0.0
2013_073403|semvalorlegal|Awards|não se aplicam a liderança. Paragrafo primeiro: A liderança receberá um premio Produtividade mensal, quando cumprida a meta de 16 metros cubicos de produção e 1.000 cubicos de serraria , sendo creditado no cartão alimentação o mesmo valor em igual prazo.Paragrafo segundo : O plus funcionará da mesma forma, ou seja atingirem todos os meses receberão o Plus. |aplicar liderança paragrafo liderança receber premio produtividade mensal cumprir meta metro cubico produção cubico serrar ser creditar cartão alimentaçãor igual prazo paragrafo plus funcionar mesmo ser atingir receber plus|0.0|0.0|0.0|0.0|0.0|0.0|0.0|0.0|0.0|0.17658608200937123|0.0|0.0|0.0|0.0|0.0|0.0|0.0|0.0|0.0|0.0|0.0|0.15578646648639782|0.0|0.0|0.0|0.0|0.0|0.0|0.0|0.0|0.0|0.0|0.17658608200937123|0.0|0.0|0.0|0.0|0.0|0.0|0.0|0.0|0.0|0.0|0.0|0.0|0.0|0.0|0.0|0.0|0.0|0.0|0.0|0.14102890441707916|0.0|0.0|0.0|0.0|0.0|0.0|0.0|0.0|0.0|0.0|0.0|0.0|0.0|0.0|0.0|0.0|0.0|0.0|0.0|0.0|0.0|0.0|0.0|0.0|0.0|0.0|0.0|0.0|0.0|0.0|0.0|0.0|0.0|0.0|0.0|0.0|0.0|0.0|0.0|0.0|0.0|0.0|0.17658608200937123|0.0|0.0|0.0|0.35317216401874246|0.15578646648639782|0.0|0.0|0.0|0.0|0.0|0.0|0.0|0.0|0.0|0.0|0.0|0.0|0.0|0.0|0.0|0.0|0.0|0.0|0.0|0.0|0.0|0.0|0.0|0.0|0.0|0.0|0.0|0.0|0.0|0.0|0.0|0.0|0.0|0.0|0.0|0.0|0.0|0.0|0.0|0.0|0.0|0.0|0.0|0.0|0.0|0.0|0.0|0.0|0.0|0.0|0.0|0.0|0.0|0.0|0.0|0.0|0.0|0.0|0.0|0.0|0.0|0.0|0.0|0.0|0.0|0.0|0.0|0.0|0.0|0.0|0.17658608200937123|0.0|0.0|0.0|0.0|0.0|0.0|0.0|0.0|0.0|0.0|0.0|0.0|0.0|0.0|0.0|0.17658608200937123|0.0|0.0|0.0|0.0|0.0|0.0|0.0|0.0|0.0|0.0|0.0|0.0|0.0|0.0|0.0|0.0|0.0|0.0|0.0|0.0|0.0|0.0|0.0|0.0|0.0|0.0|0.0|0.0|0.0|0.0|0.35317216401874246|0.0|0.0|0.0|0.0|0.0|0.0|0.0|0.0|0.14102890441707916|0.0|0.0|0.0|0.12022928889410572|0.17658608200937123|0.17658608200937123|0.0|0.0|0.0|0.0|0.0|0.0|0.0|0.0|0.0|0.0|0.0|0.0|0.0|0.0|0.0|0.0|0.0|0.0|0.0|0.0|0.0|0.0|0.0|0.0|0.0|0.0|0.0|0.0|0.0|0.0|0.0|0.0|0.0|0.2820578088341583|0.0|0.0|0.0|0.0|0.0|0.0|0.0|0.0|0.0|0.31157293297279565|0.0|0.0|0.0|0.0|0.0|0.17658608200937123|0.0|0.0|0.14102890441707916|0.0|0.0|0.0|0.0|0.0|0.0|0.0|0.0|0.17658608200937123|0.17658608200937123|0.0|0.0|0.0|0.0|0.0|0.0|0.0|0.0|0.0|0.0|0.0|0.0|0.0|0.0|0.0|0.0|0.0|0.0|0.2820578088341583|0.0|0.0|0.0|0.0|0.0|0.0|0.0|0.0|0.0|0.0|0.0|0.0|0.0|0.0|0.0|0.0|0.0|0.0|0.0|0.0|0.0|0.0|0.0|0.16934422260362728|0.17658608200937123|0.0|0.0|0.0|0.0|0.0|0.0|0.0|0.0|0.0|0.0|0.0|0.0|0.0|0.0|0.0|0.0|0.0|0.0|0.0|0.0|0.0|0.0|0.0|0.0|0.0|0.0|0.0|0.0|0.0|0.0|0.0|0.0|0.0|0.0|0.0|0.0|0.0|0.0
2013_073403|semvalorlegal|Awards|serão aqueles fixados em Convenção Coletiva de Trabalho celebrada em ambito intermunicipal entre o sindicato dos Trabalhadores e Sindicato Patronal.Nos temos do artigo 3 ( terceiro ) da Lei 10.101/2000, os valores pagos a titlulo de PLR não integrarão a remuneração do empregado e , portanto, não constitui base de incidência de qualquer encargo trabalhista ou previdenciario, não se lhe aplicando, tambem o principio de habitualidade.|ser fixado convenção coletiva trabalho celebrar ambito intermunicipal sindicato trabalhadores sindicato patronal artigo lei valor pagar titlulo plr integrar remuneração empregado constituir base incidência encargo trabalhista previdenciario aplicar tambem principio habitualidade|0.0|0.0|0.0|0.0|0.0|0.0|0.0|0.0|0.0|0.0|0.0|0.1919411159983948|0.0|0.0|0.0|0.0|0.0|0.0|0.0|0.0|0.0|0.16933287094086422|0.0|0.0|0.0|0.0|0.16933287094086422|0.0|0.0|0.0|0.0|0.0|0.0|0.0|0.0|0.0|0.0|0.0|0.0|0.16933287094086422|0.0|0.0|0.0|0.0|0.0|0.0|0.0|0.0|0.0|0.0|0.0|0.0|0.0|0.0|0.0|0.0|0.1919411159983948|0.0|0.0|0.0|0.0|0.0|0.0|0.1919411159983948|0.0|0.0|0.0|0.0|0.0|0.0|0.0|0.0|0.0|0.0|0.0|0.0|0.0|0.0|0.0|0.0|0.0|0.0|0.0|0.0|0.0|0.1919411159983948|0.0|0.0|0.0|0.0|0.0|0.0|0.16933287094086422|0.0|0.0|0.0|0.0|0.0|0.0|0.0|0.0|0.0|0.0|0.0|0.0|0.0|0.0|0.0|0.0|0.0|0.0|0.0|0.0|0.0|0.0|0.0|0.0|0.0|0.0|0.0|0.0|0.0|0.0|0.0|0.0|0.0|0.0|0.0|0.0|0.0|0.0|0.0|0.0|0.0|0.0|0.0834395146767778|0.0|0.0|0.0|0.0|0.16933287094086422|0.0|0.0|0.0|0.0|0.0|0.0|0.0|0.0|0.0|0.0|0.0|0.0|0.0|0.0|0.0|0.0|0.0|0.0|0.0|0.0|0.0|0.0|0.0|0.0|0.1919411159983948|0.0|0.0|0.0|0.0|0.0|0.0|0.0|0.0|0.0|0.0|0.0|0.0|0.0|0.1919411159983948|0.0|0.0|0.0|0.0|0.0|0.0|0.0|0.0|0.0|0.0|0.0|0.0|0.1919411159983948|0.0|0.0|0.0|0.0|0.0|0.0|0.0|0.0|0.1919411159983948|0.1919411159983948|0.0|0.0|0.0|0.0|0.0|0.0|0.0|0.0|0.0|0.0|0.0|0.0|0.0|0.16933287094086422|0.0|0.0|0.0|0.0|0.0|0.0|0.0|0.0|0.0|0.0|0.0|0.0|0.0|0.0|0.0|0.0|0.0|0.0|0.0|0.0|0.0|0.0|0.0|0.0|0.0|0.0|0.0|0.0|0.0|0.0|0.0|0.0|0.0|0.0|0.0|0.0|0.0|0.0|0.0|0.0|0.0|0.0|0.0|0.0|0.0|0.0|0.0|0.0|0.10220080049020097|0.0|0.0|0.0|0.0|0.0|0.1919411159983948|0.0|0.0|0.0|0.0|0.1919411159983948|0.0|0.0|0.0|0.0|0.0|0.0|0.0|0.0|0.0|0.0|0.0|0.0|0.0|0.0|0.1919411159983948|0.0|0.0|0.1919411159983948|0.0|0.0|0.0|0.0|0.0|0.0|0.0|0.0|0.0|0.0|0.0|0.0|0.0|0.0|0.0|0.0|0.0|0.0|0.0|0.0|0.0|0.0|0.0|0.0|0.0|0.0|0.0|0.0|0.0|0.0|0.15329206579490554|0.0|0.0|0.0|0.0|0.0|0.0|0.0|0.0|0.0|0.0|0.0|0.0|0.0|0.09203477053388572|0.0|0.0|0.0|0.0|0.33866574188172843|0.0|0.0|0.0|0.0|0.0|0.1919411159983948|0.0|0.0|0.1919411159983948|0.0|0.0|0.0|0.0|0.1919411159983948|0.0|0.16933287094086422|0.13068382073737497|0.0|0.0|0.0|0.0|0.0|0.0|0.0|0.0|0.0|0.16933287094086422|0.0|0.0|0.0|0.0|0.0|0.0|0.0
2017_039364|carimbo|Tenure Pay|Fica assegurado um adicional a cada quinquênio de serviço na empresa, correspondente a 6% (seis por cento) calculado sobre o salário base da categoria. |ficar assegurar adicional quinquênio serviço empresa correspondente calcular salário base categoria|0.0|0.0|0.0|0.0|0.0|0.29895211220742507|0.0|0.0|0.0|0.0|0.0|0.0|0.0|0.0|0.0|0.0|0.0|0.0|0.0|0.0|0.0|0.0|0.0|0.0|0.0|0.0|0.0|0.3302350918908488|0.0|0.0|0.0|0.0|0.0|0.0|0.0|0.0|0.0|0.0|0.0|0.3302350918908488|0.0|0.0|0.0|0.0|0.0|0.0|0.3302350918908488|0.0|0.0|0.0|0.0|0.0|0.0|0.0|0.0|0.3743259753831141|0.0|0.0|0.0|0.0|0.0|0.0|0.0|0.0|0.0|0.0|0.0|0.0|0.0|0.0|0.0|0.0|0.0|0.0|0.0|0.0|0.0|0.0|0.0|0.0|0.0|0.0|0.0|0.0|0.0|0.0|0.0|0.0|0.0|0.0|0.0|0.0|0.0|0.0|0.3302350918908488|0.0|0.0|0.0|0.0|0.0|0.0|0.0|0.0|0.0|0.0|0.0|0.0|0.0|0.0|0.0|0.0|0.0|0.0|0.0|0.0|0.0|0.0|0.0|0.0|0.0|0.0|0.0|0.0|0.0|0.0|0.0|0.0|0.0|0.0|0.0|0.0|0.0|0.0|0.0|0.0|0.0|0.0|0.0|0.0|0.15522240136302054|0.0|0.0|0.0|0.0|0.0|0.0|0.0|0.0|0.0|0.0|0.0|0.0|0.0|0.0|0.0|0.0|0.0|0.0|0.0|0.0|0.0|0.0|0.0|0.23809865277803618|0.0|0.0|0.0|0.0|0.0|0.0|0.0|0.0|0.0|0.0|0.0|0.0|0.0|0.0|0.0|0.0|0.0|0.0|0.0|0.0|0.0|0.0|0.0|0.0|0.0|0.0|0.0|0.0|0.0|0.0|0.0|0.0|0.0|0.0|0.0|0.0|0.0|0.0|0.0|0.0|0.0|0.0|0.0|0.0|0.0|0.0|0.0|0.0|0.0|0.0|0.0|0.0|0.0|0.0|0.0|0.0|0.0|0.0|0.0|0.0|0.0|0.0|0.0|0.0|0.0|0.0|0.0|0.0|0.0|0.0|0.0|0.0|0.0|0.0|0.0|0.0|0.0|0.0|0.0|0.0|0.0|0.0|0.0|0.0|0.0|0.0|0.0|0.0|0.0|0.0|0.0|0.0|0.0|0.0|0.0|0.0|0.0|0.0|0.0|0.0|0.0|0.0|0.0|0.0|0.0|0.0|0.0|0.0|0.0|0.0|0.0|0.0|0.0|0.0|0.0|0.0|0.0|0.0|0.0|0.0|0.0|0.0|0.0|0.0|0.0|0.0|0.0|0.0|0.0|0.0|0.0|0.0|0.0|0.0|0.0|0.0|0.0|0.0|0.0|0.0|0.0|0.0|0.0|0.0|0.0|0.0|0.3743259753831141|0.0|0.0|0.0|0.0|0.0|0.0|0.0|0.0|0.0|0.0|0.0|0.0|0.0|0.0|0.0|0.0|0.0|0.0|0.0|0.0|0.0|0.0|0.0|0.0|0.23809865277803618|0.0|0.0|0.0|0.0|0.0|0.23809865277803618|0.0|0.0|0.0|0.0|0.0|0.0|0.0|0.0|0.0|0.0|0.0|0.0|0.0|0.0|0.0|0.0|0.0|0.0|0.0|0.0|0.0|0.0|0.0|0.0|0.0|0.0|0.0|0.0|0.0|0.0|0.0|0.0|0.0|0.0|0.0|0.0|0.0
2013_073410|semvalorlegal|Other Bonuses| a)  Sempre que ocorrer promoção, a mesma deverá ser comunicada por escrito ao empregado e obrigatoriamente anotada na CTPS. b)    A toda promoção para função sem paradigma será garantido reajuste salarial, de acordo com a política de salários, de cada empresa, respeitando aumento mínimo de 10% (dez por cento). c)   Havendo paradigma, será garantido o menor salário da função. d)    O aumento por promoção não será compensado nem deduzido por ocasião da primeira data-base subseqüente, garantido-se à empresa o direito de compensar reajustes espontâneos e antecipações havidas entre a data-base passada e a data da promoção. |ocorrer promoção mesmo comunicar escrito empregado obrigatoriamente anotar ctps b promoção função paradigma ser garantir reajuste salarial acordo política salário empresa respeitar aumento mínimo c havendo paradigma ser garantir salário função d aumento promoção ser compensar deduzer ocasião subseqüente empresa direito compensar reajuste espontâneo antecipação havir passado data promoção|0.0|0.0|0.0|0.0|0.09382022338162808|0.0|0.0|0.0|0.0|0.0|0.0|0.0|0.0|0.12785216519860398|0.0|0.0|0.0|0.0|0.12785216519860398|0.0|0.0|0.0|0.0|0.0|0.0|0.0|0.0|0.0|0.0|0.0|0.0|0.0|0.0|0.0|0.0|0.25570433039720797|0.0|0.0|0.0|0.0|0.0|0.0|0.0|0.0|0.0|0.0|0.0|0.0|0.0|0.0|0.0|0.0|0.0|0.0|0.0|0.0|0.0|0.0|0.0|0.0|0.0|0.0|0.0|0.0|0.0|0.0|0.22558558208306256|0.0|0.0|0.0|0.0|0.0|0.0|0.0|0.12785216519860398|0.0|0.0|0.0|0.0|0.0|0.0|0.0|0.0|0.0|0.0|0.0|0.0|0.0|0.0|0.0|0.0|0.0|0.0|0.0|0.0|0.0|0.0|0.0|0.12785216519860398|0.0|0.0|0.0|0.0|0.0|0.0|0.0|0.12785216519860398|0.0|0.12785216519860398|0.0|0.0|0.0|0.0|0.0|0.0|0.0|0.0|0.0|0.0|0.0|0.0|0.0|0.0|0.0|0.0|0.10210799503640189|0.0|0.0|0.0|0.0|0.0|0.0|0.0|0.0|0.0|0.05557914237945743|0.0|0.0|0.0|0.10603335812470657|0.0|0.0|0.0|0.0|0.0|0.12785216519860398|0.0|0.12785216519860398|0.0|0.0|0.0|0.0|0.0|0.0|0.0|0.0|0.0|0.0|0.0|0.0|0.0|0.0|0.0|0.0|0.0|0.0|0.0|0.0|0.0|0.0|0.0|0.0|0.0|0.22558558208306256|0.0|0.0|0.20421599007280378|0.0|0.0|0.0|0.12785216519860398|0.0|0.12785216519860398|0.0|0.0|0.0|0.0|0.0|0.0|0.0|0.0|0.0|0.0|0.0|0.0|0.0|0.0|0.0|0.0|0.0|0.0|0.0|0.0|0.0|0.0|0.0|0.0|0.0|0.0|0.0|0.0|0.0|0.0|0.0|0.0|0.0|0.0|0.0|0.0|0.0|0.0|0.0|0.0|0.0|0.0|0.0|0.0|0.0|0.0|0.0|0.0|0.08704862087932919|0.0|0.0|0.0|0.0|0.0|0.0|0.0|0.0|0.0|0.12785216519860398|0.0|0.0|0.0|0.0|0.0|0.0|0.0|0.0|0.0|0.0|0.0|0.0|0.11279279104153128|0.12785216519860398|0.11279279104153128|0.0|0.0|0.0|0.0|0.0|0.0|0.0|0.0|0.0|0.25570433039720797|0.0|0.0|0.0|0.12785216519860398|0.0|0.0|0.0|0.0|0.0|0.0|0.0|0.0|0.0|0.12785216519860398|0.0|0.0|0.0|0.0|0.0|0.0|0.0|0.0|0.0|0.0|0.0|0.0|0.0|0.0|0.0|0.0|0.5114086607944159|0.0|0.0|0.0|0.0|0.0|0.0|0.0|0.0|0.0|0.0|0.0|0.0|0.0|0.0|0.25570433039720797|0.0|0.0|0.0|0.0|0.0|0.0|0.0|0.0|0.0|0.0|0.0|0.0|0.0|0.0|0.0|0.0|0.0|0.12785216519860398|0.0|0.0|0.10210799503640189|0.0|0.16264662508331904|0.0|0.0|0.0|0.18391335215138124|0.0|0.0|0.0|0.0|0.0|0.0|0.0|0.12785216519860398|0.0|0.0|0.0|0.0|0.0|0.0|0.0|0.0|0.0|0.0|0.0|0.0|0.0|0.0|0.0|0.0|0.0|0.0|0.0|0.0|0.0|0.0|0.0|0.0|0.0|0.0|0.0|0.0|0.0|0.0|0.0
2010_074884|carimbo|Other Bonuses|As partes recomendam que sejam tomadas providencias para que seja concedida aos empregados com contrato de trabalho na vigência do presente acordo, assistência médica, assistência odontológica (extensiva aos dependentes considerados conforme critérios de elegibilidade atualmente vigente na empresa), vale refeição, seguro de vida em grupo e vale transporte, cabendo à empresa a sistemática e o modelo de administração dos benefícios mencionados. PARÁGRAFO ÚNICO - Nenhum dos benefícios acima mencionados tem cunho salarial para qualquer fim ou efeito.|parte recomendar ser tomar providencia ser conceder empregado contrato trabalho vigência presente acordo assistência médico assistência odontológico extensivo dependente considerar conforme critério elegibilidade atualmente vigente empresa valer refeição seguro vida vale transporte caber empresa sistemática modelo administração benefício mencionar parágrafo único nenhum benefício acima mencionado cunho salarial efeito|0.0|0.0|0.0|0.13530791616168056|0.1125481407310615|0.0|0.1533733662412188|0.0|0.0|0.0|0.0|0.0|0.0|0.0|0.0|0.0|0.0|0.0|0.0|0.0|0.0|0.0|0.0|0.0|0.0|0.0|0.0|0.0|0.0|0.3067467324824376|0.0|0.0|0.0|0.1533733662412188|0.0|0.0|0.0|0.0|0.0|0.0|0.2706158323233611|0.0|0.0|0.1533733662412188|0.0|0.0|0.0|0.0|0.0|0.0|0.0|0.0|0.0|0.0|0.0|0.0|0.0|0.0|0.0|0.0|0.0|0.0|0.0|0.0|0.0|0.0|0.0|0.0|0.0|0.0|0.0|0.0|0.0|0.0|0.0|0.0|0.13530791616168056|0.0|0.0|0.0|0.0|0.13530791616168056|0.1533733662412188|0.0|0.0|0.0|0.0|0.0|0.0|0.13530791616168056|0.0|0.0|0.0|0.0|0.0|0.0|0.1533733662412188|0.0|0.0|0.0|0.0|0.0|0.1533733662412188|0.0|0.0|0.0|0.0|0.0|0.0|0.0|0.0|0.13530791616168056|0.0|0.0|0.0|0.0|0.0|0.0|0.0|0.0|0.0|0.0|0.0|0.0|0.0|0.0|0.0|0.0|0.0|0.0|0.0|0.13530791616168056|0.0|0.1533733662412188|0.0|0.06667356901070648|0.0|0.0|0.0|0.1271991995144131|0.0|0.0|0.0|0.0|0.0|0.0|0.0|0.0|0.0|0.0|0.0|0.0|0.0|0.0|0.1533733662412188|0.0|0.0|0.0|0.0|0.0|0.0|0.0|0.0|0.0|0.0|0.0|0.0|0.0|0.0|0.0|0.0|0.0|0.0|0.0|0.0|0.0|0.0|0.0|0.0|0.0|0.0|0.0|0.0|0.0|0.0|0.0|0.0|0.0|0.0|0.0|0.0|0.0|0.0|0.0|0.0|0.0|0.0|0.0|0.0|0.0|0.0|0.0|0.0|0.0|0.0|0.0|0.0|0.0|0.0|0.0|0.0|0.0|0.0|0.0|0.0|0.0|0.0|0.0|0.0|0.0|0.0|0.0|0.0|0.0|0.0|0.1533733662412188|0.1533733662412188|0.0|0.0|0.0|0.0|0.0|0.0|0.0|0.0|0.0|0.1533733662412188|0.0|0.0|0.0|0.1533733662412188|0.0|0.0|0.0|0.0|0.1533733662412188|0.0|0.0|0.0|0.0|0.0|0.0|0.0|0.0|0.0|0.0|0.0|0.1533733662412188|0.0|0.0|0.0|0.0|0.0|0.0|0.0|0.0|0.0|0.0|0.1125481407310615|0.10442482526736387|0.0|0.0|0.0|0.0|0.0|0.0|0.0|0.0|0.0|0.0|0.0|0.0|0.0|0.0|0.0|0.0|0.0|0.1125481407310615|0.0|0.0|0.0|0.0|0.0|0.0|0.0|0.0|0.0|0.0|0.0|0.0|0.0|0.1533733662412188|0.0|0.0|0.0|0.0|0.0|0.0|0.0|0.0|0.0|0.0|0.0|0.0|0.0|0.0|0.0|0.0|0.0|0.1533733662412188|0.13530791616168056|0.0|0.0|0.0|0.0|0.0|0.0|0.0|0.0|0.0|0.0|0.0|0.0|0.12249027534690211|0.0|0.0|0.0|0.0|0.1533733662412188|0.14708346874609435|0.0|0.0|0.0|0.0|0.0|0.1533733662412188|0.0|0.0|0.0|0.0|0.0|0.0|0.0|0.0|0.0|0.0|0.1533733662412188|0.0|0.0|0.0|0.0|0.10442482526736387|0.0|0.13530791616168056|0.0|0.0|0.0|0.0|0.0|0.13530791616168056|0.1533733662412188|0.0|0.0|0.0|0.1533733662412188|0.0|0.1533733662412188|0.13530791616168056|0.12249027534690211
2014_038173|carimbo|Other Bonuses|A empresa se compromete a remunerar em dobro o trabalho realizado nos domingos e feriados que não tenham sido compensados.|empresa comprometar remunerar dobro trabalho realizar domingo feriado ter ser compensar|0.0|0.0|0.0|0.0|0.0|0.0|0.0|0.0|0.0|0.0|0.0|0.0|0.0|0.0|0.0|0.0|0.0|0.0|0.0|0.0|0.0|0.0|0.0|0.0|0.0|0.0|0.0|0.0|0.0|0.0|0.0|0.0|0.0|0.0|0.0|0.0|0.0|0.0|0.0|0.0|0.0|0.0|0.0|0.0|0.0|0.0|0.0|0.0|0.0|0.0|0.0|0.0|0.0|0.0|0.0|0.0|0.0|0.0|0.0|0.0|0.0|0.0|0.0|0.0|0.0|0.0|0.32482082157637915|0.0|0.0|0.0|0.3681888262241701|0.0|0.0|0.0|0.0|0.0|0.0|0.0|0.0|0.0|0.0|0.0|0.0|0.0|0.0|0.0|0.0|0.0|0.0|0.0|0.0|0.0|0.0|0.0|0.0|0.0|0.0|0.0|0.0|0.0|0.0|0.0|0.0|0.0|0.0|0.0|0.0|0.0|0.0|0.0|0.0|0.0|0.0|0.0|0.0|0.0|0.0|0.0|0.0|0.0|0.0|0.0|0.0|0.0|0.0|0.0|0.0|0.3681888262241701|0.0|0.32482082157637915|0.0|0.0|0.0|0.0|0.0|0.0|0.0|0.0|0.0|0.15267749907832248|0.0|0.0|0.0|0.0|0.0|0.0|0.0|0.0|0.0|0.0|0.0|0.0|0.0|0.0|0.0|0.0|0.0|0.0|0.0|0.0|0.32482082157637915|0.0|0.0|0.0|0.0|0.0|0.0|0.0|0.0|0.0|0.0|0.0|0.0|0.0|0.0|0.0|0.0|0.0|0.0|0.0|0.0|0.0|0.0|0.0|0.0|0.0|0.0|0.0|0.0|0.0|0.0|0.0|0.0|0.0|0.0|0.0|0.0|0.0|0.0|0.0|0.0|0.0|0.0|0.0|0.0|0.0|0.0|0.0|0.0|0.0|0.0|0.0|0.0|0.0|0.0|0.0|0.0|0.0|0.0|0.0|0.0|0.0|0.0|0.0|0.0|0.0|0.0|0.0|0.0|0.0|0.0|0.0|0.0|0.0|0.0|0.0|0.0|0.0|0.0|0.0|0.0|0.0|0.0|0.0|0.0|0.0|0.0|0.0|0.0|0.0|0.0|0.0|0.0|0.0|0.0|0.0|0.0|0.0|0.0|0.0|0.0|0.0|0.0|0.0|0.0|0.0|0.0|0.0|0.0|0.0|0.0|0.0|0.0|0.0|0.0|0.0|0.0|0.0|0.0|0.0|0.0|0.0|0.0|0.0|0.0|0.0|0.0|0.0|0.0|0.0|0.0|0.0|0.0|0.0|0.0|0.0|0.0|0.0|0.0|0.0|0.0|0.0|0.0|0.0|0.0|0.0|0.0|0.0|0.0|0.0|0.0|0.0|0.0|0.0|0.294050732595389|0.0|0.0|0.0|0.0|0.0|0.0|0.0|0.0|0.0|0.3681888262241701|0.0|0.0|0.0|0.0|0.0|0.0|0.0|0.0|0.0|0.0|0.0|0.0|0.0|0.0|0.17654463431881687|0.0|0.0|0.0|0.0|0.0|0.0|0.0|0.0|0.0|0.0|0.0|0.0|0.2701835973548946|0.0|0.0|0.0|0.0|0.0|0.0|0.0|0.0|0.250682727947598|0.0|0.0|0.0|0.0|0.0|0.0|0.0|0.0|0.0|0.0|0.0|0.0|0.0|0.0|0.0|0.0|0.0
2016_082062|semvalorlegal|Other Bonuses|INDENIZAÇÃO DE QUEBRA DE CAIXA: O empregado que exercer as funções de caixa terá direito à indenização por “quebra-de-caixa” mensal, no valor de R$ 66,00 (sessenta e seis reais), a partir de 01 de setembro de 2016.  Parágrafo 1º - A conferência dos valores do caixa será sempre realizada na presença do respectivo operador e, se houver impedimento por parte da empresa, ficará aquele isento de qualquer responsabilidade.  Parágrafo 2º - As empresas que não descontam de seus empregados as eventuais diferenças de caixa não estão sujeitas ao pagamento da indenização por “quebra-de-caixa” prevista no “caput” desta cláusula.  |indenização quebra caixa empregado exercer função caixa ter direito indenização mensal sessenta real setembro parágrafo conferência valor caixa ser realizar presença respectivo operador haver impedimento empresa ficar isento responsabilidade parágrafo empresa descontar empregado eventual diferença caixa sujeitas pagamento indenização prever caput cláusula|0.0|0.0|0.0|0.0|0.0|0.0|0.0|0.0|0.0|0.0|0.0|0.0|0.0|0.0|0.0|0.0|0.0|0.0|0.0|0.0|0.0|0.0|0.0|0.0|0.0|0.0|0.0|0.0|0.0|0.0|0.0|0.0|0.0|0.0|0.0|0.0|0.0|0.0|0.0|0.0|0.0|0.0|0.0|0.0|0.5225697876973776|0.0|0.0|0.1306424469243444|0.0|0.0|0.0|0.0|0.0|0.0|0.0|0.0|0.0|0.0|0.0|0.0|0.0|0.0|0.1306424469243444|0.0|0.0|0.0|0.0|0.0|0.0|0.0|0.0|0.0|0.0|0.0|0.0|0.0|0.0|0.0|0.0|0.0|0.148084993303969|0.0|0.0|0.0|0.0|0.0|0.0|0.0|0.0|0.0|0.0|0.0|0.0|0.0|0.0|0.0|0.0|0.0|0.0|0.0|0.0|0.0|0.0|0.0|0.0|0.0|0.0|0.0|0.0|0.0|0.0|0.0|0.0|0.0|0.0|0.1306424469243444|0.0|0.0|0.0|0.0|0.0|0.0|0.0|0.0|0.148084993303969|0.1182667633180793|0.0|0.0|0.0|0.0|0.0|0.0|0.0|0.0|0.0|0.12874927717207185|0.0|0.0|0.0|0.12281332196058864|0.0|0.0|0.0|0.0|0.0|0.0|0.0|0.0|0.0|0.0|0.0|0.148084993303969|0.0|0.148084993303969|0.0|0.0|0.0|0.0|0.0|0.0|0.0|0.0|0.0|0.0941928685719256|0.0|0.0|0.0|0.0|0.0|0.0|0.0|0.0|0.0|0.1306424469243444|0.0|0.0|0.0|0.0|0.0|0.0|0.0|0.1306424469243444|0.0|0.0|0.0|0.0|0.0|0.0|0.148084993303969|0.0|0.0|0.0|0.0|0.0|0.39192734077303315|0.0|0.0|0.0|0.0|0.0|0.0|0.0|0.0|0.0|0.0|0.0|0.148084993303969|0.0|0.0|0.0|0.0|0.0|0.0|0.0|0.0|0.0|0.0|0.0|0.0|0.0|0.0|0.0|0.0|0.0|0.0|0.0|0.0|0.1182667633180793|0.0|0.0|0.0|0.0|0.0|0.0|0.0|0.0|0.0|0.0|0.0|0.0|0.0|0.0|0.0|0.0|0.0|0.0|0.0|0.0|0.0|0.0|0.0|0.0|0.0|0.0|0.0|0.0|0.0|0.0|0.0|0.1306424469243444|0.0|0.0|0.0|0.0|0.10866743734580861|0.0|0.0|0.0|0.0|0.2016484338769094|0.0|0.0|0.0|0.0|0.0|0.0|0.0|0.0|0.0|0.0|0.0|0.0|0.0|0.0|0.0|0.0|0.0|0.0|0.148084993303969|0.0|0.1182667633180793|0.0|0.0|0.0|0.0|0.0|0.0|0.0|0.0|0.0|0.0|0.0|0.0|0.0|0.0|0.0|0.0|0.0|0.0|0.148084993303969|0.0|0.0|0.0|0.08844853333218959|0.1182667633180793|0.0|0.0|0.0|0.0|0.0|0.0|0.0|0.0|0.0|0.0|0.0|0.0|0.0|0.0|0.1306424469243444|0.0|0.148084993303969|0.0|0.0|0.0|0.0|0.0|0.0|0.0|0.071005986952565|0.0|0.0|0.148084993303969|0.148084993303969|0.0|0.0|0.0|0.0|0.148084993303969|0.0|0.0|0.0|0.10866743734580861|0.0|0.0|0.0|0.0|0.0|0.0|0.0|0.0|0.0|0.0|0.0|0.0|0.0|0.0|0.0|0.0|0.0|0.0|0.1306424469243444|0.0|0.0|0.0|0.0|0.0|0.0|0.0
