|contract_id|title|text|clean_text
0|2016_082054|Wage Fairness|"SALÁRIO SUBSTITUIÇÃO  A) A partir do 10º (décimo) dia de substituição que tenha caráter eventual, o empregado substituto passará a perceber o mesmo salário do substituído, excluídas as substituições dos cargos de Chefia, a menos que estas se prolonguem por período superior a 30 (trinta) dias;  B) Substituição superior a 60 (sessenta) dias consecutivos acarretará a efetivação na função, aplicando-se à hipótese, a cláusula 35 - ""PROMOÇÕES"";  C) Não se aplica a garantia da letra ""B"" acima, quando o substituído estiver sob amparo da Previdência Social.  D) Entretanto, se a substituição ultrapassar a 30 (trinta) dias, aplicar-se-á o disposto na letra ""A"" supra.  "|salário substituição a a partir do 10º décimo dia de substituição que tenha caráter eventual o empregado substituto passará a perceber o mesmo salário do substituído excluídas as substituições dos cargos de chefia a menos que estas se prolonguem por período superior a 30 trinta dias b substituição superior a 60 sessenta dias consecutivos acarretará a efetivação na função aplicando-se à hipótese a cláusula 35 promoções c não se aplica a garantia da letra b acima quando o substituído estiver sob amparo da previdência social d entretanto se a substituição ultrapassar a 30 trinta dias aplicar-se-á o disposto na letra a supra 
1|2016_082054|Profit Sharing| Recomenda-se à empresa na hipótese de implantar PLR (Programa de Lucros e Resultados), que observe o disposto na Lei nº 10.101/2000, principalmente no que se refere a planos de metas e objetivos.  | recomenda-se à empresa na hipótese de implantar plr programa de lucros e resultados que observe o disposto na lei nº 10101/2000 principalmente no que se refere a planos de metas e objetivos 
2|2016_082084|Wage Fairness|1. Todo empregado, qualificado ou não qualificado, que substitua em caráter definitivo um profissional, deverá ter sua carteira profissional classificada. Também deverá perceber o salário igual ao do empregado de menor salário na mesma função, desconsiderando as vantagens pessoais, salvo se instituído por parte da empresa quadro de carreira aprovado, após o prazo de 45 (quarenta e cinco) dias de substituição, respeitando-se as disposições da Súmula 159 do TST. Considera-se substituição temporária toda aquela em que o empregado substitui outro ciente de seu retorno à sua função efetiva, como nos casos de férias, excetuando-se as substituições eventuais de qualquer natureza.  2. Nas hipóteses de cargos de supervisão e comando, assim entendidos aqueles que, por delegação da gerência, possuem poder de mando na seção, o prazo a que alude o item 1 supra, será de 90 (noventa) dias.  3. No caso de admissão ou promoção ao empregado para a mesma função de outro empregado demitido sem justa causa, fica assegurado o pagamento de salário igual ao do empregado de menor salário na mesma função, desconsiderando vantagens pessoais, salvo se instituído, por parte da empresa, quadro de carreira aprovado. |1todo empregado qualificado ou não qualificado que substitua em caráter definitivo um profissional deverá ter sua carteira profissional classificadatambém deverá perceber o salário igual ao do empregado de menor salário na mesma função desconsiderando as vantagens pessoais salvo se instituído por parte da empresa quadro de carreira aprovado após o prazo de 45 quarenta e cinco dias de substituição respeitando-se as disposições da súmula 159 do tstconsidera-se substituição temporária toda aquela em que o empregado substitui outro ciente de seu retorno à sua função efetiva como nos casos de férias excetuando-se as substituições eventuais de qualquer natureza 2nas hipóteses de cargos de supervisão e comando assim entendidos aqueles que por delegação da gerência possuem poder de mando na seção o prazo a que alude o item 1 supra será de 90 noventa dias 3no caso de admissão ou promoção ao empregado para a mesma função de outro empregado demitido sem justa causa fica assegurado o pagamento de salário igual ao do empregado de menor salário na mesma função desconsiderando vantagens pessoais salvo se instituído por parte da empresa quadro de carreira aprovado
3|2016_082084|Equality of Opportunities|1. A empresa procurará preencher as vagas existentes no seu quadro de pessoal prioritariamente, por via de seleção interna, garantindo-se a participação de todos os interessados, ressalvadas determinadas funções técnicas ou de confiança. |1a empresa procurará preencher as vagas existentes no seu quadro de pessoal prioritariamente por via de seleção interna garantindo-se a participação de todos os interessados ressalvadas determinadas funções técnicas ou de confiança
4|2009_016731|Profit Sharing|O presente acordo Coletivo de Trabalho tem por finalidade estabelecer condições específicas para o Programa de Participações nos Lucros ou Resultados (PLR) das obras da indústria da construção civil pesada executadas no Estado do Ceará. |o presente acordo coletivo de trabalho tem por finalidade estabelecer condições específicas para o programa de participações nos lucros ou resultados plr das obras da indústria da construção civil pesada executadas no estado do ceará
5|2009_016731|Profit Sharing|Os períodos de aferição, que credenciam a participação do empregado nos lucros ou resultados, será o da vigência do presente ACORDO COLETIVO DE TRABALHO, ou seja, de 01/01/2009 á 31/12/2010, os pagamentos, pela  empresa RG2 TERRAPLENAGEM LTDA, relativo ao primeiro período de 2009 (01/01/2009 á 30/06/2009), será efetuado  no último dia útil do mês de Agosto de 2009, já o segundo período de 2009 (01/07/2009 á 31/12/2009), será pago no último dia útil do mês de Fevereiro de 2010, enquanto que o ano de 2010 será pago da seguinte forma:  primeiro período (01/01/2010 á 30/06/2010), será efetuado  no último dia útil do mês de Agosto de 2010, já o segundo período de 2010 (01/07/2010 á 31/12/2010), será pago no último dia útil do mês de Fevereiro de 2011.  3.2- O valor máximo para pagamento do PLR, para os empregados da mão de obra direta, cujas funções estão relacionadas, no anexo I (um), em cada período de aferição(um semestre), é de 40%(quarenta por cento) do salário base do empregado com 100% (cem por cento) de freqüência no período.  |os períodos de aferição que credenciam a participação do empregado nos lucros ou resultados será o da vigência do presente acordo coletivo de trabalho ou seja de 01/01/2009 á 31/12/2010 os pagamentos pela empresa rg2 terraplenagem ltda relativo ao primeiro período de 2009 01/01/2009 á 30/06/2009 será efetuado no último dia útil do mês de agosto de 2009 já o segundo período de 2009 01/07/2009 á 31/12/2009 será pago no último dia útil do mês de fevereiro de 2010 enquanto que o ano de 2010 será pago da seguinte forma: primeiro período 01/01/2010 á 30/06/2010 será efetuado no último dia útil do mês de agosto de 2010 já o segundo período de 2010 01/07/2010 á 31/12/2010 será pago no último dia útil do mês de fevereiro de 2011 32- o valor máximo para pagamento do plr para os empregados da mão de obra direta cujas funções estão relacionadas no anexo i um em cada período de aferiçãoum semestre é de 40%quarenta por cento do salário base do empregado com 100% cem por cento de freqüência no período 
6|2017_039341|Profit Sharing|As empresas que não possuírem programas próprios da PLR e, desde que seus balanços de 31/12/2016 apresentem lucros ou resultados e que tenham disponibilidade financeira, efetuarão até 30/06/2017 pagamento único de 90% (noventa por cento) sobre o salário-base resultante da Convenção Coletiva de Trabalho de 2017, acrescido do valor fixo de R$1.481,52 (mil quatrocentos e oitenta e um reais e cinquenta e dois centavos) aos empregados admitidos até 31/12/2015 e em efetivo exercício em 31 de dezembro de 2016, limitado ao valor máximo de R$10.998,00 (dez mil, novecentos e noventa e oito reais). Parágrafo Primeiro: O percentual, o valor fixo e o limite máximo convencionados no “caput” desta Cláusula, a título de PLR, observarão, em face do exercício de 2016, como teto, o percentual de 15% (quinze por cento) e, como mínimo, o percentual de 5% (cinco por cento) do lucro líquido da Empresa. Quando o total de PLR calculado pela regra básica do “caput” desta Cláusula for inferior a 5% (cinco por cento) do lucro líquido da Empresa, no exercício de 2016, o valor individual deverá ser majorado até alcançar 2,2 (dois vírgula dois) salários do empregado e limitado ao valor de R$23.627,90 (vinte e três mil seiscentos e vinte e sete reais e noventa centavos), ou até que o total da PLR atinja 5% (cinco por cento) do lucro líquido, o que ocorrer primeiro. Parágrafo Segundo: As Empresas que apresentaram prejuízo demonstrado no seu balanço de 31/12/2016 estão isentas do pagamento da PLR. Parágrafo Terceiro: As empresas que mesmo tendo lucros ou resultados no seu balanço de 31/12/2016 e não tiverem disponibilidade financeira para atender ao disposto “no caput” deverão comprovar documentalmente com os elementos que deram origem ao resultado final de seu balanço, junto ao sindicato dos empregados, até 30/06/2017. Parágrafo Quarto: Na falta da justificativa e dos comprovantes, na data de 30/06/2017, citados no parágrafo anterior, a empresa pagará a PLR, na forma prevista no “caput” desta cláusula. Parágrafo Quinto: Para os empregados admitidos até 31/12/2015, que se afastarem a partir de 01/01/2016, por doença, acidente do trabalho e ou auxílio maternidade, as Empresas efetuarão o pagamento integral da PLR de que trata esta Cláusula. Parágrafo Sexto: Para os empregados admitidos a partir de 01/01/2016, em efetivo exercício em 31 de dezembro de 2016, ou afastados por doença, acidente do trabalho e auxílio maternidade, as Empresas pagarão 1/12 (um doze avos) do valor estabelecido, por mês trabalhado ou fração igual ou superior a 15 dias. Aos afastados por doença, acidente do trabalho ou auxílio-maternidade, fica vedada a dedução do período de afastamento para cômputo da proporcionalidade. Parágrafo Sétimo: Para os empregados demitidos sem justa causa, entre 01/02/2016 e a data da assinatura da presente Convenção, as Empresas pagarão 1/12 (um doze avos) do valor estabelecido, por mês trabalhado em 2016 ou fração igual ou superior a 15 (quinze) dias. Parágrafo Oitavo: As Empresas que já possuírem programas próprios de PLR, que irão, ou poderão implantá-los até 30/06/2017, têm por cumprida a Lei nº. 10.101, de 19/12/2000 (DOU 20/12/2000) vigente sobre a matéria não estando, por conseguinte, obrigados às concessões previstas na presente Convenção. Parágrafo Nono: As Empresas que concederem entre julho/2016 e março/2017 a PLR de 2016 poderão compensar os valores pagos em decorrência deste instrumento ou, dar como cumprida a presente cláusula, desde que tenham sido pagos nos percentuais estabelecidos na presente Convenção. Parágrafo Décimo: A participação nos lucros ou resultados prevista nesta Convenção Coletiva de Trabalho refere-se ao exercício de 2016, tem caráter excepcional e transitório, atende ao disposto na Lei nº 10.101, de 19/12/2000 (DOU 20/12/2000), e não constitui base de incidência de nenhum encargo trabalhista ou previdenciário, por ser desvinculada da remuneração, não se lhe aplicando o principio da habitualidade, porém tributável para efeito de imposto de renda, conforme legislação em vigor. |as empresas que não possuírem programas próprios da plr e desde que seus balanços de 31/12/2016 apresentem lucros ou resultados e que tenham disponibilidade financeira efetuarão até 30/06/2017 pagamento único de 90% noventa por cento sobre o salário-base resultante da convenção coletiva de trabalho de 2017 acrescido do valor fixo de r$1481,52 mil quatrocentos e oitenta e um reais e cinquenta e dois centavos aos empregados admitidos até 31/12/2015 e em efetivo exercício em 31 de dezembro de 2016 limitado ao valor máximo de r$10998,00 dez mil novecentos e noventa e oito reaisparágrafo primeiro o percentual o valor fixo e o limite máximo convencionados no “caput” desta cláusula a título de plr observarão em face do exercício de 2016 como teto o percentual de 15% quinze por cento e como mínimo o percentual de 5% cinco por cento do lucro líquido da empresaquando o total de plr calculado pela regra básica do “caput” desta cláusula for inferior a 5% cinco por cento do lucro líquido da empresa no exercício de 2016 o valor individual deverá ser majorado até alcançar 2,2 dois vírgula dois salários do empregado e limitado ao valor de r$23627,90 vinte e três mil seiscentos e vinte e sete reais e noventa centavos ou até que o total da plr atinja 5% cinco por cento do lucro líquido o que ocorrer primeiroparágrafo segundo as empresas que apresentaram prejuízo demonstrado no seu balanço de 31/12/2016 estão isentas do pagamento da plrparágrafo terceiro as empresas que mesmo tendo lucros ou resultados no seu balanço de 31/12/2016 e não tiverem disponibilidade financeira para atender ao disposto “no caput” deverão comprovar documentalmente com os elementos que deram origem ao resultado final de seu balanço junto ao sindicato dos empregados até 30/06/2017parágrafo quarto na falta da justificativa e dos comprovantes na data de 30/06/2017 citados no parágrafo anterior a empresa pagará a plr na forma prevista no “caput” desta cláusulaparágrafo quinto para os empregados admitidos até 31/12/2015 que se afastarem a partir de 01/01/2016 por doença acidente do trabalho e ou auxílio maternidade as empresas efetuarão o pagamento integral da plr de que trata esta cláusulaparágrafo sexto para os empregados admitidos a partir de 01/01/2016 em efetivo exercício em 31 de dezembro de 2016 ou afastados por doença acidente do trabalho e auxílio maternidade as empresas pagarão 1/12 um doze avos do valor estabelecido por mês trabalhado ou fração igual ou superior a 15 diasaos afastados por doença acidente do trabalho ou auxílio-maternidade fica vedada a dedução do período de afastamento para cômputo da proporcionalidadeparágrafo sétimo para os empregados demitidos sem justa causa entre 01/02/2016 e a data da assinatura da presente convenção as empresas pagarão 1/12 um doze avos do valor estabelecido por mês trabalhado em 2016 ou fração igual ou superior a 15 quinze diasparágrafo oitavo as empresas que já possuírem programas próprios de plr que irão ou poderão implantá-los até 30/06/2017 têm por cumprida a lei nº10101 de 19/12/2000 dou 20/12/2000 vigente sobre a matéria não estando por conseguinte obrigados às concessões previstas na presente convençãoparágrafo nono as empresas que concederem entre julho/2016 e março/2017 a plr de 2016 poderão compensar os valores pagos em decorrência deste instrumento ou dar como cumprida a presente cláusula desde que tenham sido pagos nos percentuais estabelecidos na presente convençãoparágrafo décimo a participação nos lucros ou resultados prevista nesta convenção coletiva de trabalho refere-se ao exercício de 2016 tem caráter excepcional e transitório atende ao disposto na lei nº 10101 de 19/12/2000 dou 20/12/2000 e não constitui base de incidência de nenhum encargo trabalhista ou previdenciário por ser desvinculada da remuneração não se lhe aplicando o principio da habitualidade porém tributável para efeito de imposto de renda conforme legislação em vigor
7|2017_039341|Profit Sharing|As empresas pagarão independente dos valores estabelecidos na Cláusula de Participação dos Empregados nos Lucros e Resultados - Exercício de 2016 desta Convenção Coletiva de Trabalho, o Adicional de Participação nos Lucros ou Resultados que corresponde a 10% (dez por cento) da variação em valor absoluto do crescimento do lucro líquido do exercício de 2016, em relação ao lucro líquido do exercício de 2015, dividido entre os seus empregados em parcelas iguais, com limite individual de R$2.536,52 (dois mil, quinhentos e trinta e seis reais e cinquenta e dois centavos), observando-se as seguintes condições: a)       Esta parcela adicional não será compensável com valores devidos em razão de planos próprios. b)       A parcela adicional paga não será computada para cálculo do mínimo de 5% (cinco por cento) e do teto de 15% (quinze por cento) de distribuição da PLR. A parcela adicional não está sujeita, também, aos tetos estabelecidos, em valor, no “caput” e no parágrafo primeiro da cláusula quarta. c)        A empresa pagará, até o dia 30/06/2017, a parcela adicional de que trata a presente cláusula. d)       O empregado admitido até 31/12/2015 e que se afastou a partir de 01/01/2016, por doença, acidente do trabalho ou licença-maternidade, faz jus ao pagamento integral do valor decorrente de aplicação da presente cláusula. e)       Ao empregado admitido a partir de 01/01/2016, em efetivo exercício em 31/12/2016, mesmo que afastado por doença, acidente do trabalho ou licença-maternidade, será efetuado o pagamento de 1/12 (um doze avos) do valor estabelecido, por mês trabalhado ou fração igual ou superior a 15 (quinze) dias. Ao afastado por doença, acidente do trabalho ou auxílio-maternidade fica vedada a dedução do período de afastamento para cômputo da proporcionalidade. f)        Ao empregado que tenha sido ou venha a ser dispensado sem justa causa, entre 01/02/2016 e 31/12/2016, será devido o pagamento, até 30/06/2017, de 1/12 (um doze avos) do valor estabelecido no “caput”, por mês trabalhado, ou fração igual ou superior a 15 (quinze) dias. g)       A empresa que apresentar prejuízo no exercício de 2016 (balanço de 31/12/2016) estará isento do pagamento do Adicional de Participação nos Lucros ou Resultados. Parágrafo Único: O Adicional de Participação nos Lucros ou Resultados previsto nesta Cláusula refere-se ao exercício de 2016, atende ao disposto na Lei nº. 10.101, de 19/12/2000, não constitui base de incidência de nenhum encargo trabalhista ou previdenciário por ser desvinculada da remuneração, não se lhe aplicando o princípio da habitualidade, porém tributável para efeito de imposto de renda, conforme legislação em vigor. |as empresas pagarão independente dos valores estabelecidos na cláusula de participação dos empregados nos lucros e resultados exercício de 2016 desta convenção coletiva de trabalho o adicional de participação nos lucros ou resultados que corresponde a 10% dez por cento da variação em valor absoluto do crescimento do lucro líquido do exercício de 2016 em relação ao lucro líquido do exercício de 2015 dividido entre os seus empregados em parcelas iguais com limite individual de r$2536,52 dois mil quinhentos e trinta e seis reais e cinquenta e dois centavos observando-se as seguintes condições a esta parcela adicional não será compensável com valores devidos em razão de planos própriosb a parcela adicional paga não será computada para cálculo do mínimo de 5% cinco por cento e do teto de 15% quinze por cento de distribuição da plra parcela adicional não está sujeita também aos tetos estabelecidos em valor no “caput” e no parágrafo primeiro da cláusula quartac a empresa pagará até o dia 30/06/2017 a parcela adicional de que trata a presente cláusulad o empregado admitido até 31/12/2015 e que se afastou a partir de 01/01/2016 por doença acidente do trabalho ou licença-maternidade faz jus ao pagamento integral do valor decorrente de aplicação da presente cláusulae ao empregado admitido a partir de 01/01/2016 em efetivo exercício em 31/12/2016 mesmo que afastado por doença acidente do trabalho ou licença-maternidade será efetuado o pagamento de 1/12 um doze avos do valor estabelecido por mês trabalhado ou fração igual ou superior a 15 quinze diasao afastado por doença acidente do trabalho ou auxílio-maternidade fica vedada a dedução do período de afastamento para cômputo da proporcionalidadef ao empregado que tenha sido ou venha a ser dispensado sem justa causa entre 01/02/2016 e 31/12/2016 será devido o pagamento até 30/06/2017 de 1/12 um doze avos do valor estabelecido no “caput” por mês trabalhado ou fração igual ou superior a 15 quinze diasg a empresa que apresentar prejuízo no exercício de 2016 balanço de 31/12/2016 estará isento do pagamento do adicional de participação nos lucros ou resultadosparágrafo único o adicional de participação nos lucros ou resultados previsto nesta cláusula refere-se ao exercício de 2016 atende ao disposto na lei nº10101 de 19/12/2000 não constitui base de incidência de nenhum encargo trabalhista ou previdenciário por ser desvinculada da remuneração não se lhe aplicando o princípio da habitualidade porém tributável para efeito de imposto de renda conforme legislação em vigor
8|2009_034089|Profit Sharing|As normas coletivas do presente instrumento abrangem todos os empregados do Grupo INTELBRAS (Matriz e Filiais), excetuando-se estagiários e menores aprendizes, observando o seguinte:  a)     Só terão direito a participação estabelecida neste instrumento os empregados que tiverem cumprido uma carência de 90 dias após a data de admissão, mesmo que admitidos no semestre anterior;  b)     Os empregados que solicitarem demissão e os demitidos sem justa causa durante o período de apuração estabelecido pelo presente instrumento, receberão valor proporcional ao período trabalhado, que será liquidado na data de pagamento prevista ao término do semestre. Os demitidos com justa causa não terão direito a participação proporcional;  c)      Os empregados que estiverem afastados do trabalho por qualquer motivo durante o semestre, receberão a participação estabelecida neste instrumento conforme a seguinte regra: ·        Até 3 dias de afastamento: recebimento integral; ·        Acima de 3 dias: desconto proporcional de 1/180 (um cento e oitenta avos) para cada dia de afastamento; ·        Os valores descontados serão rateados proporcionalmente para todos os colaboradores. |as normas coletivas do presente instrumento abrangem todos os empregados do grupo intelbras matriz e filiais excetuando-se estagiários e menores aprendizes observando o seguinte a só terão direito a participação estabelecida neste instrumento os empregados que tiverem cumprido uma carência de 90 dias após a data de admissão mesmo que admitidos no semestre anterior b os empregados que solicitarem demissão e os demitidos sem justa causa durante o período de apuração estabelecido pelo presente instrumento receberão valor proporcional ao período trabalhado que será liquidado na data de pagamento prevista ao término do semestreos demitidos com justa causa não terão direito a participação proporcional c os empregados que estiverem afastados do trabalho por qualquer motivo durante o semestre receberão a participação estabelecida neste instrumento conforme a seguinte regra · até 3 dias de afastamento recebimento integral · acima de 3 dias desconto proporcional de 1/180 um cento e oitenta avos para cada dia de afastamento · os valores descontados serão rateados proporcionalmente para todos os colaboradores
9|2009_034089|Profit Sharing|Será apurada sobre o Lucro Líquido após o Imposto de Renda efetivamente pago. |será apurada sobre o lucro líquido após o imposto de renda efetivamente pago
10|2009_034089|Profit Sharing| O valor da Participação nos Lucros a ser distribuído aos empregados será calculado de acordo com as regras que serão definidas oportunamente em Termo Aditivo ao presente Acordo Coletivo, servindo o presente instrumento para fins de antecipação da Participação nos Lucros, a ser paga em 31 de julho de 2009.  A antecipação da Participação nos Lucros será equivalente a 24% (vinte e quatro por cento) do salário base dos Colaboradores referente ao mês de Junho/09, acrescido de médias de comissão e periculosidade.| o valor da participação nos lucros a ser distribuído aos empregados será calculado de acordo com as regras que serão definidas oportunamente em termo aditivo ao presente acordo coletivo servindo o presente instrumento para fins de antecipação da participação nos lucros a ser paga em 31 de julho de 2009 a antecipação da participação nos lucros será equivalente a 24% vinte e quatro por cento do salário base dos colaboradores referente ao mês de junho/09 acrescido de médias de comissão e periculosidade
