|contract_id|title|text|clean_text
11|2009_034089|Profit Sharing|a)     O pagamento da participação anual, descontado o adiantamento referente ao 1º semestre, ocorrerá após o término do exercício, em folha de pagamento especial e separada, devendo a data ser comunicada até 20 de janeiro de 2010.  b)     O pagamento será efetuado, devendo ocorrer no intervalo entre 31 de janeiro e 31 de março de 2010.  c)      O pagamento ocorrerá no dia 31 de janeiro de 2010, se o valor total não comprometer até 30% (trinta por cento) do saldo existente em caixa. Se for maior de 30%, ficará adiado para 28 de fevereiro ou para 31 de março de 2010. |a o pagamento da participação anual descontado o adiantamento referente ao 1º semestre ocorrerá após o término do exercício em folha de pagamento especial e separada devendo a data ser comunicada até 20 de janeiro de 2010 b o pagamento será efetuado devendo ocorrer no intervalo entre 31 de janeiro e 31 de março de 2010 c o pagamento ocorrerá no dia 31 de janeiro de 2010 se o valor total não comprometer até 30% trinta por cento do saldo existente em caixase for maior de 30% ficará adiado para 28 de fevereiro ou para 31 de março de 2010
12|2009_034089|Profit Sharing|Serão efetuadas reuniões mensais de avaliação entre a Diretoria e a COMISSÃO DOS EMPREGADOS, visando debater e acompanhar a evolução dos resultados alcançados em comparação como o Orçamento. |serão efetuadas reuniões mensais de avaliação entre a diretoria e a comissão dos empregados visando debater e acompanhar a evolução dos resultados alcançados em comparação como o orçamento
13|2012_042462|Profit Sharing|a)                   Nos termos do artigo 2º da Lei 10.101 de 19/12/2000, as Empresas pertencentes a categoria econômica convenente poderão instituir programa de participação nos lucros e resultados, devendo arquivar cópia do respectivo instrumento junto ao Sindicato dos Trabalhadores, em até 15 (quinze) dias após sua formalização. b)                  O instrumento de implantação do programa deverá observar o referido dispositivo legal, bem como delimitar com precisão os Empregados envolvidos no programa. |a nos termos do artigo 2º da lei 10101 de 19/12/2000 as empresas pertencentes a categoria econômica convenente poderão instituir programa de participação nos lucros e resultados devendo arquivar cópia do respectivo instrumento junto ao sindicato dos trabalhadores em até 15 quinze dias após sua formalizaçãob o instrumento de implantação do programa deverá observar o referido dispositivo legal bem como delimitar com precisão os empregados envolvidos no programa
14|2016_082062|Profit Sharing|PARTICIPAÇÃO DOS TRABALHADORES NOS LUCROS OU RESULTADOS: As empresas abrangidas por esta Convenção Coletiva de Trabalho que, na medida de suas possibilidades e critério de administração, desejarem negociar com seus empregados a participação nos lucros ou resultados, na forma prevista na Lei 10.101/2000, deverão valer-se da assessoria de suas respectivas entidades sindicais, que constituirão comissão intersindical para oferecer orientação e apoio na implantação do programa. |participação dos trabalhadores nos lucros ou resultados as empresas abrangidas por esta convenção coletiva de trabalho que na medida de suas possibilidades e critério de administração desejarem negociar com seus empregados a participação nos lucros ou resultados na forma prevista na lei 10101/2000 deverão valer-se da assessoria de suas respectivas entidades sindicais que constituirão comissão intersindical para oferecer orientação e apoio na implantação do programa
15|2015_043120|Profit Sharing|A empresa pagará a todos os empregados a título de P.L.R., o valor correspondente a 90% (cem por cento) do salário total. A titulo de P.L.R será paga em duas parcelas iguais de 45% (quarenta e cinco por cento) juntamente com as folhas de pagamento de NOVEMBRO/2015 e JANEIRO/2016. Empregados admitidos após 01/05/2015 receberão a P.L.R. proporcionalmente aos meses trabalhados. Ocorrendo a dispensa ou pedido de demissão do empregado, o saldo da P.L.R. deverá ser quitado juntamente com o Termo de Rescisão Contratual. PARÁGRAFO UNICO - A participação nos lucros e resultados, prevista neste Acordo Coletivo de Trabalho, refere-se ao período pactuado, tem caráter excepcional e transitório, atende ao disposto na Lei n° 10.101 de 19/12/2000, não constitui base de incidência de nenhum encargo trabalhista ou previdenciário, por ser desvinculada da remuneração, não se lhe aplicando o principio da habitualidade, porém tributável para efeito de imposto de renda conforme vigente. |a empresa pagará a todos os empregados a título de plr o valor correspondente a 90% cem por cento do salário totala titulo de plr será paga em duas parcelas iguais de 45% quarenta e cinco por cento juntamente com as folhas de pagamento de novembro/2015 e janeiro/2016empregados admitidos após 01/05/2015 receberão a plrproporcionalmente aos meses trabalhadosocorrendo a dispensa ou pedido de demissão do empregado o saldo da plrdeverá ser quitado juntamente com o termo de rescisão contratualparágrafo unico a participação nos lucros e resultados prevista neste acordo coletivo de trabalho refere-se ao período pactuado tem caráter excepcional e transitório atende ao disposto na lei n° 10101 de 19/12/2000 não constitui base de incidência de nenhum encargo trabalhista ou previdenciário por ser desvinculada da remuneração não se lhe aplicando o principio da habitualidade porém tributável para efeito de imposto de renda conforme vigente
16|2015_043120|Equality of Opportunities|A empresa procurará preencher as vagas existentes no seu quadro de pessoal, ressalvadas determinadas funções técnicas ou de confiança, prioritariamente, por via de seleção interna, garantindo-se a participação de todos interessados.  |a empresa procurará preencher as vagas existentes no seu quadro de pessoal ressalvadas determinadas funções técnicas ou de confiança prioritariamente por via de seleção interna garantindo-se a participação de todos interessados 
17|2012_032551|Profit Sharing|A empresa pagará a todos os seus empregados representados por esta entidade, a título de PLR, a importância de R$ 300,00 (Trezentos Reais) em 02 (duas) parcelas de R$ 150,00 (Cento e Cinqüenta Reais), devendo a primeira ser paga competência Setembro/2012 e a segunda em Março/2013.  PARÁGRAFO ÚNICO  O benefício acima deverá considerar para o seu pagamento a proporcionalidade quanto a data de admissão e demissão. |a empresa pagará a todos os seus empregados representados por esta entidade a título de plr a importância de r$ 300,00 trezentos reais em 02 duas parcelas de r$ 150,00 cento e cinqüenta reais devendo a primeira ser paga competência setembro/2012 e a segunda em março/2013 parágrafo único o benefício acima deverá considerar para o seu pagamento a proporcionalidade quanto a data de admissão e demissão
