contract_id|title|text|clean_text
2016_082054|Subsistence Allowance|DIÁRIAS  Caso ocorra prestação de serviços externos que resulte ao empregado despesas superiores às habituais no que se refere a transporte, estadia e alimentação e, desde que tais despesas não estejam anteriormente contratadas, a empresa reembolsará a diferença que for comprovada.  |diár cas ocorr prestaçã servic extern result empreg despes superior habitu refer transport estad aliment desd tais despes anterior contrat empres reembols diferenc comprov
2012_002993|Food Assistance|O empregador fica obrigado a conceder ao empregado, um valor de R$ 12,00 (doze reais), em vale refeição ou a seu critério. (E expressamente vedado ao empregador substituí-lo por antecipação em dinheiro). O empregador pagará as diferenças de abono refeição em 03 (três) parcelas, a contar do próximo pagamento.|empreg fic obrig conced empreg valor r doz rea val refeiçã critéri express ved empreg substituíl antecip dinheir empreg pag diferenc abon refeiçã três parcel cont próxim pagament
2012_002993|Transportation Assistance| O empregador se compromete a efetuar o desconto relativo ao vale transporte, estabelecido pela Lei 7.418/85 e regulamentada pelo Decreto 95.247/87 de até no máximo 6% (seis por cento), e, é expressamente vedado ao empregador substituí-lo por antecipação em dinheiro, artigo 5 do Decreto 95.247/87. |empreg compromet efetu descont relat val transport estabelec lei regulament decret máxim seis cent express ved empreg substituíl antecip dinheir artig decret
2012_002943|Transportation Assistance|Fica o empregador obrigado a fornecer o transporte a seus empregados por meio próprios ou mediante vale transporte de acordo com a lei nº 7418, de 16/12/85, entre o local de sua residência e o local de trabalho e vice-versa. PARÁGRAFO ÚMICO - A empresa que tem transporte próprio fornecerá ônibus gratuito para todos trabalhadores de ida e volta. |fic empreg obrig fornec transport empreg mei própri mediant val transport acord lei nº local resident local trabalh vicevers parágraf úmic empres transport própri fornec ônibus gratuit tod trabalh ida volt
2016_082084|Subsistence Allowance|1. Fica assegurada aos empregados que executem serviços externos uma ajuda de custo compatível com as despesas decorrentes de tal trabalho externo (transporte, alimentação, hospedagem, etc.), ressaltando-se que a respectiva verba se destina, exclusivamente, a ressarcimento de despesas comprovadas, não configurando natureza salarial para fins trabalhistas, previdenciários e/ou tributários. Caso a empresa opte pelo pagamento de diárias, não haverá vinculação com as despesas realizadas.  2. Com relação aos serviços externos prestados, fica assegurado ao empregado o retorno para sua residência com a seguinte periodicidade: a cada 15 (quinze) dias para locais que distem até 300 (trezentos) quilômetros do município da empresa; a cada 30 (trinta) dias para locais distantes entre 300 (trezentos) e 600 (seiscentos) quilômetros; a cada 90 (noventa) dias para locais situados entre 600 (seiscentos) e 2.500 (dois mil e quinhentos) quilômetros; e a cada 120 dias para distâncias superiores a 2.500 (dois mil e quinhentos) quilômetros. Esta regra aplica-se somente à prestação de serviços dentro do Brasil.  3. A obrigação constante do item 2 supra não é aplicável a empresas que adotem política compensatória pactuada com os seus empregados, tampouco às contratações que tenham como condição expressa a prestação de serviços externa.  4. Nas hipóteses de falecimento de cônjuge, filhos ou genitores, a empresa assegurará, sob as suas expensas, o retorno imediato do empregado, não se aplicando a regra prevista no item 2 supra.  |fic assegur empreg execut servic extern ajud cust compat despes decorrent tal trabalh extern transport aliment hospedag etc ressaltandos respect verb destin exclus ressarc despes comprov configur natur salarial fins trabalh previdenciári eou tributári cas empres opte pagament diár hav vincul despes realiz relaçã servic extern prest fic assegur empreg retorn resident seguint period cad quinz dias loc dist trezent quilômetr municípi empres cad trint dias loc distant trezent seiscent quilômetr cad novent dias loc situ seiscent dois mil quinhent quilômetr cad dias distânc superior dois mil quinhent quilômetr regr aplicas soment prestaçã servic dentr brasil obrig constant item supr aplic empres adot polít compensatór pactu empreg tampouc contrat condiçã express prestaçã servic extern hipótes falec cônjug filh genitor empres assegur sob expens retorn imediat empreg aplic regr previst item supr
2016_082084|Food Assistance|1. A empresa fica obrigada a manter local adequado para que seus empregados façam suas refeições, obedecidos os parâmetros legais.  2. Além do local para refeições, a empresa deverá conceder aos empregados uma refeição a preços acessíveis, mediante desconto em folha de pagamento, até o limite de 7,5% (sete e meio por cento) do valor do custo da refeição, não podendo ser servido almoço/refeição diverso do padrão da cultura local.  3. A empresa ofertará lanche gratuito ou a refeição que estiver sendo servida no horário, também gratuita, aos seus empregados que venham a trabalhar em mais de 01 (uma) hora extraordinária no dia.  4. O intervalo concedido decorrente do lanche, mencionado no item 3 acima, deverá obedecer o limite máximo de 15 (quinze) minutos, não sendo computado na composição da jornada de trabalho.  5. Os empregados que iniciarem suas jornadas até as 7h (sete horas), inclusive, farão jus ao café da manhã (desjejum) gratuito, sendo essa refeição composta de, pelo menos, pão, café e leite, sempre acompanhados de uma proteína (variada), além de inhame, macaxeira ou cuscuz.  6. Ficam preservadas as condições mais favoráveis hoje existentes. |empres fic obrig mant local adequ empreg fac refeiçõ obedec parâmetr leg além local refeiçõ empres dev conced empreg refeiçã prec acessív mediant descont folh pagament limit set mei cent valor cust refeiçã pod serv almoçorefeiçã divers padrã cultur local empres ofert lanch gratuit refeiçã send serv horári gratuit empreg venh trabalh hor extraordinár dia interval conced decorrent lanch mencion item acim dev obedec limit máxim quinz minut send comput composiçã jorn trabalh empreg inic jorn set hor inclusiv farã jus caf manhã desjejum gratuit send refeiçã compost men pã caf leit sempr acompanh proteín vari além inham macaxeir cuscuz fic preserv condiçõ favor hoj existent
2016_082084|Food Assistance| 1. A partir do mês de fevereiro de 2017, a empresaconcederá aos beneficiários mencionados no item 4 desta cláusula um conjunto de gêneros alimentícios denominado “Nossa Feira”, através do sistema de Programa de Alimentação do Trabalhador (PAT). 2. A participação dos trabalhadores nos custos da “Nossa Feira”, mediante desconto na folha salarial, o que desde já fica autorizado, dependerá das faixas salariais, a saber: para os que percebem salário base de até R$ 4.300,00 (quatro mil e trezentos reais) o desconto será deR$ 10,00 (dez reais) por mês e para os que percebem salário base acima de R$ 4.300,00 (quatro mil e trezentos reais) o desconto será de R$ 28,00 (vinte e oito reais) por mês.  3. O conjunto de alimentos denominado “Nossa Feira” será composto de produtos essenciais para alimentação dos empregados e de seus familiares, obedecendo aos hábitos alimentares regionais, devendo cada um dos produtos atender à legislação vigente no que diz respeito às exigências de rotulagem mínimas necessárias e às normas da Agência Nacional de Vigilância Sanitária (ANVISA) e do Ministério da Agricultura, Pecuária e Abastecimento (MAPA).  4. Terão direito ao benefício disposto nesta cláusula os empregados que estejam com o contrato de trabalho ativo por ocasião da data da entrega.  Parágrafo primeiro – Entende-se como contrato de trabalho ativo, todos os contratos de trabalho que não estiverem suspenso nos termos da lei.  Parágrafo segundo – Será agendada uma reunião entre as partes com o objetivo de conhecer os produtos antes do fechamento do processo de concorrência, bem como para explicar o processo de verificação de qualidade.  Parágrafo terceiro – Os empregados de férias individuais ou coletivas terão direito ao benefício “Nossa Feira”.  Parágrafo quarto – Os empregados afastados em decorrência de acidente do trabalho e doença ocupacional com benefício do INSS – B-91, desde que tenha perícia médica presencial realizada pelo médico do INSS, terão direito a “Nossa Feira”, por até 6 (seis) meses de afastamento. |part mês fevereir empresaconced beneficiári mencion item dest cláusul conjunt gêner alimentíci denomin feir através sistem program aliment trabalh pat particip trabalh cust feir mediant descont folh salarial desd fic autoriz depend faix salari sab perceb salári bas r quatr mil trezent rea descont der dez rea mês perceb salári bas acim r quatr mil trezent rea descont r vint oit rea mês conjunt aliment denomin feir compost produt essenc aliment empreg famili obedec hábit aliment region dev cad produt atend legisl vigent diz respeit exigent rotulag mínim necessár norm agênc nacional vigil sanitár anvis ministéri agricultur pecuár abastec map direit benefíci dispost nest cláusul empreg contrat trabalh ativ ocasiã dat entreg parágraf primeir entendes contrat trabalh ativ tod contrat trabalh suspens term lei parágraf segund agend reuniã part objet conhec produt antes fechament process concorrent bem explic process verific qualidad parágraf terceir empreg fér individu colet direit benefíci feir parágraf quart empreg afast decorrent acident trabalh doenc ocupacional benefíci inss desd períc médic presencial realiz médic inss direit feir seis mes afast
2016_082084|Transportation Assistance|1. Fica pactuado que a participação de todos empregados no custo do transporte, fornecido pelo empregador, na hipótese de opção formal, nos termos da Lei nº 7.418, de 16 de dezembro de 1985, e seu Regulamento - Decreto nº 95.247, de 17 de novembro de 1987, será de até 2,5% (dois vírgula cinco por cento) do seu salário base.  2. A empresa disponibilizará aos seus empregados um sistema de transporte fretado contendo ônibus modernos, que estejam sempre limpos e com manutenção mecânica sempre em dia, e dotados com ar-condicionado, cadeiras reclináveis, cinto de segurança disponível em todos os assentos e luzes de leitura. |fic pactu particip tod empreg cust transport fornec empreg hipótes opçã formal term lei nº dezembr regul decret nº novembr dois vírgul cinc cent salári bas empres disponibiliz empreg sistem transport fret cont ônibus modern sempr limp manutençã mecân sempr dia dot arcondicion cadeir reclin cint segur dispon tod assent luz leitur
2015_043073|Food Assistance|As empresas fornecerão, gratuitamente, não integrando a remuneração para nenhum efeito, alimentação e alojamento aos trabalhadores, que fora do seu domicílio funcional, permanecerem aguardando escala no terminal da linha, caso possuam elas restaurante e alojamento próprios. PARÁGRAFO ÚNICO – Se a empresa não dispuser de restaurante e alojamento próprios, a mesma fornecerá, gratuitamente, não integrando a remuneração para nenhum efeito, aos empregados que estiverem trabalhando fora do seu domicílio funcional, refeição / alojamento que serão apresentados perante os estabelecimentos indicados pelas empresas. |empres fornec gratuit integr remuner nenhum efeit aliment aloj trabalh domicíli funcional permanec aguard escal terminal linh cas possu restaur aloj própri parágraf únic empres dispus restaur aloj própri mesm fornec gratuit integr remuner nenhum efeit empreg trabalh domicíli funcional refeiçã aloj apresent perant estabelec indic empres
2015_043073|Transportation Assistance|No caso de falecimento do empregado, a empresa empregadora dele se responsabilizará pela liberação de 1 (um) ônibus para o acompanhamento do cortejo funeral, sem ônus para a família enlutada. Fica esclarecido que o cortejo funeral se circunscreve ao local de contratação do empregado falecido, sem envolver translado de outro Município ou de outro Estado. |cas falec empreg empres empreg responsabiliz liber ônibus acompanh cortej funeral ônus famíl enlut fic esclarec cortej funeral circunscrev local contrat empreg falec envolv transl outr municípi outr estad
2012_003082|Transportation Assistance|Fica o empregador obrigado a fornecer o transporte a seus empregados por meio próprios ou mediante vale transporte de acordo com a lei nº 7418, de 16/12/85, entre o  local de sua residência e o local de trabalho e vice versa. PARÁGRAFO ÚNICO - A empresa que tem transporte próprio fornecerá  ônibus gratuito para todos trabalhadores de ida e volta. |fic empreg obrig fornec transport empreg mei própri mediant val transport acord lei nº local resident local trabalh vic vers parágraf únic empres transport própri fornec ônibus gratuit tod trabalh ida volt
2017_084934|Transportation Assistance|A empresa acordante concederá vales-transportes (cartão vale transporte) aos funcionários que utilizarem transporte coletivo, que dele necessite e assim o declare, descontando a razão de 6% (seis por cento) do salário mensal do empregado. PARÁGRAFO PRIMEIRO A empresa acordante garantirá aos empregados que utilizam automóveis para o seu deslocamento casa/trabalho e trabalho/casa, pagamento no valor correspondente ao que efetivamente o trabalhador pagaria se utilizasse ônibus nesse mesmo deslocamento, concedida através de vale combustível (cartão ticket/Card combustível), sendo que o mesmo não será considerado como salário “in natura”. PARÁGRAFO SEGUNDO Fica ajustado que se o funcionário já utiliza ônibus de diferentes prestadoras, como por exemplo ótimo + transfácil, o valor do vale-combustível será pelo menos a soma do benefício cadastrado nos dois cartões. PARÁGRAFO TERCEIRO Pela concessão do vale combustível a empresa efetuará um desconto na remuneração do trabalhador correspondente a 6% (seis por cento) por cento sobre o salário mensal do empregado. PARÁGRAFO QUARTO O vale-combustível não integrará à remuneração dos empregados para qualquer fim. |empres acord conced valestransport cartã val transport funcionári utiliz transport colet necessit assim declar descont razã seis cent salári mensal empreg parágraf primeir empres acord garant empreg utiliz automóv desloc casatrabalh trabalhocas pagament valor correspondent efet trabalh pag utiliz ônibus ness desloc conced através val combust cartã ticketcard combust send consider salári in natur parágraf segund fic ajust funcionári utiliz ônibus diferent prestador exempl ótim transfácil valor valecombust men som benefíci cadastr dois cartõ parágraf terceir concessã val combust empres efetu descont remuner trabalh correspondent seis cent cent sobr salári mensal empreg parágraf quart valecombust integr remuner empreg qualqu fim
2017_039341|Food Assistance|As empresas concederão aos seus empregados auxílio alimentação no valor de R$29,90 (vinte e nove reais e noventa centavos), sem descontos, por dia de trabalho, sob a forma de tíquetes refeição ou tíquetes alimentação, facultando, excepcionalmente seu pagamento em dinheiro, ressalvadas as situações mais favoráveis relacionadas às disposições da cláusula e seus parágrafos, inclusive quanto à época de pagamento. Parágrafo Primeiro: O auxílio refeição será concedido antecipada e mensalmente, até o último dia útil do mês anterior ao benefício à razão de 22 (vinte e dois) dias fixos por mês, inclusive nos períodos de gozo de férias e até o 15º (décimo quinto) dia nos afastamentos por doença ou acidente de trabalho. Nos casos de admissão e de retorno ao trabalho do empregado no curso do mês, o auxílio será devido proporcionalmente aos dias trabalhados. Em qualquer situação não caberá restituição dos tíquetes já recebidos. Parágrafo Segundo: As empresas que concedem auxílio semelhante aos seus empregados, mediante o fornecimento de refeição, poderão optar pela concessão aqui assegurada, por intermédio do sistema de refeições-convênio credenciado para tal fim, pelo Ministério do Trabalho e Emprego. Parágrafo Terceiro: Os empregados que, comprovadamente se utilizarem de forma gratuita ou subsidiada dos restaurantes da empresa, não farão jus à concessão do auxílio alimentação. Parágrafo Quarto: O empregado poderá optar, por escrito e com antecedência mínima de 30 (trinta) dias, por tíquete alimentação, sendo possível mudar de opção após o transcurso de 180 (cento e oitenta) dias. Parágrafo Quinto: O auxílio, sob qualquer das formas previstas nesta cláusula, não terá natureza remuneratória, nos termos da Lei nº 6.321 de 14 de abril de 1976, de seus decretos regulamentadores e da Portaria GM/MTE nº 03, de 01.03.2002 (DOU 05.03.2002) com as alterações dadas pela Portaria GM/MTE nº 08, de 16.04.2002. |empres conced empreg auxíli aliment valor r vint nov rea novent centav descont dia trabalh sob form tíquet refeiçã tíquet aliment facult excepcional pagament dinheir ressalv situaçõ favor relacion disposiçõ cláusul parágraf inclusiv quant époc pagament parágraf primeir auxíli refeiçã conced antecip mensal últim dia útil mês anterior benefíci razã vint dois dias fix mês inclusiv períod goz fér décim quint dia afast doenc acident trabalh cas admissã retorn trabalh empreg curs mês auxíli dev proporcional dias trabalh qualqu situaçã cab restituiçã tíquet receb parágraf segund empres conced auxíli semelh empreg mediant fornec refeiçã pod optar concessã aqu assegur intermédi sistem refeiçõesconvêni credenc tal fim ministéri trabalh empreg parágraf terceir empreg comprov utiliz form gratuit subsidi restaur empres farã jus concessã auxíli aliment parágraf quart empreg pod optar escrit antecedent mínim trint dias tíquet aliment send possível mud opçã após transcurs cent oitent dias parágraf quint auxíli sob qualqu form previst nest cláusul natur remuneratór term lei nº abril decret regulament port gmmte nº dou alter dad port gmmte nº
2017_039341|Food Assistance|As empresas concederão aos seus empregados, cumulativamente com o benefício da cláusula Auxílio Refeição, o Auxílio Cesta alimentação, no valor mensal de R$ 498,75 (quatrocentos e noventa e oito reais e setenta e cinco centavos), sob a forma de 4 (quatro) tíquetes, no valor de R$124,68 (cento e vinte a quatro reais e sessenta e oito centavos) cada um, junto com a entrega da ajuda alimentação prevista na cláusula Auxílio Refeição, observadas as mesmas condições estabelecidas no seu caput e § 1º e 5º. Parágrafo Primeiro: As empresas concederão até o dia 30 do mês de novembro de 2017, aos empregados que, na data da sua concessão estiverem no efetivo exercício de suas atividades, a Décima Terceira Cesta Alimentação, no valor de R$ 498,75 (quatrocentos e noventa e oito reais e setenta e cinco centavos), através de crédito em cartão eletrônico ou sob forma de 4 (quatro) tíquetes, no valor de R$124,68 (cento e vinte a quatro reais e sessenta e oito centavos) ressalvadas condições mais vantajosas. Parágrafo Segundo: Os auxílios de que trata esta Cláusula previsto no caput e no parágrafo primeiro estendem-se, também, às empregadas que se encontram em gozo de licença maternidade. Parágrafo Terceiro: O empregado afastado a partir de 01/03/2017, por acidente do trabalho ou doença, fará jus à Cesta Alimentação, e à Décima Terceira Cesta Alimentação, por prazo de 180 (cento e oitenta dias), contados do primeiro dia de afastamento do trabalho. Parágrafo Quarto: Ao empregado que, em 01/03/2017 já se encontrava afastado e recebendo o benefício, ficam mantidas as condições previstas na Convenção Coletiva de Trabalho 2017/2018. Parágrafo Quinto: Este auxílio não será devido pela empresa que já concede outro similar, com valor no mínimo equivalente, respeitados critérios mais vantajosos, quando preexistentes, ou previstos nesta CONVENÇÃO. Parágrafo Sexto: Os benefícios previstos no caput e parágrafo primeiro desta cláusula são desvinculados do salário e não tem natureza remuneratória. |empres conced empreg cumul benefíci cláusul auxíli refeiçã auxíli cest aliment valor mensal r quatrocent novent oit rea setent cinc centav sob form quatr tíquet valor r cent vint quatr rea sessent oit centav cad junt entreg ajud aliment previst cláusul auxíli refeiçã observ mesm condiçõ estabelec caput parágraf primeir empres conced dia mês novembr empreg dat concessã efet exercíci ativ décim terceir cest aliment valor r quatrocent novent oit rea setent cinc centav através crédit cartã eletrôn sob form quatr tíquet valor r cent vint quatr rea sessent oit centav ressalv condiçõ vantaj parágraf segund auxíli trat cláusul previst caput parágraf primeir estendems empreg encontr goz licenc matern parágraf terceir empreg afast part acident trabalh doenc far jus cest aliment décim terceir cest aliment praz cent oitent dias cont primeir dia afast trabalh parágraf quart empreg encontr afast receb benefíci fic mant condiçõ previst convençã colet trabalh parágraf quint auxíli dev empres conced outr simil valor mínim equivalent respeit critéri vantaj preexistent previst nest convençã parágraf sext benefíci previst caput parágraf primeir dest cláusul desvincul salári natur remuneratór
2017_039341|Transportation Assistance|As Empresas concederão o vale-transporte, ou seu valor correspondente, por meio do pagamento antecipado em dinheiro, até o quinto dia útil de cada mês, em conformidade com o inciso XXVI, do artigo 7º, da Constituição Federal e com a Portaria do Ministério nº 865, de 14 de setembro de 1995 (DOU, Seção I, de 15/09/95), e, também, em cumprimento às disposições da Lei nº 7.418, de 16 de dezembro de 1985, com a redação dada pela Lei nº 7.619, de 30 de setembro de 1987, regulamentada pelo Decreto nº 95.247, de 16 de novembro de 1987 e, ainda, em conformidade com a decisão do C. TST no Processo TST -AA-366.360/97-4 (AC.SDC), publicada no DJ 07/08/98, seção 1, pág. 314. Cabe ao empregado comunicar, por escrito, à Empresa, as alterações nas condições declaradas inicialmente. Parágrafo Único: Tendo em vista o que dispõe o parágrafo único do artigo 5º da Lei 7.418, de 16 de dezembro de 1985, o valor da participação das empresas nos gastos de deslocamento do trabalhador será equivalente à parcela que exceder a 4% (quatro por cento) do salário básico do empregado. |empres conced valetransport valor correspondent mei pagament antecip dinheir quint dia útil cad mês conform incis xxvi artig constituiçã federal port ministéri nº setembr dou seçã i cumpriment disposiçõ lei nº dezembr redaçã dad lei nº setembr regulament decret nº novembr aind conform decisã c tst process tst acsdc public dj seçã pág cab empreg comunic escrit empres alter condiçõ declar inicial parágraf únic tend vist dispõ parágraf únic artig lei dezembr valor particip empres gast desloc trabalh equivalent parcel exced quatr cent salári básic empreg
