contract_id|title|text|clean_text
2017_039341|Education Assistance|As empresas pagarão o salário-educação diretamente aos seus empregados, de qualquer idade, para indenizar, nos limites do art. 10, do Decreto nº 87.043, de 22/03/82, com redação dada pelo decreto nº 88.374, de 07/06/83, pelo Decreto nº 91.781, de 15/10/85 e, ainda, nos termos das Leis nº 9.424/96, de 24.12.96 (DOU. de 26/12/96) e nº 9.766/98, de 18/12/98 (DOU de 19/12/98) e alterações posteriores, as despesas com sua educação de 1º grau e as despesas havidas com seus filhos em estabelecimentos pagos, com idade entre 7 e 14 anos, mediante a comprovação exigida pelas respectivas normas reguladoras. Parágrafo Primeiro: A partir do dia 19 de Setembro de 1996, data da edição da Medida Provisória nº 1.518 - 1 (DOU de 18/10/96, seção 1, pág. 21260/61) e reedições, convertida nas Leis 9424/96, de 24/12/96 (DOU DE 26/12/96) e nº 9.766/98, de 18/12/98 (DOU de 19/12/98), que alteraram a legislação que rege o Salário Educação, os alunos regularmente atendidos, como beneficiários das modalidades de ensino fundamental, quer regular, quer supletivo, na forma da legislação em vigor, tem, a partir de 1º de janeiro de 1997, o benefício assegurado, vedados novos ingressos, conforme vier a ser estabelecido pelo Poder Executivo. Parágrafo Segundo: O salário-educação não tem caráter remuneratório na relação de emprego e não se vincula, para qualquer efeito, ao salário ou à remuneração percebida pelos empregados na Empresa (§ 4º do art. 1º do Decreto-lei nº 1.422, de 23/10/75). Parágrafo Terceiro: A Empresa que já concede o benefício quer diretamente, quer através de entidade de Previdência Privada, da qual seja patrocinador, fica desobrigado de sua concessão, respeitando-se os critérios mais vantajosos. |empres pag salárioeduc diret empreg qualqu idad indeniz limit art decret nº redaçã dad decret nº decret nº aind term leis nº dou nº dou alter posterior despes educ grau despes hav filh estabelec pag idad anos mediant comprov exig respect norm regul parágraf primeir part dia setembr dat ediçã med provisór nº dou seçã pág reediçõ convert leis dou nº dou alter legisl reg salári educ alun regular atend beneficiári modal ensin fundamental quer regul quer suplet form legisl vigor part janeir benefíci assegur ved nov ingress conform vier estabelec pod execut parágraf segund salárioeduc carát remuneratóri relaçã empreg vincul qualqu efeit salári remuner perceb empreg empres art decretol nº parágraf terceir empres conced benefíci quer diret quer através entidad prevident priv patrocin fic desobrig concessã respeitandos critéri vantaj
2014_038109|Subsistence Allowance|As diárias para viagens serão pagas no valor equivalente a 3,5% do valor bruto do frete e estão vinculadas às regras contidas no Artigo 457 da CLT. Parágrafo único: A forma de pagamento das diárias, aqui ajustadas, substitui a diárias previstas na CCT do SINDMAT - Sindicato das Empresas do Transporte de Cargas do Estado de Mato Grosso. |diár viagens pag valor equivalent valor brut fret vincul regr cont artig clt parágraf únic form pagament diár aqu ajust substitu diár previst cct sindmat sindicat empres transport carg estad mat gross
2014_038109|Food Assistance|O auxilio alimentação/cesta básica convencionado na CCT do SINDMAT deverá ser entregue pela empresa no seu valor integral diferenciado, por este acordo coletivo, no montante de R$ 150,00, a partir do mês de maio de 2014, para todos motoristas. Este valor será mantido no ano de 2014, salvo se o valor em CCT seja definido em valor superior ao ajustado neste acordo coletivo. |auxili alimentaçãocest básic convencion cct sindmat dev entreg empres valor integral diferenc acord colet montant r part mês mai tod motor valor mant ano salv valor cct defin valor superior ajust nest acord colet
2017_039364|Food Assistance|As empresas fornecerão lanches gratuitamente a seus empregados, quando estes estiverem em regime de trabalho extraordinário. |empres fornec lanch gratuit empreg regim trabalh extraordinári
2012_032527|Food Assistance|O CRMV-SC fornecerá a seus empregados, com caráter indenizatório, Vale-Refeição no valor de R$ 22,00 (vinte e dois reais), por dia trabalhado.|crmvsc fornec empreg carát indenizatóri valerefeiçã valor r vint dois rea dia trabalh
2012_032527|Transportation Assistance|O CRMV-SC concederá aos seus funcionários um vale transporte, que satisfaça as despesas com transportes coletivos, mensalmente, com ônus para os mesmos, no percentual máximo 3% (três por cento) de seus salários, tudo em conformidade com a Lei 7.418 de 16 de dezembro de 1985.|crmvsc conced funcionári val transport satisfac despes transport colet mensal ônus mesm percentual máxim três cent salári tud conform lei dezembr
2013_073410|Transportation Assistance| a) Fica a empresa alertada de que deverão cumprir a legislação referente ao vale-transporte, nos termos da Lei 7619/87 e decreto nº 95.247/87. b) Na concorrência de aumento de tarifa de transporte, a empresa deverá complementar a diferença, dentro do prazo máximo de 05 (cinco) dias úteis.|fic empres alert dev cumpr legisl referent valetransport term lei decret nº b concorrent aument tarif transport empres dev complement diferenc dentr praz máxim cinc dias úte
2013_073410|Transportation Assistance|O encerramento do expediente que se verificar no período noturno, na empresa que não fornece transporte coletivo próprio, deverá ser compatível com os horários cobertos normalmente por serviços de transportes públicos. |encerr expedient verific períod noturn empres fornec transport colet própri dev compat horári cobert normal servic transport públic
2013_073410|Education Assistance|Serão abonadas as faltas do empregado estudante para prestação de exames em estabelecimento de ensino oficial, autorizado ou reconhecido e desde que coincidentes com o horário de trabalho, pré-avisado o empregador com o mínimo de 72 (setenta e duas) horas de comprovação posterior. |abon falt empreg estud prestaçã exam estabelec ensin oficial autoriz reconhec desd coincident horári trabalh préavis empreg mínim setent duas hor comprov posterior
2013_073410|Education Assistance|Recomenda-se à empresa solicitarem os serviços do MEC ou do FENAME, para facilitar aos seus empregados a aquisição de material escolar, duas vezes por ano. |recomendas empres solicit servic mec fenam facilit empreg aquisiçã material escol duas vez ano
2010_074884|Food Assistance|A empresa concederá a todos os seus empregados, e sem qualquer ônus a estes, a quantia de R$ 95,00 (noventa reais) mensais através de vale alimentação, junto com o pagamento do adiantamento quinzenal. PARÁGRAFO PRIMEIRO - Excetuam-se da concessão deste benefício, os empregados diretores, gerentes, coordenadores e ocupantes de cargos equivalentes. PARÁGRAFO SEGUNDO - Caberá exclusivamente à empresa a escolha do fornecedor e a forma de aquisição dos vales alimentação, ficando claro, desde já, que a concessão não possui natureza salarial para qualquer fim ou efeito. |empres conced tod empreg qualqu ônus quant r novent rea mens através val aliment junt pagament adiant quinzenal parágraf primeir excetuams concessã dest benefíci empreg diretor gerent coorden ocup carg equivalent parágraf segund cab exclus empres escolh fornecedor form aquisiçã val aliment fic clar desd concessã possu natur salarial qualqu fim efeit
2014_038173|Food Assistance|"A empresa fornecerá para os seus empregados, ""Ticket Alimentação"", no valor de R$ 230,41 (duzentos e trinta reais e quarenta e um centavos), de forma gratuita e proporcional aos dias trabalhados, não integrando os salários, às férias, ao 13º salário, e também não incidindo encargos sociais, nos termos do art. 6º do Decreto 05, de 14/01/91, que regulamentou a Lei 6.321 de 14/04/76 "|empres fornec empreg ticket aliment valor r duzent trint rea quarent centav form gratuit proporcional dias trabalh integr salári fér salári incid encarg soc term art decret regulament lei
2014_038173|Transportation Assistance|"A empresa concederá transporte gratuito para todos os seus empregados, nos seus veículos coletivos, desde que estejam devidamente credenciados, salvo em caso de aposentadoria por qualquer de suas formas. Parágrafo Único - A empresa se compromete a buscar os empregados para o 1º (primeiro) turno, e a levá-los após o 2º (segundo) turno, em itinerários pré-estabelecidos, sem que o tempo gasto seja considerado horas ""in itinere""."|empres conced transport gratuit tod empreg veícul colet desd devid credenc salv cas aposentador qualqu form parágraf únic empres compromet busc empreg primeir turn levál após segund turn itinerári préestabelec temp gast consider hor in itiner
2014_038173|Education Assistance|A empresa poderá implantar escolinha para preparação e capacitação dos seus trabalhadores, visando promoção ao cargo de motorista, sendo que a deliberação acerca da promoção ficará a cargo exclusivo da empresa.As aulas serão destinadas, unicamente, àqueles trabalhadores que tenham interesse na capacitação, sendo, portanto, facultativas. O periodo despendido nas aulas não será considerado como trabalhado ou tempo a disposição do empregador, não podendo, em hipótese alguma, ser computado na jornada de trabalho para qualquer finalidade. |empres pod implant escolinh prepar capacit trabalh vis promoçã carg motor send deliber acerc promoçã fic carg exclus empresa aul destin unic àquel trabalh inter capacit send portant facult period despend aul consider trabalh temp disposiçã empreg pod hipótes algum comput jorn trabalh qualqu final
2012_042462|Housing Assistance|As Empresas que fornecerem moradia aos seus Trabalhadores, na hipótese de rescisão do contrato de trabalho, concederão ao mesmo prazo de até 60 (sessenta) dias, contados a partir da homologação da rescisão contratual, para desocupar o imóvel. |empres fornec morad trabalh hipótes rescisã contrat trabalh conced praz sessent dias cont part homolog rescisã contratual desocup imóvel
2012_042462|Transportation Assistance|Se for o Trabalhador recrutado em localidade distinta da Empresa empregadora, no caso de dispensa sem justa causa, esta se obriga a providenciar o retorno do Trabalhador a sua origem, bem como o pagamento das despesas. |trabalh recrut local distint empres empreg cas dispens just caus obrig providenc retorn trabalh orig bem pagament despes
2015_043120|Food Assistance|Fica estipulado o valor de vale-refeição de R$ 130,00 (cento e trinta reais) por mês, concedidos a todos os empregados de acordo com os benefícios e entendimentos disciplinados na lei que instituiu o PAT - Programa de Alimentação do Trabalhador;  3.1 A empresa se comprometera a servir alimentação, conforme (art. 2º, §1º, do Decreto nº 349, de 21 de novembro de 1991, e o art. 4º da Portaria nº 03/2002), mantendo-se ainda o vale alimentação sem nem um desconto. |fic estipul valor valerefeiçã r cent trint rea mês conced tod empreg acord benefíci entend disciplin lei institu pat program aliment trabalh empres compromet serv aliment conform art decret nº novembr art port nº mantendos aind val aliment descont
2015_043120|Food Assistance|Aos trabalhadores quando em viajem pela empresa receberam um auxilio de R$ 25,00 (vinte e cinco reais) para o interior e R$ 30,00 (trinta reais) para Capital, para efetuarem o desejum durante o trajeto;  |trabalh viaj empres receb auxili r vint cinc rea interior r trint rea capital efetu desejum durant trajet
2015_043120|Transportation Assistance|A empresa fornecerá aos seus empregados condução para o local de trabalho, com duração aproximada de 01 (uma) hora com ou vale transporte de trajeto de ida e volta com desconto de 6%.  1 A empresa fornecerá aos seus empregados, por tratar-se de ser um percurso de mais de 20KM sendo ida e volta, não tendo ônibus suficiente para este trajeto a empresa concederá uma reajuste quando obtiver o aumento das viações. |empres fornec empreg conduçã local trabalh duraçã aproxim hor val transport trajet ida volt descont empres fornec empreg tratars percurs send ida volt tend ônibus suficient trajet empres conced reajust obtiv aument viaçõ
2012_032551|Food Assistance|ALMOÇO - R$ 17,00 - Será pago aos empregados, quando em serviços externos, em dinheiro. JANTAR - R$ 17,00 - Será pago aos empregados, quando em serviços externos, em dinheiro. PERNOITE- R$ 12,00 - Este valor que já inclui o café da manhã, será pago aos empregados, quando em viagens a serviço da empresa, que em razão de sua natureza e da limitação de sua jornada de trabalho, implique em retorno em dia(s) posterior(s), em dinheiro. |almoc r pag empreg servic extern dinheir jant r pag empreg servic extern dinheir pernoite r valor inclu caf manhã pag empreg viagens servic empres razã natur limit jorn trabalh impliqu retorn dia s posterior s dinheir
2015_043084|Food Assistance|"Será devida, pelos empregadores a todos os seus empregados, independentemente de sua função, uma cesta básica mensal equivalente ao padrão básico alimentar, contendo, no mínimo, os seguintes produtos:  3 Kg de açúcar; 10 Kg de arroz tipo agulhinha tipo 1; 3 Kg de feijão preto tipo 1; 1 kg de sal; 1,5 kg de massa com ovos; 1 Kg de café; 2 Kg de farinha de trigo especial; 1 Kg de farinha de milho; 340g de polpa de tomate; 200g de ervilhas; 2.700ml (3 latas) de óleo de cozinha; 400g de bolachas ""Maria""; 400g de bolachas salgadas; 400g de leite em pó; 400g de achocolatado; 180g de salsichas; 130g de sardinhas; 500g de farinha de mandioca.  Parágrafo Primeiro - O valor desta cesta básica será devido pela metade, caso o empregado trabalhar 110 horas normais por mês ou for de meia jornada a sua carga normal.  Parágrafo Segundo - Apenas em locais distantes e/ou de difícil abastecimento será permitido convertê-la em pecúnia, sendo indispensável, contudo, a discriminação em recibo de sua destinação específica.  Parágrafo  Terceiro  - As partes reconhecem, para todos os fins de direito, que o fornecimento desta cesta básica, por quaisquer das formas aqui referidas, não terá natureza salarial, não podendo ser invocado a qualquer tempo, salvo caso de inadimplência, como salário ""in natura"".  Parágrafo Quarto - Os empregados poderão participar com até, no máximo, 10% (dez por cento) do valor da cesta básica efetivamente fornecida.  Parágrafo Quinto - Os empregados que estejam no gozo de férias também terão direito a percepção da cesta básica.  Parágrafo Sexto  - O empregado, no mês de sua admissão, terá direito ao recebimento integral da cesta básica, caso trabalhe mais de 15 (quinze) dias no mês.  Parágrafo Sétimo  - O empregado demitido sem justa causa e que tiver indenizado o período de aviso prévio, terá direito ao recebimento integral da cesta básica do mês em que recebeu o aviso, que será entregue junto com a cesta básica dos demais empregados.  Parágrafo Oitavo - O empregado perderá o direito a percepção da cesta básica caso no mês anterior ao da concessão do benefício tenha faltado ao trabalho injustificadamente.  Parágrafo Nono - Além dos casos previstos em lei e na presente convenção coletiva de trabalho como faltas justificadas e que ensejam o abono, também serão entendidas como justificadas, unicamene para os efeitos da presente cláusula, as faltas decorrentes de: a) consulta médica devidamente comprovada; b) acompanhamento de filho menor, filho portador de deficiência, ou de pai e mãe maiores de 70 (setenta) anos, ou inválidos ao médico mediante apresentação de atestado; c) internação hospitalar de filho menor, filho portador de deficiência, ou de pai ou mãe maiores de 70 (setenta) anos ou inválidos (dia da internação); e d) ausência de transporte público em decorrência de grave da categoria rodoviária.  "|dev empreg tod empreg independent funçã cest básic mensal equivalent padrã básic aliment cont mínim seguint produt kg açúc kg arroz tip agulhinh tip kg feijã pret tip kg sal kg mass ovos kg caf kg farinh trig especial kg farinh milh polp tomat ervilh lat óle cozinh bolach mar bolach salg leit pó achocolat salsich sardinh farinh mandioc parágraf primeir valor dest cest básic dev metad cas empreg trabalh hor norm mês mei jorn carg normal parágraf segund apen loc distant eou difícil abastec permit convertêl pecún send indispens contud discrimin recib destin específ parágraf terceir part reconhec tod fins direit fornec dest cest básic quaisqu form aqu refer natur salarial pod invoc qualqu temp salv cas inadimplent salári in natur parágraf quart empreg pod particip máxim dez cent valor cest básic efet fornec parágraf quint empreg goz fér direit percepçã cest básic parágraf sext empreg mês admissã direit receb integral cest básic cas trabalh quinz dias mês parágraf sétim empreg demit just caus indeniz períod avis prévi direit receb integral cest básic mês receb avis entreg junt cest básic dem empreg parágraf oitav empreg perd direit percepçã cest básic cas mês anterior concessã benefíci falt trabalh injustific parágraf non além cas previst lei present convençã colet trabalh falt justific ensej abon entend justific unicamen efeit present cláusul falt decorrent consult médic devid comprov b acompanh filh menor filh portador deficient pai mã maior setent anos invál médic mediant apresent atest c intern hospital filh menor filh portador deficient pai mã maior setent anos invál dia intern d ausênc transport públic decorrent grav categor rodoviár
2015_043084|Education Assistance|As partes acordantes emitirão circular conjunta informando os procedimentos necessários para o aproveitamento direto, e na forma da Lei, do salário educação por parte dos trabalhadores. |part acord emit circul conjunt inform proced necessári aproveit diret form lei salári educ part trabalh
