contract_id|title|text|clean_text
2016_082054|Medical Exams|EXAME PREVENTIVO DE CÂNCER  A empresa que empregar mão de obra feminina proporcionará às suas empregadas, desde que por elas formalmente requerido, a realização de exame preventivo do câncer, gratuitamente, quando da realização do exame periódico anual.  |exam prevent cânc empres empreg mã obra feminin proporcion empreg desd formal requer realiz exam prevent cânc gratuit realiz exam periód anual
2016_082054|Acceptance of Medical Certificates|ATESTADOS MÉDICOS E ODONTOLÓGICOS  Serão reconhecidos os atestados médicos e/ou odontológicos passados por facultativos do sindicato, desde que obedecidas às exigências da Portaria MPAS-3370/84. Tais atestados não serão questionados quanto a sua origem, se portarem o Código Internacional de Doenças (CID), o carimbo do respectivo sindicato e assinatura do seu facultativo. Excetuam-se os casos previstos no parágrafo 4º do artigo 60 da Lei 8.213 de 24.07.91 e sua regulamentação constante no parágrafo 1º do artigo 73 do Decreto 611 de 21.07.92.  Não será exigida a comprovação de aquisição de medicamentos.  Os atestados que retratem casos de urgência médica serão reconhecidos sempre.  |atest médic odontológ reconhec atest médic eou odontológ pass facult sindicat desd obedec exigent port tais atest question quant orig port códig internacional doenc cid carimb respect sindicat assinatur facult excetuams cas previst parágraf artig lei regulament constant parágraf artig decret exig comprov aquisiçã medic atest retrat cas urgênc médic reconhec sempr
2012_002993|Health Care| Os Empregadores estão obrigados a instituir o Convênio Médico para assistência dos seus empregados, e subsidiarão o valor de R$ 60,00 (sessenta reais) mensais para cada empregado, ficando por conta do trabalhador o valor excedente que será descontado em folha de pagamento desde que, expressamente autorizado pelo respectivo funcionário.  Parágrafo 1°) O Sindicato dos empregados é o responsável pela contratação da operadora do convênio médico. As empresas que já concedem o convênio médico a seus funcionários ficam desobrigadas do cumprimento desta cláusula, desde que as condições por elas praticadas sejam equivalentes aqui estipuladas, ou ainda, mais favoráveis ao empregado, Sendo que na hipótese da contratação pelo empregador, este fica obrigado a apresentar ao Sindicato dos Empregados, o contrato de prestação de serviços do convênio médico com empresa idônea;  Parágrafo 2º) Em caso do fornecimento do convênio médico pelo Sindicato dos Empregados a responsabilidade de informar, fiscalizar a cobrança da cobertura do convênio será do Sindicato dos Empregados, o empregador será responsável pela informação do numero de empregados pelo pagamento dos boletos. Na rescisão do contrato de trabalho do empregado não poderá ser exigido à cobrança dos boletos em atraso do empregador;  Parágrafo 3°) O empregado que já possuir convênio médico, o empregador poderá subsidiar até o valor de R$. 60,00 (sessenta reais);  O reajuste será aplicado ao longo de doze meses, respeitando a data de aniversário do contrato com o convênio Médico;  Fica vedado o desconto de contribuição para convênio médico, salvo expressa concordância do empregado.|empreg obrig institu convêni médic assistent empreg subsidi valor r sessent rea mens cad empreg fic cont trabalh valor excedent descont folh pagament desd express autoriz respect funcionári parágraf sindicat empreg respons contrat oper convêni médic empres conced convêni médic funcionári fic desobrig cumpriment dest cláusul desd condiçõ pratic equivalent aqu estipul aind favor empreg send hipótes contrat empreg fic obrig apresent sindicat empreg contrat prestaçã servic convêni médic empres idôn parágraf cas fornec convêni médic sindicat empreg respons inform fiscaliz cobranc cobertur convêni sindicat empreg empreg respons inform numer empreg pagament bolet rescisã contrat trabalh empreg pod exig cobranc bolet atras empreg parágraf empreg possu convêni médic empreg pod subsidi valor r sessent rea reajust aplic long doz mes respeit dat aniversári contrat convêni médic fic ved descont contribuiçã convêni médic salv express concord empreg
2012_002993|Medical Exams|Para efeito de justificação, abono de faltas e atraso, a Empresa aceitará o atestado médico e/ou odontológico do Instituto Previdenciário, ou alternativamente, de eventual Convênio Medico do qual o empregado faça parte. |efeit justific abon falt atras empres aceit atest médic eou odontológ institut previdenciári altern eventual convêni medic empreg fac part
2012_002943|First Aid|A empresa se obriga a comunicar aos familiares do acidentado quando o mesmo estiver que ser levado de imediato para o hospital, desde que o endereço esteja atualizado. PARÁGRAFO ÚNICO - Nos casos de acidente do empregado que esteja em horario de trabalho a empresa se obriga a providenciar o seu transporte para asistência médica. |empres obrig comunic famili acident lev imediat hospital desd enderec atualiz parágraf únic cas acident empreg horari trabalh empres obrig providenc transport asistent médic
2016_082084|Health Care|1. A empresa estabelecerá convênio médico-hospitalar em favor dos seus empregados, em modelo de coparticipação.  2. Para a coparticipação do empregado serão observados: a) A empresa disponibilizará aos seus empregados os extratos dos pagamentos de responsabilidade dos mesmos sempre que tais extratos não forem enviados pela operadora do convênio aos empregados beneficiários.  b) A empresa disponibilizará conta bancária especial e informará aos seus empregados afastados, visando a permitir aos mesmos os depósitos mensais correspondentes às suas coparticipações no custeio do plano médico, de acordo com as diretrizes previstas para todos os demais empregados.  c) Na ocorrência de atrasos superiores a 90 (noventa) dias, por parte da operadora do plano, no envio dos pagamentos de responsabilidade dos empregados, cumulando estes em um único pagamento que ultrapasse 30% (trinta por cento) do salário do empregado, a empresa parcelará os descontos correspondentes em 3 (três) parcelas. |empres estabelec convêni médicohospital favor empreg model coparticip coparticip empreg observ empres disponibiliz empreg extrat pagament respons mesm sempr tais extrat envi oper convêni empreg beneficiári b empres disponibiliz cont bancár especial inform empreg afast vis permit mesm depósit mens correspondent coparticip custei plan médic acord diretriz previst tod dem empreg c ocorrent atras superior novent dias part oper plan envi pagament respons empreg cumul únic pagament ultrap trint cent salári empreg empres parcel descont correspondent três parcel
2016_082084|Medical Exams|1. Nos casos de suspeita de doenças comuns ou ocupacionais, verificadas no exame médico demissional, cabe à empresa providenciar exames complementares para comprovar a doença ou a sua ausência. Nesses casos, a empresa fornecerá cópias de tais exames ao empregado no ato da homologação. Quando o médico do trabalho comprovar a doença, com ou sem os exames complementares, será suspensa a rescisão e o empregado será encaminhado ao INSS. |cas suspeit doenc comuns ocupacion verific exam médic demissional cab empres providenc exam complement comprov doenc ausênc ness cas empres fornec cóp tais exam empreg ato homolog médic trabalh comprov doenc exam complement suspens rescisã empreg encaminh inss
2016_082084|Medical Exams|1. O empregador se compromete a fornecer aos seus empregados uma cópia dos seus Atestados de Saúde Ocupacional (ASO), tanto admissionais, quanto demissionais ou periódicos, e, ainda, cópia dos exames complementares, quando requeridos pelo empregado. |empreg compromet fornec empreg cóp atest saúd ocupacional aso tant admission quant demission periód aind cóp exam complement requer empreg
2016_082084|Acceptance of Medical Certificates|1. Nos termos previstos nos parágrafos 1º (primeiro) a 2º (segundo) do artigo 75, do Regulamento da Previdência Social – Decreto nº 3.048, de 06.05.99 – a empresa, possuindo serviços médicos próprios ou convênios, se responsabilizará pelos exames médicos e odontológicos para abonos de faltas, somente encaminhando os documentos à Previdência Social quando a duração da incapacidade ultrapassar a 15 (quinze) dias, ressalvadas as emergências legais, bem como as hipóteses mais favoráveis já existentes.  2. Caso a empresa deixe de se enquadrar nas hipóteses acima, as doenças dos empregados serão comprovadas mediante atestados médicos e odontológicos expedidos de acordo com a ordem de preferência estabelecida no parágrafo 2ª (segundo), do Artigo 6º (sexto), da Lei nº 605, de 05.01.49, entendendo-se como primeira prioridade, ainda, os serviços médicos conveniados com o INSS/SUS, aí incluído o serviço médico/odontológico do sindicato profissional, enquanto conveniado com o INSS/SUS.  3. Os atestados médicos e odontológicos expedidos na forma do item 1 supracitado, somente terão validade para fins de abono de faltas com a observância das formalidades previstas na Portaria nº 3.291, de 20.02.84, do então M.P.A.S.  4. Salvo os casos de força maior, comprobatórios do impedimento para entrega, os atestados médicos e odontológicos expedidos por profissionais que não sejam da própria empresa deverão ser a esta entregues no prazo máximo de até 24 (vinte e quatro) horas após o retorno do empregado, garantindo-se, em tal hipótese, a remuneração dos dias referentes ao período atestado, na primeira folha subsequente de pagamento, após a entrega, sob pena de não terem eficácia para fins de abono de faltas. Em tais casos, o empregado deverá comunicar o motivo do seu afastamento ao empregador, por quaisquer meios, no prazo de 48 (quarenta e oito) horas do aludido afastamento.  5. A empresa se compromete a protocolar a cópia do atestado médico, desde que o empregado o entregue em duas vias (original e cópia). |term previst parágraf primeir segund artig regul prevident social decret nº empres possu servic médic própri convêni responsabiliz exam médic odontológ abon falt soment encaminh document prevident social duraçã incapac ultrapass quinz dias ressalv emergent leg bem hipótes favor existent cas empres deix enquadr hipótes acim doenc empreg comprov mediant atest médic odontológ exped acord ordem preferent estabelec parágraf segund artig sext lei nº entendendos primeir prioridad aind servic médic conveni insssus aí incluíd servic médicoodontológ sindicat profissional enquant conveni insssus atest médic odontológ exped form item supracit soment validad fins abon falt observ formal previst port nº entã mpas salv cas forc maior comprobatóri imped entreg atest médic odontológ exped profission própr empres dev entregu praz máxim vint quatr hor após retorn empreg garantindos tal hipótes remuner dias referent períod atest primeir folh subsequent pagament após entreg sob pen ter eficác fins abon falt tais cas empreg dev comunic motiv afast empreg quaisqu mei praz quarent oit hor alud afast empres compromet protocol cóp atest médic desd empreg entreg duas vias original cóp
2016_082084|First Aid|1. A empresa fornecerá gratuitamente a medicação necessária aos primeiros socorros dos seus empregados vitimados por acidentes de trabalho ou por doenças profissionais, providenciando, ainda, sob suas expensas, a sua condução para o atendimento hospitalar necessário.  2. A empresa se compromete a manter, nas caixas de primeiros socorros e enfermarias, absorventes higiênicos para os casos de emergência, bem como os medicamentos definidos pelo SESMT ou pelo coordenador do PCMSO da empresa. |empres fornec gratuit medic necessár primeir socorr empreg vitim acident trabalh doenc profission providenc aind sob expens conduçã atend hospital necessári empres compromet mant caix primeir socorr enferm absorvent higiên cas emergent bem medic defin sesmt coorden pcmso empres
2015_043073|Acceptance of Medical Certificates|As empresas aceitarão atestados médicos e odontológicos firmados por profissionais credenciados pelo Sindicato Profissional, para licença até 4 (quatro) dias por mês, salvo as que possuam departamento médico e / ou odontológico. |empres aceit atest médic odontológ firm profission credenc sindicat profissional licenc quatr dias mês salv possu depart médic odontológ
2012_003082|First Aid|A empresa se obriga a comunicar aos familiares do acidentado quando o mesmo estiver que ser levado de imediato do local de trabalho para o hospital, desde que o endereço esteja atualizado. PARÁGRAFO ÚNICO - Nos casos de acidente do empregado que esteja em horario de trabalho a empresa se obriga a providenciar o seu transporte para assistência médica. |empres obrig comunic famili acident lev imediat local trabalh hospital desd enderec atualiz parágraf únic cas acident empreg horari trabalh empres obrig providenc transport assistent médic
2017_039341|Health Care|O empregado dispensado sem justa causa, a partir de 1º/03/2017, poderá usufruir os convênios de assistência médica e hospitalar contratados pela empresa, pelo período abaixo especificados, contados do último dia de trabalho efetivo e determinados conforme tempo de casa, mantidas as condições do convênio, respeitadas as situações mais favoráveis. Parágrafo Primeiro: A presente cláusula se aplica somente às empresas que possuam convênio de assistência médica e hospitalar.     Vínculo empregatício com a empresa   Período de utilização do convênio     Até 5 (cinco) anos   60 (sessenta) dias     mais de 5 (cinco) anos até 10 (dez) anos   90 (noventa) dias     mais de 10 (dez) anos até 20 (vinte) anos   180 (cento e oitenta) dias     mais de 20 (vinte) anos   270 (duzentos e setenta) dias     Parágrafo Segundo: Os empregados dispensados, sem justa causa, até 28/02/2017, estão abrangidos pelas condições previstas na Convenção Coletiva de Trabalho 2017/2018. |empreg dispens just caus part pod usufru convêni assistent médic hospital contrat empres períod abaix especific cont últim dia trabalh efet determin conform temp cas mant condiçõ convêni respeit situaçõ favor parágraf primeir present cláusul aplic soment empres possu convêni assistent médic hospital víncul empregatíci empres períod utiliz convêni cinc anos sessent dias cinc anos dez anos novent dias dez anos vint anos cent oitent dias vint anos duzent setent dias parágraf segund empreg dispens just caus abrang condiçõ previst convençã colet trabalh
2017_039341|Acceptance of Medical Certificates|Os atestados médicos e odontológicos passados pelos respectivos departamentos do Sindicato dos Empregados, desde que mantenham convênio com o INSS, serão reconhecidos e aceitos pelas empresas para justificativa de faltas ao trabalho por motivo de doença. |atest médic odontológ pass respect depart sindicat empreg desd mantenh convêni inss reconhec aceit empres justific falt trabalh motiv doenc
2017_039364|Acceptance of Medical Certificates|Os atestados médicos e odontológicos fornecidos por profissional das entidades signatárias desta Convenção serão aceitos pelas empresas para todos os efeitos legais, ressalvados os casos em que estas mantenham a assistência médica para os seus empregados, quando somente serão aceitos os atestados emitidos pelos médicos por eles credenciados. |atest médic odontológ fornec profissional entidad signatár dest convençã aceit empres tod efeit leg ressalv cas mantenh assistent médic empreg soment aceit atest emit médic credenc
2012_032527|Health Care|O CRMV-SC fornecerá aos funcionários e seus dependentes, um convênio Saúde, de assistência médica hospitalar e laboratorial, e pagará 75% (setenta e cinco por cento) das mensalidades dos seus planos,  sendo que os 25% (vinte e cinco por cento) restantes serão cobertos pelos próprios funcionários, mediante desconto em folha.|crmvsc fornec funcionári dependent convêni saúd assistent médic hospital laboratorial pag setent cinc cent mensal plan send vint cinc cent restant cobert própri funcionári mediant descont folh
2012_032527|Health Care|O CRMV-SC fornecerá aos funcionários e seus dependentes, um convênio de assistência odontológica, e pagará 75% (setenta e cinco por cento) das mensalidades dos seus planos, sendo que os 25% (vinte e cinco por cento) restantes serão cobertos pelos próprios funcionários, mediante desconto em folha. |crmvsc fornec funcionári dependent convêni assistent odontológ pag setent cinc cent mensal plan send vint cinc cent restant cobert própri funcionári mediant descont folh
2013_073410|Medical Exams|Serão realizados obrigatoriamente os exames admissionais, demissionais e periódicos, na forma estabelecida pela NR-7 da Portaria 3214/78, sem ônus para o trabalhador. |realiz obrigatori exam admission demission periód form estabelec port ônus trabalh
2013_073410|Acceptance of Medical Certificates|A empresa deverá preencher o Atestado do Afastamento e Salários (AAS), quando solicitado pelo empregado nos seguintes prazos: a) Máximo de 5 (cinco) dias úteis, contados da solicitação,  nos casos  de  obtenção  de  benefício  por auxílio doença. Se ocorrer solicitação do INSS para apresentação do AAS, a empresa o concederá no prazo de 48 horas. b) Máximo de 7 (sete) dias úteis, contados da data da solicitação, nos casos de aposentadoria e abono de permanência em serviço. c) Máximo de 7 (sete) dias úteis, contados da solicitação, quando, após, a rescisão contratual, o empregado necessitar, justificadamente, do AAS. |empres dev preench atest afast salári aas solicit empreg seguint praz máxim cinc dias úte cont solicit cas obtençã benefíci auxíli doenc ocorr solicit inss apresent aas empres conced praz hor b máxim set dias úte cont dat solicit cas aposentador abon permanent servic c máxim set dias úte cont solicit após rescisã contratual empreg necessit justific aas
2013_073410|Acceptance of Medical Certificates|A empresa reconhecerá a validade dos atestados médicos ou odontológicos emitidos de conformidade com a portaria MPAS-3.291, de 20-02-84, inclusive os emitidos pela entidade sindical, desde que o profissional emitente seja conveniado com a Previdência Social. |empres reconhec validad atest médic odontológ emit conform port inclusiv emit entidad sindical desd profissional emitent conveni prevident social
2013_073410|First Aid|Obriga-se o empregador a transportar o empregado com urgência, para o local apropriado, em caso de acidente ou mal súbito, desde que ocorram no local e em horário de trabalho. |obrigas empreg transport empreg urgênc local apropri cas acident mal súbit desd ocorr local horári trabalh
2014_038173|Health Care|A empresa fornecerá  PLANO DE SAÚDE para os trabalhadores, com a co-participação - como fator moderador - de R$13,22 (treze reais e vinte e dois centavos) do titular e mais R$13,22 (treze reais e vinte e dois centavos) do cônjuge, se houver. A partir da vigência do Acordo coletivo de 2014, fica a empresa autorizada  a descontar, mensalmente, 1% (um por cento) sobre a remuneração básica do empregado, associado ou não, valor este que deverá ser creditado diretamente na conta da entidade sindical junto a Caixa Econômica Federal, conta nº 1358-0, agência 0132, que serão destinados a assistência social e fiscalização dos benefícios conquistados, tais como: ajuda ticket alimentação, prevenção da saúde dos trabalhadores e de seus dependentes (Plano de Saúde), devendo os valores depositados serem comprovados via Email para o endereço eletrônico sindcoletivosurbanos@yahoo.com.br. Fica garantido ao trabalhador o direito de oposição contra o desconto previsto na cláusula anterior, devendo ele, nesse caso, formalizar por escrito e de próprio punho a sua pretensão, diretamente no sindicato, no prazo preclusivo  de 15 (quinze) dias a partir da homologação do presente termo. Caso, por algum motivo, a empresa tenha que devolver eventuais valores que tenham sido descontados dos empregados com base na presente cláusula, fica o sindicato obrigado a restituír o respectivo montante, exceto se a quantia correspondente ainda não lhe tiver sido repassada pela empresa. |empres fornec plan saúd trabalh coparticip fator moder r trez rea vint dois centav titul r trez rea vint dois centav cônjug part vigênc acord colet fic empres autoriz descont mensal cent sobr remuner básic empreg assoc valor dev credit diret cont entidad sindical junt caix econôm federal cont nº agênc destin assistent social fiscaliz benefíci conquist tais ajud ticket aliment prevençã saúd trabalh dependent plan saúd dev valor deposit ser comprov via email enderec eletrôn sindcoletivosurban yahoocombr fic garant trabalh direit oposiçã contr descont previst cláusul anterior dev ness cas formaliz escrit própri punh pretensã diret sindicat praz preclus quinz dias part homolog present term cas algum motiv empres devolv eventu valor sid descont empreg bas present cláusul fic sindicat obrig restituír respect montant excet quant correspondent aind sid repass empres
2014_038173|Acceptance of Medical Certificates|"A empresa reconhecerá a validade dos atestados médicos e/ou odontológicos oficiais, desde que conste o CID, e sejam ratificados pelo médico da empresa, ficando estabelecido prazo de 48 (quarenta e oito) horas para a sua entrega, a contar da data da sua emissão. Parágrafo Primeiro - A empresa, nos atos de admissão, demissão e exames periódicos, submeterá seus empregados a exames médicos sem ônus para os mesmos; Parágrafo Segundo - A empresa concederá estabilidade de 60 (sessenta) dias para todos os empregados que retornarem a empresa depois de afastamento para tratamento médico com atestado de mais de 30 (trinta) dias. Parágrafo Terceiro - A empresa fornecerá no ato de demissão carta de apresentação, salvo se a dispensa for por ""justa causa""."|empres reconhec validad atest médic eou odontológ ofic desd const cid ratific médic empres fic estabelec praz quarent oit hor entreg cont dat emissã parágraf primeir empres atos admissã demissã exam periód submet empreg exam médic ônus mesm parágraf segund empres conced estabil sessent dias tod empreg retorn empres afast tratament médic atest trint dias parágraf terceir empres fornec ato demissã cart apresent salv dispens just caus
2012_042462|Health Care|a)     A Empresa manterá convênio com farmácias e/ou drogarias, visando aquisição exclusivamente de medicamentos com receita médica, aos seus trabalhadores e dependente, com posterior descontos em folha de pagamento. b)    Quando o valor a ser descontado em folha de pagamento ultrapassar a 20% (vinte por cento) o salário base do trabalhador, o mesmo será efetuado, no máximo, em 02 (duas) parcelas consecutivas. |empres mant convêni farmác eou drog vis aquisiçã exclus medic receit médic trabalh dependent posterior descont folh pagament b valor descont folh pagament ultrapass vint cent salári bas trabalh efetu máxim duas parcel consecut
2012_042462|Acceptance of Medical Certificates|a)                   As empresas que mantêm convênio médico aos seus Empregados poderão recusar atestados médicos emitidos por profissionais que não integrem o quadro médico do Convênio utilizado. b)                  Não havendo convênio médico serão aceitos os atestados médicos e Odontológicos fornecidos por profissionais particulares, da instituição de Previdência Social Federal, de profissional indicado pelo Sindicato Laboral e Serviço Social de Indústria ou do Comércio, serviço de repartições federais, estaduais ou municipais, incumbidas de assuntos de higiene ou de saúde pública. c)                   Ocorrendo ausências em conformidade com esta cláusula, ficam mantidas todas as vantagens legais oferecidas. |empres mantêm convêni médic empreg pod recus atest médic emit profission integr quadr médic convêni utiliz b hav convêni médic aceit atest médic odontológ fornec profission particul instituiçã prevident social federal profissional indic sindicat laboral servic social indústr comérci servic repartiçõ feder estadu municip incumb assunt higien saúd públic c ocorr ausênc conform cláusul fic mant tod vantagens leg oferec
