contract_id|title|text|clean_text
2016_082062|Acceptance of Medical Certificates|ATESTADOS MÉDICOS E ODONTOLÓGICOS: Serão reconhecidos os atestados médicos e/ou odontológicos firmados por profissionais habilitados junto ao sindicato representativo da categoria, desde que mencionado o objeto do atendimento, e desde que este mantenha convênio com órgão oficial competente da Previdência Social; serão reconhecidos também, os atestados médicos ou comprovante de comparecimento dos órgãos da saúde estadual ou municipal, prevalecendo, sempre, a ordem de prioridade prevista no parágrafo 1º do art. 75 do Decreto n.º 3.048/99.  Parágrafo único – Os atestados médicos deverão obedecer aos requisitos previstos na Portaria MPAS 3.291/84, devendo constar, inclusive, o diagnóstico codificado, conforme o Código Internacional de Doenças (CID), nesse caso, com a concordância do empregado, bem como deverão ser apresentados à empresa em até 10 (dez) dias de sua emissão. |atest médic odontológ reconhec atest médic eou odontológ firm profission habilit junt sindicat represent categor desd mencion objet atend desd mantenh convêni órgã oficial competent prevident social reconhec atest médic comprov comparec órgã saúd estadual municipal prevalec sempr ordem prioridad previst parágraf art decret nº parágraf únic atest médic dev obedec requisit previst port mpas dev const inclusiv diagnóst codific conform códig internacional doenc cid ness cas concord empreg bem dev apresent empres dez dias emissã
2010_075192|Hazard Pay (Health)|Repórteres que acumulem a função de laboratorista farão jus a um adicional de insalubridade, fixado de acordo com o laudo pericial elaborado por setor competente do Ministério do Trabalho, incidente sobre o piso salarial da categoria. |repórt acumul funçã laborator farã jus adicional insalubr fix acord laud pericial elabor setor competent ministéri trabalh incident sobr pis salarial categor
2010_075192|Medical Exams|A empregada-jornalista gestante poderá se ausentar do serviço para fazer exame pré-natal, mediante comprovação médica. |empregadajornal gestant pod ausent servic faz exam prénatal mediant comprov médic
2015_043120|Health Care|A empresa pagará plano de saúde Unimed, Medical ou qualquer outro convênio com os mesmos benefícios oferecidos pelos apresentados nesta cláusula. |empres pag plan saúd unimed medical qualqu outr convêni mesm benefíci oferec apresent nest cláusul
2015_043120|Medical Exams|Os empregadores se comprometem a fornecer aos seus empregados uma copia dos seus Atestados de Saúde Ocupacional – ASO, tanto adimensionais, quanto demissionais ou periódicos, e, ainda, copia dos exames complementares, quando requeridos pelo empregado. |empreg compromet fornec empreg cop atest saúd ocupacional aso tant adimension quant demission periód aind cop exam complement requer empreg
2015_043120|Acceptance of Medical Certificates|Serão aceitos os atestados médico/odontológico expedidos pelo ambulatório do Sindicato profissional ou serviço conveniado, para justificação das ausências ao serviço, por doença, inclusive pagamento das diárias relativas ao afastamento e repousos remunerados, desde que ratificados pelo médico da empresa ou serviço conveniado; |aceit atest médicoodontológ exped ambulatóri sindicat profissional servic conveni justific ausênc servic doenc inclusiv pagament diár relat afast repous remuner desd ratific médic empres servic conveni
2015_043120|First Aid|A empresa manterá medicamentos básicos em local apropriado e de fácil acesso para primeiros socorros, em todos os turnos de trabalho;  |empres mant medic básic local apropri fácil acess primeir socorr tod turn trabalh
2012_032551|Acceptance of Medical Certificates|Os atestados médicos ou odontológicos fornecidos por facultativos do Sindicato ou por conveniados serão aceitos pela(s) empresa(s).  PARÁGRAFO ÚNICO  Caso a(s) empresa(s) mantenha(m) atendimento médico/odontológico próprio ou convênios assinados neste sentido, em favor e sem ônus para seus empregados, os atestados emitidos por estes, prevalecerão sobre os demais. |atest médic odontológ fornec facult sindicat conveni aceit s empres s parágraf únic cas s empres s mantenh m atend médicoodontológ própri convêni assin nest sent favor ônus empreg atest emit prevalec sobr dem
2015_043084|Health Care|Os empregadores deverão instituir plano de saúde ambulatorial em grupo, em benefício dos integrantes da categoria profissional, ficando estabelecido que o desconto mensal do salário correspondente a participação dos empregados no custeio do plano não poderá ser superior a 5% (cinco por cento) do piso normativo estabelecido na presente convenção coletiva, e não ultrapassará o valor total de custeio do mesmo.  Parágrafo Primeiro - O empregado que não deseje integrar o plano de saúde instituído pelo seu empregador por participar de outro, deverá fazê-lo por escrito, comprovando essa condição.  Parágrafo Seguno - As empresas interessadas em oferecer aos seus empregados plano mais abrangente do que o estabelececido no caput desta cláusula, inclusive com atendimento hospitalar, poderão empreender negociação direta com o sindicato dos empregados, hipótese de que a participação dos empregados poderá ser superior a estabelecida no caput desta cláusula.   |empreg dev institu plan saúd ambulatorial grup benefíci integr categor profissional fic estabelec descont mensal salári correspondent particip empreg custei plan pod superior cinc cent pis normat estabelec present convençã colet ultrapass valor total custei parágraf primeir empreg desej integr plan saúd instituíd empreg particip outr dev fazêl escrit comprov condiçã parágraf segun empres interess oferec empreg plan abrangent estabelecec caput dest cláusul inclusiv atend hospital pod empreend negoc diret sindicat empreg hipótes particip empreg pod superior estabelec caput dest cláusul
2015_043084|Medical Exams|Fica reconhecida, nos termos da NR7, da Portaria 3214/78 do Mtb, a obrigatoriedade da realização, por conta do empregador, dos exames médicos admissionais, periódicos e demissionais previstos na referida norma, que compreenderão a avaliação clínica do empregado.  Parágrafo Primeiro - Os empregadores ficam obrigados a entregar ao empregado o Atestado de Saúde Ocupacional.  Parágrafo Segundo -  Ficam desobrigadas de indicar médico coordenador do PCMSO as empresas com até 20 (vinte) empregados.  Parágrafo Terceiro - As empresas somente estarão obrigadas a realizar o exame médico demissional até a data da homologação da rescisão contratual, caso o último exame ocupacional do empregado tenha sido realizado a mais de 180 (cento e oitenta) dias. |fic reconhec term port mtb obrigatoriedad realiz cont empreg exam médic admission periód demission previst refer norm compreend avali clínic empreg parágraf primeir empreg fic obrig entreg empreg atest saúd ocupacional parágraf segund fic desobrig indic médic coorden pcmso empres vint empreg parágraf terceir empres soment estarã obrig realiz exam médic demissional dat homolog rescisã contratual cas últim exam ocupacional empreg sid realiz cent oitent dias
2015_043084|Acceptance of Medical Certificates|Os empregadores reconhecerão como válidos os atestados médicos e odontológicos fornecidos por profissionais que prestem serviços a entidade profissional convenente. |empreg reconhec vál atest médic odontológ fornec profission prest servic entidad profissional convenent
