2013_073403|Awards|No dia 20 de cada mês, no cartão vale alimentação no valor de R$ 57,00 ( cinquenta e sete ) reais aqueles funcionários que não tiverem ausencia superior a 4 h no mes, desde que estas horas estejam devidamente atestadas. Paragrafo Primeiro : o premio assiduidade pactuado pelo presente instrumento não incorporará aos salários,nem tampouco haverá incidencia de INSS ou quaisquer encargos trabalhistas. |dia cad mês cartã val aliment valor r cinquent set rea funcionári ausenc superior h mes desd hor devid atest paragraf primeir premi assidu pactu present instrument incorpor salári tampouc hav incidenc inss quaisqu encarg trabalh|0.0|0.0|0.0|0.0|0.0|0.0|0.0|0.0|0.14742777328309153|0.0|0.0|0.0|0.0|0.0|0.0|0.0|0.0|0.0|0.0|0.0|0.0|0.0|0.0|0.0|0.0|0.160451060549974|0.0|0.0|0.0|0.17724099800954266|0.0|0.0|0.0|0.0|0.0|0.17724099800954266|0.0|0.0|0.0|0.0|0.0|0.0|0.0|0.14742777328309153|0.0|0.0|0.0|0.0|0.0|0.0|0.160451060549974|0.0|0.0|0.0|0.0|0.0|0.0|0.0|0.0|0.0|0.17724099800954266|0.0|0.0|0.0|0.0|0.0|0.0|0.0|0.0|0.0|0.0|0.0|0.0|0.0|0.0|0.0|0.0|0.0|0.0|0.0|0.0|0.0|0.0|0.0|0.0|0.0|0.0|0.0|0.0|0.0|0.0|0.0|0.0|0.0|0.0|0.0|0.0|0.0|0.0|0.0|0.0|0.0|0.0|0.0|0.0|0.0|0.0|0.0|0.0|0.0|0.0|0.0|0.0|0.0|0.0|0.2009050857615328|0.0|0.0|0.0|0.0|0.2009050857615328|0.0|0.0|0.14742777328309153|0.0|0.0|0.0|0.0|0.0|0.0|0.0|0.0|0.0|0.0|0.0|0.0|0.0|0.0|0.0|0.17724099800954266|0.0|0.0|0.0|0.0|0.0|0.0|0.0|0.0|0.0|0.0|0.0|0.0|0.0|0.0|0.0|0.0|0.0|0.0|0.0|0.0|0.0|0.0|0.0|0.0|0.0|0.0|0.0|0.0|0.0|0.0|0.0|0.0|0.160451060549974|0.0|0.0|0.0|0.0|0.0|0.0|0.0|0.0|0.0|0.17724099800954266|0.160451060549974|0.0|0.0|0.0|0.0|0.0|0.0|0.0|0.2009050857615328|0.0|0.2009050857615328|0.0|0.0|0.0|0.0|0.0|0.2009050857615328|0.2009050857615328|0.0|0.0|0.0|0.0|0.0|0.0|0.0|0.0|0.0|0.0|0.0|0.0|0.0|0.0|0.0|0.0|0.0|0.0|0.0|0.0|0.0|0.0|0.0|0.0|0.0|0.0|0.0|0.0|0.0|0.14742777328309153|0.0|0.0|0.0|0.0|0.0|0.0|0.0|0.0|0.0|0.0|0.0|0.14742777328309153|0.0|0.0|0.0|0.0|0.0|0.0|0.0|0.0|0.0|0.0|0.0|0.0|0.0|0.0|0.0|0.0|0.0|0.0|0.0|0.0|0.0|0.0|0.0|0.0|0.2009050857615328|0.0|0.0|0.0|0.160451060549974|0.0|0.0|0.0|0.0|0.0|0.0|0.0|0.0|0.0|0.0|0.0|0.0|0.0|0.0|0.0|0.0|0.0|0.0|0.0|0.0|0.160451060549974|0.0|0.14742777328309153|0.0|0.0|0.0|0.0|0.160451060549974|0.0|0.0|0.0|0.0|0.0|0.0|0.0|0.0|0.0|0.0|0.0|0.0|0.2009050857615328|0.0|0.0|0.0|0.0|0.0|0.0|0.12779030417837958|0.0|0.0|0.0|0.0|0.0|0.0|0.0|0.0|0.0|0.0|0.0|0.0|0.0|0.0|0.0|0.0|0.0|0.0|0.0|0.0|0.0|0.12779030417837958|0.0|0.0|0.0|0.0|0.0|0.0|0.0|0.0|0.0|0.0|0.0|0.0|0.2009050857615328|0.0|0.0|0.0|0.0|0.0|0.0|0.0|0.0|0.0|0.0|0.2009050857615328|0.0|0.2009050857615328|0.0|0.0|0.0|0.0|0.0|0.0|0.10697374807153273|0.0|0.0|0.0|0.0|0.0|0.0|0.0|0.0|0.0|0.17724099800954266|0.11312288504599372|0.0|0.0|0.0|0.0|0.0|0.0|0.0|0.0|0.0|0.0
2013_073403|Awards|"As ausencias ( nem mesmo as 4 h compravadas) ao final do período ( junho / 13 a maio / 2014 ) receberão um  ""Plus"", que consiste em um crédito de mais  R$ 96,00 ( noventa e seis ) reais , no cartão alimentação. "|ausenc h comprav final períod junh mai receb plus cons crédit r novent seis rea cartã aliment|0.0|0.0|0.0|0.0|0.0|0.0|0.0|0.0|0.21210246206454364|0.0|0.0|0.0|0.0|0.0|0.0|0.0|0.0|0.0|0.0|0.0|0.0|0.0|0.0|0.0|0.0|0.0|0.0|0.0|0.0|0.0|0.0|0.0|0.0|0.0|0.0|0.2549943692387874|0.0|0.0|0.0|0.0|0.0|0.0|0.0|0.0|0.0|0.0|0.0|0.0|0.0|0.0|0.23083889979242997|0.0|0.0|0.0|0.0|0.0|0.0|0.0|0.0|0.0|0.0|0.0|0.0|0.0|0.0|0.0|0.0|0.2890395912680898|0.0|0.0|0.0|0.0|0.0|0.0|0.0|0.0|0.0|0.0|0.0|0.2890395912680898|0.0|0.0|0.0|0.0|0.0|0.0|0.0|0.0|0.0|0.0|0.0|0.0|0.0|0.0|0.2890395912680898|0.0|0.0|0.0|0.0|0.0|0.0|0.0|0.0|0.0|0.0|0.0|0.0|0.0|0.0|0.0|0.0|0.0|0.0|0.0|0.0|0.0|0.0|0.0|0.0|0.0|0.0|0.0|0.0|0.0|0.0|0.0|0.0|0.0|0.0|0.0|0.0|0.0|0.0|0.0|0.0|0.0|0.0|0.0|0.0|0.0|0.0|0.0|0.0|0.0|0.0|0.0|0.0|0.0|0.0|0.0|0.0|0.0|0.0|0.0|0.0|0.0|0.0|0.0|0.0|0.0|0.0|0.0|0.0|0.2549943692387874|0.0|0.0|0.0|0.0|0.0|0.0|0.0|0.0|0.0|0.0|0.0|0.0|0.0|0.0|0.0|0.0|0.0|0.0|0.0|0.0|0.0|0.0|0.0|0.0|0.0|0.0|0.0|0.0|0.0|0.0|0.0|0.0|0.0|0.0|0.0|0.0|0.0|0.0|0.0|0.0|0.0|0.0|0.0|0.0|0.0|0.2890395912680898|0.0|0.0|0.0|0.0|0.0|0.0|0.0|0.0|0.0|0.0|0.2890395912680898|0.0|0.0|0.0|0.0|0.0|0.0|0.0|0.0|0.0|0.0|0.0|0.0|0.0|0.0|0.0|0.0|0.0|0.0|0.0|0.0|0.0|0.0|0.0|0.0|0.0|0.0|0.0|0.0|0.0|0.0|0.0|0.0|0.2549943692387874|0.0|0.0|0.0|0.0|0.0|0.0|0.0|0.0|0.0|0.0|0.0|0.0|0.0|0.0|0.0|0.0|0.0|0.0|0.0|0.0|0.0|0.0|0.0|0.0|0.0|0.2890395912680898|0.0|0.2549943692387874|0.0|0.0|0.0|0.0|0.0|0.0|0.0|0.0|0.0|0.0|0.0|0.0|0.0|0.0|0.0|0.0|0.0|0.0|0.0|0.0|0.0|0.0|0.0|0.0|0.0|0.0|0.0|0.0|0.0|0.0|0.0|0.0|0.0|0.0|0.0|0.0|0.0|0.18385028506239992|0.0|0.0|0.0|0.23083889979242997|0.0|0.0|0.0|0.0|0.0|0.0|0.0|0.0|0.0|0.0|0.0|0.0|0.0|0.0|0.0|0.0|0.0|0.0|0.0|0.0|0.0|0.0|0.23083889979242997|0.0|0.0|0.0|0.0|0.0|0.0|0.0|0.0|0.0|0.0|0.0|0.0|0.0|0.0|0.0|0.0|0.0|0.0|0.0|0.0|0.0|0.0|0.0|0.0|0.0|0.0|0.0|0.0|0.0|0.0|0.0|0.0|0.0|0.0|0.0|0.0|0.0|0.0|0.0|0.0|0.0|0.0|0.0|0.0|0.0|0.0|0.0|0.0|0.0
2013_073403|Awards|não se aplicam a liderança. Paragrafo primeiro: A liderança receberá um premio Produtividade mensal, quando cumprida a meta de 16 metros cubicos de produção e 1.000 cubicos de serraria , sendo creditado no cartão alimentação o mesmo valor em igual prazo.Paragrafo segundo : O plus funcionará da mesma forma, ou seja atingirem todos os meses receberão o Plus. |aplic lider paragraf primeir lider receb premi produt mensal cumpr met metr cubic produçã cubic serr send credit cartã aliment valor igual prazoparagraf segund plus funcion mesm form ating tod mes receb plus|0.0|0.0|0.0|0.0|0.0|0.0|0.0|0.0|0.12793208686622015|0.0|0.0|0.0|0.0|0.0|0.0|0.0|0.0|0.0|0.0|0.0|0.15380284358003618|0.0|0.0|0.0|0.0|0.0|0.0|0.0|0.0|0.0|0.17433761842252285|0.0|0.0|0.0|0.0|0.0|0.0|0.0|0.0|0.0|0.0|0.0|0.0|0.0|0.0|0.0|0.0|0.0|0.0|0.0|0.13923318896393208|0.0|0.0|0.0|0.0|0.0|0.0|0.0|0.0|0.0|0.0|0.0|0.0|0.0|0.0|0.0|0.0|0.0|0.0|0.0|0.0|0.0|0.0|0.0|0.0|0.0|0.0|0.0|0.0|0.0|0.0|0.0|0.0|0.0|0.0|0.0|0.0|0.0|0.0|0.0|0.0|0.0|0.17433761842252285|0.0|0.0|0.0|0.3486752368450457|0.15380284358003618|0.0|0.0|0.0|0.0|0.0|0.0|0.0|0.0|0.0|0.0|0.0|0.0|0.0|0.0|0.0|0.0|0.0|0.0|0.0|0.0|0.0|0.0|0.0|0.0|0.0|0.0|0.0|0.0|0.0|0.0|0.0|0.0|0.0|0.0|0.0|0.0|0.0|0.0|0.0|0.0|0.0|0.0|0.0|0.0|0.0|0.0|0.0|0.0|0.0|0.0|0.0|0.0|0.0|0.0|0.0|0.0|0.0|0.0|0.0|0.0|0.0|0.0|0.0|0.0|0.0|0.0|0.0|0.0|0.0|0.0|0.15380284358003618|0.0|0.0|0.17433761842252285|0.0|0.0|0.0|0.0|0.0|0.0|0.0|0.0|0.0|0.0|0.0|0.0|0.0|0.0|0.0|0.17433761842252285|0.0|0.0|0.0|0.0|0.0|0.0|0.0|0.0|0.0|0.0|0.0|0.0|0.0|0.0|0.0|0.0|0.0|0.0|0.0|0.0|0.0|0.0|0.0|0.0|0.0|0.0|0.0|0.0|0.0|0.0|0.3486752368450457|0.0|0.0|0.0|0.0|0.0|0.0|0.0|0.0|0.0|0.12793208686622015|0.0|0.12793208686622015|0.11869841412144541|0.17433761842252285|0.17433761842252285|0.0|0.0|0.0|0.0|0.0|0.0|0.0|0.0|0.0|0.0|0.0|0.0|0.0|0.0|0.0|0.0|0.0|0.0|0.0|0.0|0.0|0.0|0.0|0.0|0.0|0.0|0.0|0.0|0.0|0.0|0.0|0.0|0.0|0.0|0.0|0.0|0.0|0.13923318896393208|0.0|0.0|0.0|0.0|0.0|0.0|0.0|0.0|0.0|0.30760568716007236|0.0|0.0|0.0|0.0|0.0|0.0|0.0|0.17433761842252285|0.0|0.0|0.13923318896393208|0.0|0.0|0.0|0.0|0.0|0.0|0.13923318896393208|0.0|0.17433761842252285|0.17433761842252285|0.0|0.0|0.0|0.0|0.0|0.0|0.0|0.0|0.0|0.0|0.0|0.0|0.0|0.0|0.0|0.0|0.0|0.0|0.0|0.0|0.27846637792786416|0.0|0.0|0.0|0.0|0.0|0.0|0.0|0.0|0.0|0.0|0.0|0.0|0.0|0.0|0.0|0.0|0.0|0.0|0.0|0.0|0.17433761842252285|0.0|0.0|0.0|0.13923318896393208|0.0|0.0|0.17433761842252285|0.0|0.0|0.0|0.0|0.0|0.0|0.0|0.0|0.0|0.0|0.0|0.0|0.0|0.0|0.0|0.0|0.0|0.0|0.0|0.09816363927895871|0.0|0.0|0.0|0.0|0.0|0.0|0.0|0.0|0.0|0.0|0.0|0.0|0.0|0.09816363927895871|0.0|0.0|0.0|0.0|0.0|0.0|0.0|0.0|0.0|0.0
2013_073403|Awards|serão aqueles fixados em Convenção Coletiva de Trabalho celebrada em ambito intermunicipal entre o sindicato dos Trabalhadores e Sindicato Patronal.Nos temos do artigo 3 ( terceiro ) da Lei 10.101/2000, os valores pagos a titlulo de PLR não integrarão a remuneração do empregado e , portanto, não constitui base de incidência de qualquer encargo trabalhista ou previdenciario, não se lhe aplicando, tambem o principio de habitualidade.|fix convençã colet trabalh celebr ambit intermunicipal sindicat trabalh sindicat patronaln artig terceir lei valor pag titlul plr integr remuner empreg portant constitu bas incident qualqu encarg trabalh previdenciari aplic tamb principi habitual|0.0|0.0|0.0|0.0|0.0|0.0|0.0|0.0|0.0|0.0|0.18479449154552918|0.0|0.0|0.0|0.0|0.0|0.0|0.0|0.0|0.0|0.1630280288029763|0.0|0.0|0.1630280288029763|0.0|0.0|0.0|0.0|0.0|0.0|0.0|0.0|0.0|0.0|0.0|0.0|0.0|0.0|0.1630280288029763|0.0|0.0|0.0|0.0|0.0|0.0|0.0|0.0|0.0|0.0|0.0|0.0|0.0|0.0|0.0|0.18479449154552918|0.0|0.0|0.0|0.0|0.0|0.0|0.0|0.18479449154552918|0.0|0.0|0.0|0.0|0.0|0.0|0.0|0.0|0.0|0.0|0.0|0.0|0.0|0.0|0.0|0.0|0.0|0.0|0.0|0.18479449154552918|0.0|0.0|0.0|0.0|0.0|0.0|0.1630280288029763|0.0|0.0|0.0|0.0|0.0|0.0|0.0|0.0|0.0|0.0|0.0|0.0|0.0|0.0|0.0|0.0|0.0|0.0|0.0|0.0|0.0|0.0|0.0|0.0|0.0|0.0|0.0|0.0|0.0|0.0|0.0|0.0|0.0|0.0|0.0|0.0|0.0|0.0|0.0|0.0|0.0|0.0|0.0|0.0|0.0|0.0|0.0766290522772238|0.0|0.0|0.1630280288029763|0.0|0.0|0.0|0.0|0.0|0.0|0.0|0.0|0.0|0.0|0.0|0.0|0.0|0.0|0.0|0.0|0.0|0.0|0.0|0.0|0.0|0.0|0.0|0.0|0.0|0.18479449154552918|0.0|0.0|0.0|0.0|0.0|0.0|0.0|0.0|0.0|0.0|0.0|0.0|0.0|0.0|0.0|0.18479449154552918|0.0|0.0|0.0|0.0|0.0|0.0|0.0|0.0|0.0|0.0|0.18479449154552918|0.0|0.0|0.0|0.0|0.0|0.0|0.0|0.0|0.18479449154552918|0.18479449154552918|0.0|0.0|0.0|0.0|0.0|0.0|0.0|0.0|0.0|0.0|0.0|0.0|0.0|0.1630280288029763|0.0|0.0|0.0|0.0|0.0|0.0|0.0|0.0|0.0|0.0|0.0|0.0|0.0|0.0|0.0|0.0|0.0|0.0|0.0|0.0|0.0|0.0|0.0|0.0|0.0|0.0|0.0|0.0|0.0|0.0|0.0|0.0|0.0|0.0|0.0|0.0|0.0|0.0|0.0|0.0|0.0|0.0|0.0|0.0|0.0|0.0|0.0|0.0|0.0|0.0|0.0|0.0983955150197767|0.0|0.0|0.0|0.0|0.0|0.0|0.18479449154552918|0.0|0.0|0.0|0.0|0.18479449154552918|0.0|0.0|0.0|0.0|0.0|0.0|0.0|0.18479449154552918|0.0|0.0|0.0|0.0|0.0|0.0|0.0|0.18479449154552918|0.0|0.0|0.0|0.18479449154552918|0.0|0.0|0.0|0.0|0.0|0.0|0.0|0.0|0.0|0.0|0.0|0.0|0.1475844777143542|0.0|0.0|0.0|0.0|0.0|0.0|0.0|0.0|0.0|0.0|0.0|0.0|0.0|0.0|0.0|0.0|0.0|0.13560552885095167|0.0|0.0|0.0|0.0|0.0|0.0|0.0|0.0|0.0|0.0|0.0|0.0|0.0|0.0|0.0|0.0|0.0|0.0|0.0|0.0|0.0|0.0|0.0|0.0|0.0|0.0|0.0|0.3260560576059526|0.0|0.0|0.0|0.0|0.0|0.0|0.18479449154552918|0.0|0.0|0.18479449154552918|0.18479449154552918|0.0|0.0|0.0|0.2951865450593301|0.0|0.0|0.0|0.0|0.0|0.0|0.0|0.0|0.0|0.0|0.10405155222924839|0.0|0.0|0.0|0.0|0.0|0.0|0.0|0.0|0.0|0.0
2017_039364|Tenure Pay|Fica assegurado um adicional a cada quinquênio de serviço na empresa, correspondente a 6% (seis por cento) calculado sobre o salário base da categoria. |fic assegur adicional cad quinquêni servic empres correspondent seis cent calcul sobr salári bas categor|0.0|0.0|0.0|0.0|0.0|0.26712420580442026|0.0|0.0|0.0|0.0|0.0|0.0|0.0|0.0|0.0|0.0|0.0|0.0|0.0|0.0|0.0|0.0|0.0|0.0|0.29507664621846336|0.0|0.0|0.0|0.0|0.0|0.0|0.0|0.0|0.0|0.0|0.0|0.0|0.0|0.29507664621846336|0.0|0.0|0.0|0.0|0.24544260858590092|0.0|0.29507664621846336|0.0|0.0|0.0|0.0|0.0|0.0|0.0|0.3344733982571802|0.0|0.0|0.19977501335166029|0.0|0.0|0.0|0.0|0.0|0.0|0.0|0.0|0.0|0.0|0.0|0.0|0.0|0.0|0.0|0.0|0.0|0.0|0.0|0.0|0.0|0.0|0.0|0.0|0.0|0.0|0.0|0.0|0.0|0.0|0.0|0.0|0.0|0.0|0.29507664621846336|0.0|0.0|0.0|0.0|0.0|0.0|0.0|0.0|0.0|0.0|0.0|0.0|0.0|0.0|0.0|0.0|0.0|0.0|0.0|0.0|0.0|0.0|0.0|0.0|0.0|0.0|0.0|0.0|0.0|0.0|0.0|0.0|0.0|0.0|0.0|0.0|0.0|0.0|0.0|0.0|0.0|0.0|0.0|0.0|0.0|0.0|0.1386966640944241|0.0|0.0|0.0|0.0|0.0|0.0|0.0|0.0|0.0|0.0|0.0|0.0|0.0|0.0|0.0|0.0|0.0|0.0|0.0|0.0|0.0|0.0|0.19977501335166029|0.0|0.0|0.0|0.0|0.0|0.0|0.0|0.0|0.0|0.0|0.0|0.0|0.0|0.0|0.0|0.0|0.0|0.0|0.0|0.0|0.0|0.0|0.0|0.0|0.0|0.0|0.0|0.0|0.0|0.0|0.0|0.0|0.0|0.0|0.0|0.0|0.0|0.0|0.0|0.0|0.0|0.0|0.0|0.0|0.0|0.0|0.0|0.0|0.0|0.0|0.0|0.0|0.0|0.0|0.0|0.0|0.0|0.0|0.0|0.0|0.0|0.0|0.0|0.0|0.0|0.0|0.0|0.0|0.0|0.0|0.0|0.0|0.0|0.0|0.0|0.0|0.0|0.0|0.0|0.0|0.0|0.0|0.0|0.0|0.0|0.0|0.0|0.0|0.0|0.0|0.0|0.0|0.0|0.0|0.0|0.0|0.0|0.0|0.0|0.0|0.0|0.0|0.0|0.0|0.0|0.0|0.0|0.0|0.0|0.0|0.0|0.0|0.0|0.0|0.0|0.0|0.0|0.0|0.0|0.0|0.0|0.0|0.0|0.0|0.0|0.0|0.0|0.0|0.0|0.0|0.0|0.0|0.0|0.0|0.0|0.0|0.0|0.0|0.0|0.0|0.0|0.0|0.0|0.0|0.0|0.0|0.0|0.0|0.0|0.0|0.0|0.0|0.0|0.0|0.0|0.0|0.29507664621846336|0.0|0.0|0.0|0.0|0.0|0.0|0.0|0.0|0.0|0.0|0.0|0.0|0.0|0.0|0.0|0.0|0.0|0.0|0.0|0.0|0.0|0.0|0.21274950378107965|0.0|0.0|0.0|0.0|0.26712420580442026|0.0|0.0|0.0|0.0|0.0|0.21274950378107965|0.0|0.0|0.0|0.0|0.0|0.0|0.0|0.0|0.24544260858590092|0.0|0.0|0.0|0.0|0.0|0.0|0.0|0.0|0.0|0.0|0.0|0.0|0.0|0.0|0.0|0.0|0.0|0.0|0.0|0.0|0.0|0.0|0.0|0.0|0.0|0.0|0.0|0.0|0.0|0.0|0.0|0.0|0.0|0.0
2013_073410|Other Bonuses| a)  Sempre que ocorrer promoção, a mesma deverá ser comunicada por escrito ao empregado e obrigatoriamente anotada na CTPS. b)    A toda promoção para função sem paradigma será garantido reajuste salarial, de acordo com a política de salários, de cada empresa, respeitando aumento mínimo de 10% (dez por cento). c)   Havendo paradigma, será garantido o menor salário da função. d)    O aumento por promoção não será compensado nem deduzido por ocasião da primeira data-base subseqüente, garantido-se à empresa o direito de compensar reajustes espontâneos e antecipações havidas entre a data-base passada e a data da promoção. |sempr ocorr promoçã mesm dev comunic escrit empreg obrigatori anot ctps b tod promoçã funçã paradigm garant reajust salarial acord polít salári cad empres respeit aument mínim dez cent c hav paradigm garant menor salári funçã d aument promoçã compens deduz ocasiã primeir databas subsequent garantidos empres direit compens reajust espontân antecip hav databas pass dat promoçã|0.0|0.0|0.0|0.0|0.08738678591983322|0.0|0.0|0.0|0.0|0.0|0.0|0.0|0.0|0.11908509047299262|0.0|0.0|0.105058367255784|0.0|0.0|0.0|0.0|0.0|0.0|0.0|0.0|0.0|0.0|0.0|0.0|0.0|0.0|0.0|0.0|0.0|0.23817018094598524|0.0|0.0|0.0|0.0|0.0|0.0|0.0|0.0|0.08738678591983322|0.0|0.0|0.0|0.0|0.0|0.0|0.0|0.0|0.0|0.0|0.0|0.0|0.07112740703203312|0.0|0.0|0.0|0.0|0.0|0.0|0.0|0.0|0.210116734511568|0.0|0.0|0.0|0.0|0.0|0.11908509047299262|0.0|0.0|0.0|0.0|0.0|0.0|0.0|0.0|0.0|0.0|0.0|0.0|0.0|0.0|0.0|0.0|0.0|0.0|0.0|0.0|0.0|0.0|0.0|0.11908509047299262|0.0|0.0|0.0|0.0|0.0|0.0|0.0|0.0|0.11908509047299262|0.23817018094598524|0.11908509047299262|0.0|0.0|0.0|0.0|0.0|0.0|0.0|0.0|0.0|0.0|0.0|0.0|0.09510624875251286|0.0|0.105058367255784|0.0|0.0|0.0|0.0|0.09510624875251286|0.0|0.0|0.0|0.0|0.0|0.0|0.0|0.0|0.0|0.04938122098214486|0.0|0.09876244196428972|0.0|0.0|0.0|0.0|0.11908509047299262|0.0|0.11908509047299262|0.0|0.0|0.0|0.0|0.0|0.0|0.0|0.0|0.0|0.0|0.0|0.0|0.0|0.0|0.0|0.0|0.0|0.0|0.0|0.0|0.0|0.0|0.0|0.0|0.0|0.0|0.0|0.23817018094598524|0.0|0.0|0.17477357183966644|0.11908509047299262|0.0|0.0|0.0|0.0|0.210116734511568|0.0|0.0|0.0|0.0|0.0|0.0|0.0|0.0|0.0|0.0|0.0|0.0|0.0|0.0|0.0|0.0|0.0|0.0|0.0|0.0|0.0|0.0|0.0|0.0|0.0|0.0|0.0|0.0|0.0|0.0|0.0|0.0|0.0|0.0|0.0|0.0|0.0|0.0|0.0|0.0|0.0|0.0|0.0|0.0|0.11908509047299262|0.0|0.0|0.0|0.08107952553530426|0.0|0.0|0.0|0.0|0.0|0.0|0.0|0.0|0.0|0.0|0.0|0.11908509047299262|0.0|0.0|0.0|0.0|0.0|0.0|0.0|0.0|0.0|0.0|0.0|0.0|0.0|0.0|0.105058367255784|0.11908509047299262|0.105058367255784|0.0|0.0|0.0|0.0|0.0|0.0|0.0|0.0|0.0|0.23817018094598524|0.0|0.0|0.0|0.11908509047299262|0.0|0.0|0.0|0.0|0.0|0.0|0.0|0.0|0.0|0.11908509047299262|0.0|0.0|0.0|0.0|0.0|0.0|0.0|0.0|0.0|0.0|0.0|0.0|0.0|0.0|0.09510624875251286|0.0|0.0|0.0|0.4763403618919705|0.0|0.0|0.0|0.0|0.0|0.0|0.0|0.0|0.0|0.0|0.0|0.0|0.0|0.0|0.0|0.0|0.23817018094598524|0.0|0.0|0.0|0.0|0.0|0.0|0.0|0.0|0.0|0.0|0.0|0.0|0.0|0.0|0.0|0.11908509047299262|0.0|0.0|0.0|0.09510624875251286|0.15149362572848665|0.0|0.0|0.0|0.0|0.0|0.105058367255784|0.0|0.0|0.0|0.0|0.0|0.0|0.0|0.0|0.0|0.0|0.0|0.0|0.0|0.0|0.0|0.11908509047299262|0.0|0.0|0.0|0.0|0.0|0.0|0.0|0.06705280231809563|0.0|0.0|0.0|0.0|0.0|0.0|0.0|0.0|0.0|0.0|0.0|0.0|0.0|0.0|0.0|0.0|0.0|0.0|0.0|0.0|0.0|0.0|0.0|0.0
2010_074884|Other Bonuses|As partes recomendam que sejam tomadas providencias para que seja concedida aos empregados com contrato de trabalho na vigência do presente acordo, assistência médica, assistência odontológica (extensiva aos dependentes considerados conforme critérios de elegibilidade atualmente vigente na empresa), vale refeição, seguro de vida em grupo e vale transporte, cabendo à empresa a sistemática e o modelo de administração dos benefícios mencionados. PARÁGRAFO ÚNICO - Nenhum dos benefícios acima mencionados tem cunho salarial para qualquer fim ou efeito.|part recomend tom providenc conced empreg contrat trabalh vigênc present acord assistent médic assistent odontológ extens dependent consider conform critéri elegibil atual vigent empres val refeiçã segur vid grup val transport cab empres sistemát model administr benefíci mencion parágraf únic nenhum benefíci acim mencion cunh salarial qualqu fim efeit|0.0|0.0|0.0|0.12843124255926555|0.10682817363437389|0.0|0.14557856303336916|0.0|0.0|0.0|0.0|0.0|0.0|0.0|0.0|0.0|0.0|0.0|0.0|0.0|0.0|0.0|0.0|0.0|0.0|0.0|0.0|0.2911571260667383|0.0|0.0|0.0|0.0|0.14557856303336916|0.0|0.0|0.0|0.0|0.0|0.0|0.0|0.2568624851185311|0.0|0.14557856303336916|0.0|0.0|0.0|0.0|0.0|0.0|0.0|0.0|0.0|0.0|0.0|0.0|0.0|0.0|0.0|0.0|0.0|0.0|0.0|0.0|0.0|0.0|0.0|0.0|0.0|0.0|0.0|0.0|0.0|0.0|0.12843124255926555|0.0|0.0|0.0|0.0|0.12843124255926555|0.0|0.14557856303336916|0.0|0.0|0.0|0.0|0.0|0.12843124255926555|0.0|0.0|0.0|0.0|0.0|0.0|0.14557856303336916|0.0|0.0|0.0|0.0|0.0|0.14557856303336916|0.0|0.0|0.0|0.0|0.0|0.0|0.0|0.0|0.0|0.0|0.12843124255926555|0.0|0.0|0.0|0.0|0.0|0.0|0.0|0.0|0.0|0.0|0.0|0.0|0.0|0.0|0.0|0.0|0.0|0.0|0.0|0.0|0.0|0.0|0.0|0.12843124255926555|0.14557856303336916|0.06036731519336815|0.0|0.1207346303867363|0.0|0.0|0.0|0.0|0.0|0.0|0.0|0.0|0.0|0.0|0.0|0.0|0.14557856303336916|0.0|0.0|0.0|0.0|0.0|0.0|0.0|0.0|0.0|0.0|0.14557856303336916|0.0|0.0|0.0|0.0|0.0|0.0|0.0|0.0|0.0|0.0|0.0|0.0|0.0|0.0|0.0|0.0|0.0|0.14557856303336916|0.0|0.0|0.0|0.0|0.0|0.0|0.0|0.0|0.0|0.0|0.0|0.0|0.0|0.0|0.0|0.0|0.0|0.0|0.0|0.0|0.0|0.0|0.0|0.0|0.0|0.0|0.0|0.0|0.0|0.0|0.0|0.0|0.0|0.0|0.0|0.0|0.0|0.0|0.0|0.0|0.0|0.0|0.0|0.0|0.0|0.2911571260667383|0.0|0.0|0.0|0.0|0.0|0.0|0.0|0.0|0.0|0.14557856303336916|0.0|0.0|0.0|0.0|0.14557856303336916|0.0|0.0|0.0|0.0|0.0|0.14557856303336916|0.0|0.0|0.0|0.0|0.0|0.0|0.0|0.0|0.0|0.0|0.0|0.0|0.0|0.14557856303336916|0.0|0.0|0.0|0.0|0.0|0.0|0.0|0.0|0.0|0.0|0.08695148709956492|0.09911770459236344|0.0|0.0|0.0|0.0|0.0|0.0|0.0|0.0|0.0|0.0|0.0|0.0|0.0|0.0|0.0|0.0|0.0|0.0|0.0|0.0|0.10682817363437389|0.0|0.0|0.0|0.0|0.0|0.0|0.0|0.0|0.0|0.0|0.0|0.14557856303336916|0.0|0.0|0.0|0.0|0.0|0.0|0.11626502506646705|0.0|0.0|0.0|0.0|0.0|0.0|0.0|0.0|0.0|0.0|0.0|0.0|0.14557856303336916|0.12843124255926555|0.0|0.0|0.0|0.0|0.0|0.0|0.0|0.0|0.0|0.0|0.0|0.0|0.11626502506646705|0.0|0.0|0.0|0.0|0.14557856303336916|0.0|0.0|0.0|0.0|0.0|0.0|0.0|0.0|0.0|0.0|0.0|0.0|0.0|0.0|0.14557856303336916|0.0|0.0|0.0|0.0|0.0|0.0|0.0|0.0|0.0|0.0|0.0|0.0|0.14557856303336916|0.07751463566747177|0.0|0.12843124255926555|0.0|0.0|0.0|0.0|0.0|0.0|0.0|0.2568624851185311|0.0|0.0|0.0|0.14557856303336916|0.0|0.14557856303336916|0.12843124255926555|0.0|0.0|0.11626502506646705|0.0
2014_038173|Other Bonuses|A empresa se compromete a remunerar em dobro o trabalho realizado nos domingos e feriados que não tenham sido compensados.|empres compromet remuner dobr trabalh realiz doming feri sid compens|0.0|0.0|0.0|0.0|0.0|0.0|0.0|0.0|0.0|0.0|0.0|0.0|0.0|0.0|0.0|0.0|0.0|0.0|0.0|0.0|0.0|0.0|0.0|0.0|0.0|0.0|0.0|0.0|0.0|0.0|0.0|0.0|0.0|0.0|0.0|0.0|0.0|0.0|0.0|0.0|0.0|0.0|0.0|0.0|0.0|0.0|0.0|0.0|0.0|0.0|0.0|0.0|0.0|0.0|0.0|0.0|0.0|0.0|0.0|0.0|0.0|0.0|0.0|0.0|0.0|0.33424148537187687|0.0|0.0|0.37886727697213496|0.0|0.0|0.0|0.0|0.0|0.0|0.0|0.0|0.0|0.0|0.0|0.0|0.0|0.0|0.0|0.0|0.0|0.0|0.0|0.0|0.0|0.0|0.0|0.0|0.0|0.0|0.0|0.0|0.0|0.0|0.0|0.0|0.0|0.0|0.0|0.0|0.0|0.0|0.0|0.0|0.0|0.0|0.0|0.0|0.0|0.0|0.0|0.0|0.0|0.0|0.0|0.0|0.0|0.0|0.0|0.0|0.0|0.0|0.0|0.37886727697213496|0.0|0.0|0.33424148537187687|0.0|0.0|0.0|0.0|0.0|0.0|0.15710555076840194|0.0|0.0|0.0|0.0|0.0|0.0|0.0|0.0|0.0|0.0|0.0|0.0|0.0|0.0|0.0|0.0|0.0|0.0|0.0|0.0|0.33424148537187687|0.0|0.0|0.0|0.0|0.0|0.0|0.0|0.0|0.0|0.0|0.0|0.0|0.0|0.0|0.0|0.0|0.0|0.0|0.0|0.0|0.0|0.0|0.0|0.0|0.0|0.0|0.0|0.0|0.0|0.0|0.0|0.0|0.0|0.0|0.0|0.0|0.0|0.0|0.0|0.0|0.0|0.0|0.0|0.0|0.0|0.0|0.0|0.0|0.0|0.0|0.0|0.0|0.0|0.0|0.0|0.0|0.0|0.0|0.0|0.0|0.0|0.0|0.0|0.0|0.0|0.0|0.0|0.0|0.0|0.0|0.0|0.0|0.0|0.0|0.0|0.0|0.0|0.0|0.0|0.0|0.0|0.0|0.0|0.0|0.0|0.0|0.0|0.0|0.0|0.0|0.0|0.0|0.0|0.0|0.0|0.0|0.0|0.0|0.0|0.0|0.0|0.0|0.0|0.0|0.0|0.0|0.0|0.0|0.0|0.0|0.0|0.0|0.0|0.0|0.0|0.0|0.0|0.0|0.0|0.0|0.0|0.0|0.0|0.0|0.0|0.0|0.0|0.0|0.0|0.0|0.0|0.0|0.0|0.0|0.0|0.0|0.0|0.0|0.0|0.0|0.0|0.0|0.0|0.0|0.0|0.0|0.0|0.0|0.0|0.0|0.0|0.0|0.0|0.0|0.0|0.0|0.0|0.0|0.0|0.0|0.0|0.0|0.3025789823459967|0.0|0.0|0.0|0.0|0.0|0.0|0.0|0.0|0.27801963699479826|0.0|0.0|0.0|0.0|0.0|0.0|0.0|0.0|0.0|0.0|0.0|0.0|0.0|0.0|0.0|0.0|0.0|0.0|0.0|0.0|0.0|0.0|0.0|0.0|0.0|0.0|0.37886727697213496|0.0|0.0|0.0|0.0|0.0|0.0|0.0|0.0|0.0|0.0|0.0|0.0|0.0|0.0|0.0|0.20173134236866005|0.0|0.0|0.0|0.0|0.0|0.0|0.0|0.0|0.0|0.0|0.0|0.0|0.0|0.0|0.0|0.0|0.0|0.0|0.0|0.0|0.0
2016_082062|Other Bonuses|INDENIZAÇÃO DE QUEBRA DE CAIXA: O empregado que exercer as funções de caixa terá direito à indenização por “quebra-de-caixa” mensal, no valor de R$ 66,00 (sessenta e seis reais), a partir de 01 de setembro de 2016.  Parágrafo 1º - A conferência dos valores do caixa será sempre realizada na presença do respectivo operador e, se houver impedimento por parte da empresa, ficará aquele isento de qualquer responsabilidade.  Parágrafo 2º - As empresas que não descontam de seus empregados as eventuais diferenças de caixa não estão sujeitas ao pagamento da indenização por “quebra-de-caixa” prevista no “caput” desta cláusula.  |indeniz quebr caix empreg exerc funçõ caix direit indeniz quebradecaix mensal valor r sessent seis rea part setembr parágraf conferent valor caix sempr realiz presenc respect oper imped part empres fic isent qualqu respons parágraf empres descont empreg eventu diferenc caix sujeit pagament indeniz quebradecaix previst caput dest cláusul|0.0|0.0|0.0|0.0|0.0|0.0|0.0|0.0|0.0|0.0|0.0|0.0|0.0|0.0|0.0|0.0|0.0|0.0|0.0|0.0|0.0|0.0|0.0|0.0|0.0|0.0|0.0|0.0|0.0|0.0|0.0|0.0|0.0|0.0|0.0|0.0|0.0|0.0|0.0|0.0|0.0|0.0|0.0|0.0|0.48602155179810275|0.0|0.12150538794952569|0.0|0.0|0.0|0.0|0.0|0.0|0.0|0.0|0.0|0.0|0.0|0.0|0.0|0.0|0.12150538794952569|0.0|0.0|0.0|0.0|0.0|0.0|0.0|0.0|0.0|0.0|0.0|0.0|0.0|0.0|0.0|0.13772801248373404|0.0|0.0|0.0|0.0|0.0|0.0|0.0|0.0|0.0|0.0|0.0|0.0|0.0|0.0|0.0|0.0|0.0|0.0|0.0|0.0|0.0|0.0|0.0|0.0|0.0|0.0|0.0|0.0|0.0|0.0|0.0|0.0|0.0|0.0|0.0|0.0|0.10999525266714973|0.0|0.0|0.12150538794952569|0.0|0.0|0.0|0.0|0.0|0.0|0.0|0.13772801248373404|0.10999525266714973|0.0|0.0|0.0|0.0|0.0|0.0|0.0|0.0|0.0|0.11422382756527057|0.0|0.11422382756527057|0.0|0.0|0.0|0.0|0.0|0.0|0.0|0.0|0.0|0.13772801248373404|0.0|0.13772801248373404|0.0|0.0|0.0|0.0|0.0|0.0|0.0|0.0|0.0|0.0|0.0822624928505654|0.0|0.0|0.0|0.0|0.0|0.0|0.0|0.0|0.0|0.0|0.0|0.0|0.13772801248373404|0.0|0.0|0.0|0.0|0.0|0.0|0.0|0.0|0.0|0.0|0.0|0.0|0.0|0.13772801248373404|0.0|0.0|0.0|0.0|0.0|0.36451616384857705|0.0|0.0|0.0|0.0|0.0|0.0|0.0|0.0|0.0|0.0|0.0|0.13772801248373404|0.0|0.0|0.0|0.0|0.0|0.0|0.0|0.0|0.0|0.0|0.0|0.0|0.0|0.0|0.0|0.0|0.0|0.0|0.0|0.0|0.0|0.10106729813342794|0.0|0.0|0.0|0.0|0.0|0.0|0.0|0.0|0.0|0.0|0.0|0.0|0.0|0.0|0.0|0.0|0.0|0.0|0.0|0.0|0.0|0.0|0.0|0.0|0.0|0.0|0.0|0.0|0.0|0.0|0.0|0.0|0.0|0.0|0.0|0.12150538794952569|0.0|0.0|0.0|0.0|0.10106729813342794|0.0|0.0|0.1645249857011308|0.18754525626588275|0.0|0.0|0.0|0.0|0.0|0.0|0.0|0.0|0.0|0.0|0.0|0.0|0.0|0.0|0.0|0.0|0.0|0.0|0.0|0.13772801248373404|0.0|0.0|0.0|0.0|0.10999525266714973|0.0|0.0|0.0|0.0|0.0|0.0|0.0|0.0|0.0|0.0|0.0|0.0|0.0|0.0|0.10999525266714973|0.0|0.0|0.13772801248373404|0.27545602496746807|0.0|0.08760507252698904|0.0|0.0|0.10999525266714973|0.0|0.0|0.0|0.0|0.0|0.0|0.0|0.0|0.0|0.0|0.0|0.0|0.12150538794952569|0.0|0.13772801248373404|0.0|0.0|0.0|0.0|0.0|0.0|0.0|0.0|0.10999525266714973|0.12150538794952569|0.0|0.0|0.0|0.0|0.0|0.13772801248373404|0.0|0.13772801248373404|0.0|0.0|0.0|0.0|0.0|0.0|0.0|0.0|0.13772801248373404|0.0|0.0|0.0|0.0|0.0|0.0|0.0|0.0|0.0|0.0|0.0|0.0|0.0|0.0|0.0|0.0|0.0|0.0|0.0|0.0|0.15510000719746603|0.0|0.0|0.0|0.0|0.0|0.0|0.0|0.0|0.0|0.0
