|contract_id|title|text|clean_text
0|2016_082054|Other Assistances|"COMPLEMENTAÇÃO DO AUXÍLIO PREVIDENCIÁRIO  A) Ao empregado em gozo de benefício do auxílio previdenciário ou acidentário fica garantida, entre o 16º (décimo sexto) e o 120º (centésimo vigésimo) dia de afastamento, uma complementação de salário em valor equivalente a diferença entre o efetivamente percebido da Previdência Social e o salário nominal, respeitado sempre, para efeito da complementação o limite máximo de 7 (sete) vezes o menor Salário Normativo, vigente na época do evento;  B) Quando o empregado não tiver direito ao auxílio previdenciário ou acidentário, por não ter ainda completado o período de carência exigido pela Previdência Social, a empresa pagará seu salário nominal entre o 16º (décimo sexto) e o 120º (centésimo vigésimo) dia de afastamento, respeitado também o limite máximo de 7 (sete) vezes o menor Salário Normativo, vigente na época do evento;  C) Não sendo conhecido o valor básico do benefício previdenciário ou acidentário, no caso da letra ""A"", a complementação deverá ser paga em valores estimados. Se ocorrerem diferenças, a maior ou a menor, deverão ser compensadas no pagamento imediatamente posterior;  D) O pagamento previsto nesta cláusula deverá ocorrer junto com o pagamento mensal dos demais empregados.   26 - ABONO POR APOSENTADORIA  Aos empregados com 5 (cinco) anos ou mais de serviços contínuos dedicados à empresa, quando dela vier a desligar-se definitivamente por motivo de aposentadoria, será pago um abono equivalente ao seu último salário nominal, acrescido de 5% (cinco por cento) desse mesmo salário para cada ano de serviço que ultrapassar 5 (cinco);  Se o empregado permanecer trabalhando na empresa após aposentadoria, será garantido este abono, apenas por ocasião do desligamento definitivo.  Para os empregados com menos de 5 (cinco) anos de serviço na empresa, será pago um abono correspondente a 5% (cinco por cento) para cada ano de serviço, até o limite de 20% (vinte por cento) do seu salário nominal.  Caso a empresa mantenha, às suas expensas, plano de complementação de aposentadoria ou pecúlio aos seus empregados, salvo contribuições voluntárias do empregado, cujo benefício seja igual ou superior aos valores mencionados, desobriga-se ao cumprimento desta cláusula;  O disposto nesta cláusula não se acumulará com os dispositivos que vierem a regulamentar o inciso XX - art. 7º - da Constituição Federal. Serão aplicados exclusivamente os dispositivos mais favoráveis ao empregado.  "|complementação do auxílio previdenciário a ao empregado em gozo de benefício do auxílio previdenciário ou acidentário fica garantida entre o 16º décimo sexto e o 120º centésimo vigésimo dia de afastamento uma complementação de salário em valor equivalente a diferença entre o efetivamente percebido da previdência social e o salário nominal respeitado sempre para efeito da complementação o limite máximo de 7 sete vezes o menor salário normativo vigente na época do evento b quando o empregado não tiver direito ao auxílio previdenciário ou acidentário por não ter ainda completado o período de carência exigido pela previdência social a empresa pagará seu salário nominal entre o 16º décimo sexto e o 120º centésimo vigésimo dia de afastamento respeitado também o limite máximo de 7 sete vezes o menor salário normativo vigente na época do evento c não sendo conhecido o valor básico do benefício previdenciário ou acidentário no caso da letra a a complementação deverá ser paga em valores estimadosse ocorrerem diferenças a maior ou a menor deverão ser compensadas no pagamento imediatamente posterior d o pagamento previsto nesta cláusula deverá ocorrer junto com o pagamento mensal dos demais empregados 26 abono por aposentadoria aos empregados com 5 cinco anos ou mais de serviços contínuos dedicados à empresa quando dela vier a desligar-se definitivamente por motivo de aposentadoria será pago um abono equivalente ao seu último salário nominal acrescido de 5% cinco por cento desse mesmo salário para cada ano de serviço que ultrapassar 5 cinco se o empregado permanecer trabalhando na empresa após aposentadoria será garantido este abono apenas por ocasião do desligamento definitivo para os empregados com menos de 5 cinco anos de serviço na empresa será pago um abono correspondente a 5% cinco por cento para cada ano de serviço até o limite de 20% vinte por cento do seu salário nominal caso a empresa mantenha às suas expensas plano de complementação de aposentadoria ou pecúlio aos seus empregados salvo contribuições voluntárias do empregado cujo benefício seja igual ou superior aos valores mencionados desobriga-se ao cumprimento desta cláusula o disposto nesta cláusula não se acumulará com os dispositivos que vierem a regulamentar o inciso xx art7º da constituição federalserão aplicados exclusivamente os dispositivos mais favoráveis ao empregado 
1|2016_082054|Other Assistances|TRANSPORTE E ALIMENTAÇÃO - REAJUSTES  Na hipótese de a empresa oferecer aos seus empregados serviço de alimentação e de transporte coletivo, preservadas as condições mais vantajosas já existentes, somente poderá reajustar os preços cobrados na época dos reajustes ou aumentos gerais de salário, espontâneos ou não, em percentual não superior ao limite máximo do aumento.  Quando os aumentos salariais gerais ou espontâneos forem compensáveis, os reajustes dos preços de refeições e transportes também o serão na mesma proporção.  Os serviços de transporte fornecidos pela empresa, deverão obedecer condições de segurança, higiene e conforto, assim como deverão obedecer a legislação vigente a respeito.  Pretendendo a empresa introduzir melhorias nos seus serviços de alimentação e de transporte, poderá reajustar os preços até então praticados, independente de vinculação e aumentos gerais de salários desde que mediante entendimento específico com o sindicato signatário deste instrumento.  |transporte e alimentação reajustes na hipótese de a empresa oferecer aos seus empregados serviço de alimentação e de transporte coletivo preservadas as condições mais vantajosas já existentes somente poderá reajustar os preços cobrados na época dos reajustes ou aumentos gerais de salário espontâneos ou não em percentual não superior ao limite máximo do aumento quando os aumentos salariais gerais ou espontâneos forem compensáveis os reajustes dos preços de refeições e transportes também o serão na mesma proporção os serviços de transporte fornecidos pela empresa deverão obedecer condições de segurança higiene e conforto assim como deverão obedecer a legislação vigente a respeito pretendendo a empresa introduzir melhorias nos seus serviços de alimentação e de transporte poderá reajustar os preços até então praticados independente de vinculação e aumentos gerais de salários desde que mediante entendimento específico com o sindicato signatário deste instrumento 
2|2016_082054|Other Specific Groups|DIVERSIDADE NAS CONTRATAÇÕES  A empresa se compromete em despender todos os esforços para que, nas novas contratações, respeitada a capacitação individual, sejam observados os princípios da igualdade de oportunidade para os jovens entre 18(dezoito) e 24 (vinte e quatro) anos e as pessoas com idade superior a 40 (quarenta) anos de idade, independente do sexo, origem étnica ou religiosidade.  |diversidade nas contratações a empresa se compromete em despender todos os esforços para que nas novas contratações respeitada a capacitação individual sejam observados os princípios da igualdade de oportunidade para os jovens entre 18dezoito e 24 vinte e quatro anos e as pessoas com idade superior a 40 quarenta anos de idade independente do sexo origem étnica ou religiosidade 
3|2016_082054|Other Provisions|Em que pese às diversas tentativas de negociação acerca da data-base de 2016 entre a Federação dos Sindicatos Metalúrgicos da CUT no Estado de São – (FEM-CUT/SP) e  SINDICATO  DA INDÚSTRIA  DE  LÂMPADAS  E  APARELHOS  ELÉTRICOS  DE  ILUMINAÇÃO DO ESTADO DE SÃO PAULO;  SINDICATO DA INDÚSTRIA MECÂNICA DO ESTADO DE SÃO PAULO; SINDICATO DA INDÚSTRIA DE REPARAÇÃO DE VEÍCULOS E ACESSÓRIOS DO ESTADO DE SÃO PAULO; SINDICATO DA INDÚSTRIA DA PROTEÇÃO, TRATAMENTO E TRANSFORMAÇÃO DE SUPERFÍCIES DO ESTADO DE SÃO PAULO; SINDICATO NACIONAL DA INDÚSTRIA DE MATERIAL BÉLICO; SINDICATO NACIONAL DA INDÚSTRIA DE ROLHAS METÁLICAS,  não houve consenso sobre os itens econômicos da pauta; Não obstante o impasse das negociações naquele âmbito, as partes neste instrumento reconhecem que a empresa possui condição econômica própria diferenciada que lhe permite o avanço nas tratativas; Assim, reconhecem que a melhor solução, neste caso, é a negociação direta entre o Sindicato e a Empresa, razão pela qual celebram o presente Acordo Coletivo de Trabalho, que se regerá pelas seguintes cláusulas econômicas e sociais, ressalvada a aplicação e prevalência de normas e/ou cláusulas mais benéficas, constantes de Convenção Coletiva de Trabalho que venha a ser celebrada. |em que pese às diversas tentativas de negociação acerca da data-base de 2016 entre a federação dos sindicatos metalúrgicos da cut no estado de são fem-cut/sp e sindicato da indústria de lâmpadas e aparelhos elétricos de iluminação do estado de são paulo; sindicato da indústria mecânica do estado de são paulo sindicato da indústria de reparação de veículos e acessórios do estado de são paulo sindicato da indústria da proteção tratamento e transformação de superfícies do estado de são paulo sindicato nacional da indústria de material bélico sindicato nacional da indústria de rolhas metálicas não houve consenso sobre os itens econômicos da pauta não obstante o impasse das negociações naquele âmbito as partes neste instrumento reconhecem que a empresa possui condição econômica própria diferenciada que lhe permite o avanço nas tratativas assim reconhecem que a melhor solução neste caso é a negociação direta entre o sindicato e a empresa razão pela qual celebram o presente acordo coletivo de trabalho que se regerá pelas seguintes cláusulas econômicas e sociais ressalvada a aplicação e prevalência de normas e/ou cláusulas mais benéficas constantes de convenção coletiva de trabalho que venha a ser celebrada
4|2012_002993|Other Assurances|É vedada a dispensa do empregado no período de (30) trinta dias que antecedem e 30 trinta dias que sucedem à data-base da categoria, sob pena de pagamento dos salários do período e de multa igual a 01 (um) salário do Empregado na respectiva função. |é vedada a dispensa do empregado no período de 30 trinta dias que antecedem e 30 trinta dias que sucedem à data-base da categoria sob pena de pagamento dos salários do período e de multa igual a 01 um salário do empregado na respectiva função
5|2012_002993|Other Assurances|Fica garantida a todo Empregado após o retorno das férias uma estabilidade de 30 (trinta) dias corridos. |fica garantida a todo empregado após o retorno das férias uma estabilidade de 30 trinta dias corridos
6|2012_002993|Other Provisions| Fica estipulada multa no valor correspondente a (10%) dez por cento do piso salarial vigente nas respectivas funções por empregado e por infração, no caso de violação de qualquer cláusula do presente acordo revertendo seu valor para a parte prejudicada.| fica estipulada multa no valor correspondente a 10% dez por cento do piso salarial vigente nas respectivas funções por empregado e por infração no caso de violação de qualquer cláusula do presente acordo revertendo seu valor para a parte prejudicada
7|2012_002993|Other Provisions|É vedado ao empregador efetuar anotações desabonadoras à conduta do empregado em sua Carteira de Trabalho e Previdência Social. (Acrescentado pela L-010.270-2001). |é vedado ao empregador efetuar anotações desabonadoras à conduta do empregado em sua carteira de trabalho e previdência socialacrescentado pela l-010270-2001
8|2012_002993|Other Provisions|O Empregador, desde que solicitado, fornecerá ao seu empregado os documentos necessários relativos ao vínculo laborial para obtenção de benefício previdenciário.|o empregador desde que solicitado fornecerá ao seu empregado os documentos necessários relativos ao vínculo laborial para obtenção de benefício previdenciário
9|2012_002993|Other Provisions|Eventuais interrupções do trabalho ocasionadas ou decorrentes de casos fortuitos ou de força maior não poderão ser descontadas nem trabalhadas como compensação.  Parágrafo único:  O atraso ao trabalho, desde que não ultrapasse (15) quinze minutos,  não acarretará qualquer desconto da remuneração do trabalhador. |eventuais interrupções do trabalho ocasionadas ou decorrentes de casos fortuitos ou de força maior não poderão ser descontadas nem trabalhadas como compensação parágrafo único: o atraso ao trabalho desde que não ultrapasse 15 quinze minutos, não acarretará qualquer desconto da remuneração do trabalhador
10|2012_002993|Other Provisions|O Empregador abonará (5) cinco dias alternados de ausência do empregado dentro do período de (12) doze meses em caso de internação hospitalar da esposa e filhos, desde que haja incompatibilidade de horário para o comparecimento ao serviço. |o empregador abonará 5 cinco dias alternados de ausência do empregado dentro do período de 12 doze meses em caso de internação hospitalar da esposa e filhos desde que haja incompatibilidade de horário para o comparecimento ao serviço
11|2012_002993|Other Provisions|Fica garantida a Entidade Sindical Signatária a promoção perante a Justiça do Trabalho e o Foro em Geral de ações plúrimas em nome dos empregados e em nome próprio ou ainda, como parte interessada, em caso de descumprimento de qualquer cláusula avençada ou determinada neste Acordo Coletivo.  Parágrafo único: Fica vedado ao Sindicato dos Trabalhadores patrocinarem causas trabalhistas, sem esgotar a negociação da conciliação trabalhista prevista neste acordo, após sua constituição.|fica garantida a entidade sindical signatária a promoção perante a justiça do trabalho e o foro em geral de ações plúrimas em nome dos empregados e em nome próprio ou ainda como parte interessada em caso de descumprimento de qualquer cláusula avençada ou determinada neste acordo coletivo parágrafo único fica vedado ao sindicato dos trabalhadores patrocinarem causas trabalhistas sem esgotar a negociação da conciliação trabalhista prevista neste acordo após sua constituição
12|2012_002993|Other Provisions|As partes conveniadas comprometem-se a divulgar os termos do presente acordo aos seus representados.|as partes conveniadas comprometem-se a divulgar os termos do presente acordo aos seus representados
13|2014_081501|Other Provisions|Fica acordado que a partir de 01/01/2014 os empregados poderão trabalhar no dia de domingo que estiver de folga, mediante o pagamento de SERVIÇOS EXTRAS no valor mínimo de R$ 70,00 (setenta reais) pela jornada máxima de sete horas.  |fica acordado que a partir de 01/01/2014 os empregados poderão trabalhar no dia de domingo que estiver de folga mediante o pagamento de serviços extras no valor mínimo de r$ 70,00 setenta reais pela jornada máxima de sete horas 
14|2014_081501|Other Provisions|A empresa concederá uma folga semanal a  todos os seus empregados, nos dias da semana compreendida de segunda-feira a sábado.  A folga no domingo prevista na Cláusula sexta da CCT 2014/2016 poderá ser concedida mediante solicitação do empregado, com uma semana de antecedência, de comum acordo com a empresa. Parágrafo Único - As horas extras trabalhadas nos dias de domingos de folga alem da jornada prevista acima serão pagas em dobro.|a empresa concederá uma folga semanal a todos os seus empregados nos dias da semana compreendida de segunda-feira a sábado a folga no domingo prevista na cláusula sexta da cct 2014/2016 poderá ser concedida mediante solicitação do empregado com uma semana de antecedência de comum acordo com a empresaparágrafo único as horas extras trabalhadas nos dias de domingos de folga alem da jornada prevista acima serão pagas em dobro
15|2017_084835|Other Provisions|O Acordo de Compensação de Horas “BANCO DE HORAS” é um sistema de compensação de horas trabalhadas a mais ou a menos que o previsto, que as partes estabelecem, de modo a permitir que a Empresa ajuste o potencial da mão de obra à demanda do mercado consumidor. A Empresa fornecerá ao SITIBRON, uma planilha do BANCO DE HORAS contendo o acumulado das horas do período, com um prazo de três dias depois do fechamento da folha de pagamento.  Parágrafo Único: O numero de Empregado envolvido no sistema de compensação de horas trabalhadas, banco de horas, neste acordo é de 152 colaboradores. |o acordo de compensação de horas “banco de horas” é um sistema de compensação de horas trabalhadas a mais ou a menos que o previsto que as partes estabelecem de modo a permitir que a empresa ajuste o potencial da mão de obra à demanda do mercado consumidora empresa fornecerá ao sitibron uma planilha do banco de horas contendo o acumulado das horas do período com um prazo de três dias depois do fechamento da folha de pagamento parágrafo único o numero de empregado envolvido no sistema de compensação de horas trabalhadas banco de horas neste acordo é de 152 colaboradores
16|2017_084835|Other Provisions|A Empresa fixará, com antecedência mínima de 24 horas, os dias em que haverá trabalho, bem como a sua duração e forma de cumprimento diário, podendo abranger todos ou apenas parte dos empregados. Parágrafo Primeiro: O sistema de flexibilização não prejudicará o direito dos empregados quanto ao intervalo de alimentação, no período de descanso entre duas jornadas diárias de trabalho e o repouso semanal. Parágrafo Segundo: Não será aplicado aos Trabalhadores a compensação de horas nos domingos e feriados |a empresa fixará com antecedência mínima de 24 horas os dias em que haverá trabalho bem como a sua duração e forma de cumprimento diário podendo abranger todos ou apenas parte dos empregadosparágrafo primeiro o sistema de flexibilização não prejudicará o direito dos empregados quanto ao intervalo de alimentação no período de descanso entre duas jornadas diárias de trabalho e o repouso semanalparágrafo segundo não será aplicado aos trabalhadores a compensação de horas nos domingos e feriados 
17|2017_084835|Other Provisions|O Trabalho além das 44 horas semanais será convertido em folgas remuneradas, na proporção de 01 hora de trabalho por 01 hora de descanso. Compromete-se a não passar de duas horas diárias da jornada de trabalho. Parágrafo Único: Os trabalhos prestados em repousos semanais ou feriados serão compensados em forma de horas extras em 100%. |o trabalho além das 44 horas semanais será convertido em folgas remuneradas na proporção de 01 hora de trabalho por 01 hora de descansocompromete-se a não passar de duas horas diárias da jornada de trabalhoparágrafo único os trabalhos prestados em repousos semanais ou feriados serão compensados em forma de horas extras em 100%
18|2017_084835|Other Provisions|As horas serão controladas por um sistema manual ou informatizado, de debito e crédito, e cada funcionário receberá, mensalmente um extrato onde poderá verificar seu saldo de hora a cada final de mês. |as horas serão controladas por um sistema manual ou informatizado de debito e crédito e cada funcionário receberá mensalmente um extrato onde poderá verificar seu saldo de hora a cada final de mês
19|2017_084835|Other Provisions|Durante a vigência do presente acordo, a jornada normal de trabalho não poderá ultrapassar a 02 (duas) horas diárias adicionais, caso seja ultrapassada deve ser contabilizada 02 (horas) no Banco de Horas e o restante será contabilizado com horas extras em 50% (cinquenta) por cento. |durante a vigência do presente acordo a jornada normal de trabalho não poderá ultrapassar a 02 duas horas diárias adicionais caso seja ultrapassada deve ser contabilizada 02 horas no banco de horas e o restante será contabilizado com horas extras em 50% cinquenta por cento
20|2017_084835|Other Provisions|A compensação das horas deverá ocorrer 180 (cento e oitenta dias) 6 – 6 meses após a ocorrência das mesmas; não havendo a compensação das mesmas, estas serão pagas aplicando-se os percentuais devidos de 50% (cinquenta) pr cento conforme determina a Lei. Parágrafo Primeiro: As folgas dos funcionários deverão ser programadas e ajustadas diretamente entre o empregado e o seu superior imediato. Parágrafo Segundo: As horas a crédito dos funcionários poderão ser compensadas com acréscimos de dias de férias futuras, desde que o período de gozo das férias dos funcionários aconteça dentro dos 60 dias determinados por lei.  Parágrafo Terceiro: As horas ou dias pagos e não trabalhados na semana, serão compensados na oportunidade que a empresa determinar, salvo casos em que o empregado esteja disponível na empresa a mesma não dispor do seu trabalho por motivo de força maior, como também aqueles funcionários que comprovarem por meio de atestado medica que não se encontra em condição de trabalhar, não se aplica este parágrafo as mulheres em licença maternidade. Parágrafo Quarto: Por deliberação da assembleia geral ordinária, após a assinatura deste instrumento normativo de trabalho (BANCO DE HORAS), e o seu deposito no MTE, art. 614 da CLT, fica devidamente quitado pela empresa qualquer valor monetário referente a horas extraordinárias retroativas de seus empregados, desde a sua admissão até a presente data deste instrumento, da área administrativa, operadores, auxiliares, empilhador, motoboy e outras funções que englobe o quadro de funcionários da Majestic Industria e Comércio de Bebidas Ltda. |a compensação das horas deverá ocorrer 180 cento e oitenta dias 6 6 meses após a ocorrência das mesmas não havendo a compensação das mesmas estas serão pagas aplicando-se os percentuais devidos de 50% cinquenta pr cento conforme determina a leiparágrafo primeiro as folgas dos funcionários deverão ser programadas e ajustadas diretamente entre o empregado e o seu superior imediatoparágrafo segundo as horas a crédito dos funcionários poderão ser compensadas com acréscimos de dias de férias futuras desde que o período de gozo das férias dos funcionários aconteça dentro dos 60 dias determinados por lei parágrafo terceiro as horas ou dias pagos e não trabalhados na semana serão compensados na oportunidade que a empresa determinar salvo casos em que o empregado esteja disponível na empresa a mesma não dispor do seu trabalho por motivo de força maior como também aqueles funcionários que comprovarem por meio de atestado medica que não se encontra em condição de trabalhar não se aplica este parágrafo as mulheres em licença maternidadeparágrafo quarto por deliberação da assembleia geral ordinária após a assinatura deste instrumento normativo de trabalho banco de horas e o seu deposito no mte art614 da clt fica devidamente quitado pela empresa qualquer valor monetário referente a horas extraordinárias retroativas de seus empregados desde a sua admissão até a presente data deste instrumento da área administrativa operadores auxiliares empilhador motoboy e outras funções que englobe o quadro de funcionários da majestic industria e comércio de bebidas ltda
21|2017_084835|Other Provisions|Ocorrendo demissão do empregado, a empresa pagará, junto com as demais verbas rescisórias, o saldo credor de horas, aplicando-se o percentual de trabalho extraordinário vigente.   Parágrafo Único: O saldo devedor será assumido pela empresa, exceto quando da ruptura do contrato de trabalho de se der por iniciativa do empregado ou por motivo de justa causa, quando o desconto das horas se fará no acerto das verbas rescisórias. |ocorrendo demissão do empregado a empresa pagará junto com as demais verbas rescisórias o saldo credor de horas aplicando-se o percentual de trabalho extraordinário vigente parágrafo único o saldo devedor será assumido pela empresa exceto quando da ruptura do contrato de trabalho de se der por iniciativa do empregado ou por motivo de justa causa quando o desconto das horas se fará no acerto das verbas rescisórias
22|2017_084835|Other Provisions|Para a concessão dos benefícios: vale transporte e alimentação, a empresa não levará em consideração os dias efetivamente trabalhados no mês. |para a concessão dos benefícios vale transporte e alimentação a empresa não levará em consideração os dias efetivamente trabalhados no mês
23|2017_084835|Other Provisions|O descumprimento por parte do empregador sujeita a multa de 5 (cinco salários) do piso da categoria por empregado, cujo montante será revertido em favor da parte prejudicada. |o descumprimento por parte do empregador sujeita a multa de 5 cinco salários do piso da categoria por empregado cujo montante será revertido em favor da parte prejudicada
