|contract_id|title|text|clean_text
43|2017_039341|Other Provisions|Pelo presente instrumento coletivo de trabalho, com base no disposto no § 2º, do artigo 74, da Consolidação das Leis do Trabalho e no art. 2º da Portaria nº 373, de 25/02/2011 do Ministério do Trabalho e Emprego, as empresas de leasing filiadas ao Sindicato Patronal poderão manter, no âmbito da base territorial definida na cláusula segunda deste, Sistema Alternativo Eletrônico de Controle de Jornada de Trabalho, aqui denominado simplesmente “Sistema de Ponto Eletrônico”, para controle da jornada de trabalho de seus empregados. 49.1. O Sistema de Ponto Eletrônico não poderá admitir: a)       restrições à marcação do ponto. b)       marcação automática do ponto. c)        exigência de autorização prévia para marcação de sobrejornada; e d)       alteração ou eliminação dos dados registrados pelo empregado. 49.2. O Sistema de Ponto Eletrônico adotado deverá reunir, também, as seguintes condições: a)       encontrar-se disponível no local de trabalho para o registro dos horários de trabalho e consulta. b)       permitir a identificação de empregador e empregado. c)        possibilitar ao empregado, a qualquer tempo, através da central de dados, a consulta eletrônica e impressa do registro fiel das marcações realizadas. d)       possibilitar à fiscalização, quando solicitado, através da central de dados, a extração eletrônica e impressa do registro fiel das marcações realizadas. 49.3. A adoção do Sistema de Ponto Eletrônico, previsto no presente instrumento normativo, subordina-se à prévia certificação de conformidade do sistema às exigências previstas neste instrumento, a ser obtida junto à empresa certificadora com a expertise necessária à aferição do sistema. Parágrafo primeiro: A empresa certificadora não poderá integrar o mesmo grupo econômico da empresa de arrendamento mercantil adotante do sistema alternativo eletrônico. Parágrafo segundo: A certificação de conformidade do Sistema de Ponto Eletrônico deverá ser encaminhada ao Sindicato profissional, que dará ciência da recepção do referido documento para efeito de fixação de data de início de operação do referido sistema. 49.4. Fica assegurado ao Sindicato Profissional, através dos seus representantes ou técnicos, o acesso às informações do Sistema de Ponto Eletrônico mantido pelas Empresas filiadas ao Sindicato Patronal sempre que haja dúvida ou denúncia que o uso do mesmo esteja em desacordo com a legislação ou com as normas aqui acordadas. 49.5. Qualquer alteração a ser realizada no Sistema de Ponto Eletrônico deverá ser comunicada ao Sindicato Profissional, informando as alterações técnicas a serem feitas e indicando razões que as justificam. Parágrafo Primeiro: Ocorrendo alteração, deverá a empresa obter nova certificação de conformidade, na forma do disposto na cláusula sétima. Parágrafo Segundo: Comprovada a realização de qualquer alteração sem que tenham sido observadas as exigências a que se referem o caput desta cláusula e seu parágrafo primeiro, considerar-se-á denunciado o presente instrumento coletivo de trabalho cessando os seus efeitos para o cumprimento do permissivo da Portaria nº 373/11. 49.6.  As partes signatárias reconhecem que o Sistema Alternativo Eletrônico de Controle de Jornada das empresas de leasing filiadas ao Sindicato Patronal, uma vez obedecido o disposto no presente instrumento normativo, atende as exigências do artigo 74, § 2º, da Consolidação das Leis do Trabalho e o disposto no art. 2ºda Portaria nº 373, de 25/02/2011, do Ministério do Trabalho e Emprego, dispensando-se a instalação do Registrador Eletrônico de Ponto – REP|pelo presente instrumento coletivo de trabalho com base no disposto no § 2º do artigo 74 da consolidação das leis do trabalho e no art2º da portaria nº 373 de 25/02/2011 do ministério do trabalho e emprego as empresas de leasing filiadas ao sindicato patronal poderão manter no âmbito da base territorial definida na cláusula segunda deste sistema alternativo eletrônico de controle de jornada de trabalho aqui denominado simplesmente “sistema de ponto eletrônico” para controle da jornada de trabalho de seus empregados491o sistema de ponto eletrônico não poderá admitir a restrições à marcação do pontob marcação automática do pontoc exigência de autorização prévia para marcação de sobrejornada e d alteração ou eliminação dos dados registrados pelo empregado492o sistema de ponto eletrônico adotado deverá reunir também as seguintes condições a encontrar-se disponível no local de trabalho para o registro dos horários de trabalho e consultab permitir a identificação de empregador e empregadoc possibilitar ao empregado,a qualquer tempo através da central de dados a consulta eletrônica e impressa do registro fiel das marcações realizadasd possibilitar à fiscalização quando solicitado através da central de dados a extração eletrônica e impressa do registro fiel das marcações realizadas493a adoção do sistema de ponto eletrônico previsto no presente instrumento normativo subordina-se à prévia certificação de conformidade do sistema às exigências previstas neste instrumento a ser obtida junto à empresa certificadora com a expertise necessária à aferição do sistemaparágrafo primeiro a empresa certificadora não poderá integrar o mesmo grupo econômico da empresa de arrendamento mercantil adotante do sistema alternativo eletrônicoparágrafo segundo a certificação de conformidade do sistema de ponto eletrônico deverá ser encaminhada ao sindicato profissional que dará ciência da recepção do referido documento para efeito de fixação de data de início de operação do referido sistema494fica assegurado ao sindicato profissional através dos seus representantes ou técnicos o acesso às informações do sistema de ponto eletrônico mantido pelas empresas filiadas ao sindicato patronal sempre que haja dúvida ou denúncia que o uso do mesmo esteja em desacordo com a legislação ou com as normas aqui acordadas495qualquer alteração a ser realizada no sistema de ponto eletrônico deverá ser comunicada ao sindicato profissional informando as alterações técnicas a serem feitas e indicando razões que as justificamparágrafo primeiro ocorrendo alteração deverá a empresa obter nova certificação de conformidade na forma do disposto na cláusula sétimaparágrafo segundo comprovada a realização de qualquer alteração sem que tenham sido observadas as exigências a que se referem o caput desta cláusula e seu parágrafo primeiro considerar-se-á denunciado o presente instrumento coletivo de trabalho cessando os seus efeitos para o cumprimento do permissivo da portaria nº 373/11496 as partes signatárias reconhecem que o sistema alternativo eletrônico de controle de jornada das empresas de leasing filiadas ao sindicato patronal uma vez obedecido o disposto no presente instrumento normativo atende as exigências do artigo 74 § 2º da consolidação das leis do trabalho e o disposto no art2ºda portaria nº 373 de 25/02/2011 do ministério do trabalho e emprego dispensando-se a instalação do registrador eletrônico de ponto rep
44|2013_069396|Other Provisions|RELAÇÃO DOS TRABALHADORES: A empresa se obriga a comunicar ao Sindicato Laboral, pôr escrita, a relação dos trabalhadores que irão trabalhar nos dias acima citado onde a mesma não poderá funcionar com o mesmo quadro de funcionários.|relação dos trabalhadores a empresa se obriga a comunicar ao sindicato laboral pôr escrita a relação dos trabalhadores que irão trabalhar nos dias acima citado onde a mesma não poderá funcionar com o mesmo quadro de funcionários
45|2009_016579|Other Provisions| E por estarem as partes justas e acordadas, arquivam o presente Acordo Coletivo de Trabalho, perante  a Secretaria de Relações do Trabalho, do Ministério do Trabalho e Emprego em Brasília/DF, para que surtam seus jurídicos e legais efeitos.| e por estarem as partes justas e acordadas arquivam o presente acordo coletivo de trabalho perante a secretaria de relações do trabalho do ministério do trabalho e emprego em brasília/df para que surtam seus jurídicos e legais efeitos
46|2015_065035|Other Provisions|"Os contratos de trabalhos dos empregados que forem admitidos após a assinatura deste Acordo reger-se-ão pelos horários estabelecidos neste instrumento, pelo que deverão assim ser cientificados pela empresa quando do ato da admissão. // <![CDATA[ D([""mb"",""\u003c/span\u003e\u003c/font\u003e\u003c/b\u003e\u003c/h3\u003e\n\n\u003cp\u003e\u003cfont size\u003d\""3\"" face\u003d\""Arial\""\u003e\u003cspan style\u003d\""font-size:12.0pt;font-family:Arial\""\u003e&nbsp;\u003c/span\u003e\u003c/font\u003e\u003c/p\u003e\n\n\u003cp\u003e\u003cfont size\u003d\""3\"" face\u003d\""Arial\""\u003e\u003cspan style\u003d\""font-size:12.0pt;font-family:Arial\""\u003e&nbsp;\u003c/span\u003e\u003c/font\u003e\u003c/p\u003e\n\n\u003ch4 style\u003d\""line-height:normal\""\u003e\u003cb\u003e\u003cfont size\u003d\""3\"" face\u003d\""Arial\""\u003e\u003cspan style\u003d\""font-size:12.0pt;font-family:Arial;background:silver\""\u003eCLÁUSULA QUINTA - Do Foro\u003c/span\u003e\u003c/font\u003e\u003c/b\u003e\u003cfont size\u003d\""3\"" face\u003d\""Arial\""\u003e\u003cspan style\u003d\""font-size:12.0pt;font-family:Arial\""\u003e\u003c/span\u003e\u003c/font\u003e\u003c/h4\u003e\n\n\u003cp\u003e\u003cfont size\u003d\""1\"" face\u003d\""Arial\""\u003e\u003cspan style\u003d\""font-size:8.0pt;font-family:Arial\""\u003e&nbsp;\u003c/span\u003e\u003c/font\u003e\u003c/p\u003e\n\n\u003cp\u003e\u003cfont size\u003d\""3\"" face\u003d\""Arial\""\u003e\u003cspan style\u003d\""font-size:12.0pt;font-family:Arial\""\u003eEstipulam as partes o Foro Trabalhista de Salto/SP\u003cspan\u003e.,\u003c/span\u003e para dirimir quaisquer dúvidas acerca do presente Acordo\nColetivo de Trabalho, renunciando a qualquer outro, por mais privilegiado que\nseja. \u003c/span\u003e\u003c/font\u003e\u003c/p\u003e\n\n\u003cp\u003e\u003cfont size\u003d\""3\"" face\u003d\""Arial\""\u003e\u003cspan style\u003d\""font-size:12.0pt;font-family:Arial\""\u003e&nbsp;\u003c/span\u003e\u003c/font\u003e\u003c/p\u003e\n\n\u003cp\u003e\u003cfont size\u003d\""3\"" face\u003d\""Arial\""\u003e\u003cspan style\u003d\""font-size:12.0pt;font-family:Arial\""\u003e&nbsp;\u003c/span\u003e\u003c/font\u003e\u003c/p\u003e\n\n\u003cp class\u003d\""MsoNormal\"" align\u003d\""center\"" style\u003d\""text-align:center\""\u003e\u003cb\u003e\u003cfont size\u003d\""3\"" face\u003d\""Arial\""\u003e\u003cspan style\u003d\""font-size:12.0pt;font-family:Arial;background:silver;font-weight:bold\""\u003eCLÁUSULA SEXTA - Vigência\u003c/span\u003e\u003c/font\u003e\u003c/b\u003e\u003cb\u003e\u003cfont size\u003d\""3\"" face\u003d\""Arial\""\u003e\u003cspan style\u003d\""font-size:12.0pt;font-family:Arial;font-weight:bold\""\u003e\u003c/span\u003e\u003c/font\u003e\u003c/b\u003e\u003c/p\u003e\n\n\u003cp\u003e\u003cfont size\u003d\""1\"" face\u003d\""Arial\""\u003e\u003cspan style\u003d\""font-size:8.0pt;font-family:Arial\""\u003e&nbsp;\u003c/span\u003e\u003c/font\u003e\u003c/p\u003e\n\n\u003cp\u003e\u003cfont size\u003d\""3\"" face\u003d\""Arial\""\u003e\u003cspan style\u003d\""font-size:12.0pt;font-family:Arial\""\u003eO prazo de vigência deste Acordo será de 14\u003cspan\u003e&nbsp; \u003c/span\u003ede janeiro a 31 de dezembro de 2008.\u003c/span\u003e\u003c/font\u003e\u003c/p\u003e\n\n\u003cp\u003e\u003cfont size\u003d\""3\"" face\u003d\""Arial\""\u003e\u003cspan style\u003d\""font-size:12.0pt;font-family:Arial\""\u003e&nbsp;\u003c/span\u003e\u003c/font\u003e\u003c/p\u003e\n\n\u003cp\u003e\u003cfont size\u003d\""3\"" face\u003d\""Arial\""\u003e\u003cspan style\u003d\""font-size:12.0pt;font-family:Arial\""\u003e&nbsp;\u003c/span\u003e\u003c/font\u003e\u003c/p\u003e\n\n\u003cp class\u003d\""MsoNormal\"" style\u003d\""text-align:justify\""\u003e\u003cfont size\u003d\""3\"" face\u003d\""Arial\""\u003e\u003cspan style\u003d\""font-size:12.0pt;font-family:Arial\""\u003e"",1] ); // ]]> "|os contratos de trabalhos dos empregados que forem admitidos após a assinatura deste acordo reger-se-ão pelos horários estabelecidos neste instrumento pelo que deverão assim ser cientificados pela empresa quando do ato da admissão// <![cdata[ d[mb,\u003c/span\u003e\u003c/font\u003e\u003c/b\u003e\u003c/h3\u003e\n\n\u003cp\u003e\u003cfont size\u003d\3\ face\u003d\arial\\u003e\u003cspan style\u003d\font-size:120pt;font-family:arial\\u003e&nbsp;\u003c/span\u003e\u003c/font\u003e\u003c/p\u003e\n\n\u003cp\u003e\u003cfont size\u003d\3\ face\u003d\arial\\u003e\u003cspan style\u003d\font-size:120pt;font-family:arial\\u003e&nbsp;\u003c/span\u003e\u003c/font\u003e\u003c/p\u003e\n\n\u003ch4 style\u003d\line-height:normal\\u003e\u003cb\u003e\u003cfont size\u003d\3\ face\u003d\arial\\u003e\u003cspan style\u003d\font-size:120pt;font-family:arial;background:silver\\u003ecláusula quinta do foro\u003c/span\u003e\u003c/font\u003e\u003c/b\u003e\u003cfont size\u003d\3\ face\u003d\arial\\u003e\u003cspan style\u003d\font-size:120pt;font-family:arial\\u003e\u003c/span\u003e\u003c/font\u003e\u003c/h4\u003e\n\n\u003cp\u003e\u003cfont size\u003d\1\ face\u003d\arial\\u003e\u003cspan style\u003d\font-size:80pt;font-family:arial\\u003e&nbsp;\u003c/span\u003e\u003c/font\u003e\u003c/p\u003e\n\n\u003cp\u003e\u003cfont size\u003d\3\ face\u003d\arial\\u003e\u003cspan style\u003d\font-size:120pt;font-family:arial\\u003eestipulam as partes o foro trabalhista de salto/sp\u003cspan\u003e,\u003c/span\u003e para dirimir quaisquer dúvidas acerca do presente acordo\ncoletivo de trabalho renunciando a qualquer outro por mais privilegiado que\nseja\u003c/span\u003e\u003c/font\u003e\u003c/p\u003e\n\n\u003cp\u003e\u003cfont size\u003d\3\ face\u003d\arial\\u003e\u003cspan style\u003d\font-size:120pt;font-family:arial\\u003e&nbsp;\u003c/span\u003e\u003c/font\u003e\u003c/p\u003e\n\n\u003cp\u003e\u003cfont size\u003d\3\ face\u003d\arial\\u003e\u003cspan style\u003d\font-size:120pt;font-family:arial\\u003e&nbsp;\u003c/span\u003e\u003c/font\u003e\u003c/p\u003e\n\n\u003cp class\u003d\msonormal\ align\u003d\center\ style\u003d\text-align:center\\u003e\u003cb\u003e\u003cfont size\u003d\3\ face\u003d\arial\\u003e\u003cspan style\u003d\font-size:120pt;font-family:arial;background:silver;font-weight:bold\\u003ecláusula sexta vigência\u003c/span\u003e\u003c/font\u003e\u003c/b\u003e\u003cb\u003e\u003cfont size\u003d\3\ face\u003d\arial\\u003e\u003cspan style\u003d\font-size:120pt;font-family:arial;font-weight:bold\\u003e\u003c/span\u003e\u003c/font\u003e\u003c/b\u003e\u003c/p\u003e\n\n\u003cp\u003e\u003cfont size\u003d\1\ face\u003d\arial\\u003e\u003cspan style\u003d\font-size:80pt;font-family:arial\\u003e&nbsp;\u003c/span\u003e\u003c/font\u003e\u003c/p\u003e\n\n\u003cp\u003e\u003cfont size\u003d\3\ face\u003d\arial\\u003e\u003cspan style\u003d\font-size:120pt;font-family:arial\\u003eo prazo de vigência deste acordo será de 14\u003cspan\u003e&nbsp \u003c/span\u003ede janeiro a 31 de dezembro de 2008\u003c/span\u003e\u003c/font\u003e\u003c/p\u003e\n\n\u003cp\u003e\u003cfont size\u003d\3\ face\u003d\arial\\u003e\u003cspan style\u003d\font-size:120pt;font-family:arial\\u003e&nbsp;\u003c/span\u003e\u003c/font\u003e\u003c/p\u003e\n\n\u003cp\u003e\u003cfont size\u003d\3\ face\u003d\arial\\u003e\u003cspan style\u003d\font-size:120pt;font-family:arial\\u003e&nbsp;\u003c/span\u003e\u003c/font\u003e\u003c/p\u003e\n\n\u003cp class\u003d\msonormal\ style\u003d\text-align:justify\\u003e\u003cfont size\u003d\3\ face\u003d\arial\\u003e\u003cspan style\u003d\font-size:120pt;font-family:arial\\u003e,1] // ]]> 
47|2012_032527|General Assurances| Gozarão de estabilidade provisória no emprego, salvo por motivo de justa causa para demissão: a) Acidentado: por 12 meses após a cessação do auxilio doença acidentário, consoante artigo 118 da lei 8.213/199; b) Pré-aposentados: por 36 (trinta e seis) meses imediatamente, anteriores a complementação de tempo para aposentadoria pela Previdência Social ou outra instituição com a mesma finalidade, desde que tenham ao menos 05 (cinco) anos de vinculação empregatícia com o CRMV-SC; c) Gestante/Aborto: a mulher, por 6 (seis) meses após o parto, ou por 90 (noventa) dias em caso de aborto legal devidamente comprovado por Atestado Médico; ou ainda, por 90 (noventa) dias por adoção legal de criança de até 6 anos de idade, devidamente comprovada; d) No Processo Eleitoral: no período compreendido entre os 3 (três) meses que antecedem as eleições de qualquer dos cargos diretivos dos Conselhos até os 3 (três) meses sucessivos à posse nestes mesmos cargos.| gozarão de estabilidade provisória no emprego salvo por motivo de justa causa para demissão a acidentado por 12 meses após a cessação do auxilio doença acidentário consoante artigo 118 da lei 8213/199 b pré-aposentados por 36 trinta e seis meses imediatamente anteriores a complementação de tempo para aposentadoria pela previdência social ou outra instituição com a mesma finalidade desde que tenham ao menos 05 cinco anos de vinculação empregatícia com o crmv-sc c gestante/aborto a mulher por 6 seis meses após o parto ou por 90 noventa dias em caso de aborto legal devidamente comprovado por atestado médico ou ainda por 90 noventa dias por adoção legal de criança de até 6 anos de idade devidamente comprovada d no processo eleitoral no período compreendido entre os 3 três meses que antecedem as eleições de qualquer dos cargos diretivos dos conselhos até os 3 três meses sucessivos à posse nestes mesmos cargos
48|2009_034089|Other Provisions|O presente instrumento poderá ser revisto a qualquer tempo, desde que de comum acordo entre as partes.|o presente instrumento poderá ser revisto a qualquer tempo desde que de comum acordo entre as partes
49|2013_068336|Other Provisions|RELAÇÃO DOS FUNCIONÁRIOS: A empresa se obriga a comunicar ao Sindicato Laboral, pôr escrita, a relação dos trabalhadores que irão trabalhar no dia acima citado onde a mesma não poderá funcionar com o mesmo quadro de funcionários.|relação dos funcionários a empresa se obriga a comunicar ao sindicato laboral pôr escrita a relação dos trabalhadores que irão trabalhar no dia acima citado onde a mesma não poderá funcionar com o mesmo quadro de funcionários
50|2013_073410|Other Assistances|Recomenda-se à empresa que estabeleça convênios com farmácias e drogarias para aquisição de remédios pelos seus empregados. |recomenda-se à empresa que estabeleça convênios com farmácias e drogarias para aquisição de remédios pelos seus empregados
51|2013_073410|Other Specific Groups|a) Fornecimento obrigatório ao empregado, de pagamento, com a discriminação das importâncias pagas e descontos efetuados, contendo a identificação da empresa e os recolhimentos ao Fundo de Garantia por Tempo de Serviço (FGTS). b) A empresa fica alerta de que deverá cumprir rigorosamente as disposições da Lei 8036/90, especialmente seu Art. 17, a fim de possibilitar ao Banco Depositário do FGTS o atendimento ao Art. 22 do Decreto 99.684/90, ou seja, a remessa pelo Banco, do Extrato do FGTS, bimestralmente, diretamente ao próprio trabalhador. |a fornecimento obrigatório ao empregado de pagamento com a discriminação das importâncias pagas e descontos efetuados contendo a identificação da empresa e os recolhimentos ao fundo de garantia por tempo de serviço fgtsba empresa fica alerta de que deverá cumprir rigorosamente as disposições da lei 8036/90 especialmente seu art17 a fim de possibilitar ao banco depositário do fgts o atendimento ao art22 do decreto 99684/90 ou seja a remessa pelo banco do extrato do fgts bimestralmente diretamente ao próprio trabalhador
52|2013_073410|Other Specific Groups|A empresa deverá providenciar o pagamento do PIS nas suas próprias dependências. As empresas que não o fizerem deverão conceder abono de 4 (quatro) horas para o empregado recebê-lo, analisando os casos em que o domicílio bancário esteja situado em outro município para abonar o tempo necessário. |a empresa deverá providenciar o pagamento do pis nas suas próprias dependênciasas empresas que não o fizerem deverão conceder abono de 4 quatro horas para o empregado recebê-lo analisando os casos em que o domicílio bancário esteja situado em outro município para abonar o tempo necessário
53|2010_074884|Other Assistances|Será concedida, uma única vez, em forma de crédito em folha de pagamento ou vale compra, o valor de R$ 116,51 (cento e dezesseis reais e cinquenta e um centavos), para auxílio na aquisição de material escolar, mediante comprovação, para os empregados estudantes existentes no quadro de pessoal na data da assinatura deste acordo, que permanecerem trabalhando até 15 de março de 2011 e aos dependentes assim considerados de acordo com a legislação vigente e que venham a ser ratificados a critério da empresa, desde que estejam cursando 1º e 2º graus, superior e pós-graduação em estabelecimento de ensino regular, com idade inferior a 24(vinte e quatro) anos. Excetua-se da concessão deste benefício, os empregados diretores, gerentes, coordenadores e ocupantes de cargos equivalentes. PARÁGRAFO PRIMEIRO - Os empregados que apresentarem a comprovação de matrícula até o dia 15 de fevereiro de 2011, receberão o benefício juntamente com os salários de fevereiro. Os empregados que apresentarem a comprovação de matrícula até o dia 15 de março de 2011, receberão o benefício juntamente com os salários de março. Os empregados e seus dependentes que estudam em entidades onde o ano letivo inicia-se no segundo semestre, a comprovação da matrícula deverá ser entregue até o dia 15 de agosto de 2011, recebendo esse benefício juntamente com os salários de agosto; PARÁGRAFO SEGUNDO - O benefício decorrente dessa cláusula estará encerrado após 15 de março e 15 de agosto, razão pela qual não será aceita qualquer comprovação que porventura venha a ser apresentada após as referidas datas; PARÁGRAFO TERCEIRO – A concessão prevista nesta cláusula, não tem cunho salarial, para nenhum fim ou efeito. |será concedida uma única vez em forma de crédito em folha de pagamento ou vale compra o valor de r$ 116,51 cento e dezesseis reais e cinquenta e um centavos para auxílio na aquisição de material escolar mediante comprovação para os empregados estudantes existentes no quadro de pessoal na data da assinatura deste acordo que permanecerem trabalhando até 15 de março de 2011 e aos dependentes assim considerados de acordo com a legislação vigente e que venham a ser ratificados a critério da empresa desde que estejam cursando 1º e 2º graus superior e pós-graduação em estabelecimento de ensino regular com idade inferior a 24vinte e quatro anosexcetua-se da concessão deste benefício os empregados diretores gerentes coordenadores e ocupantes de cargos equivalentesparágrafo primeiro os empregados que apresentarem a comprovação de matrícula até o dia 15 de fevereiro de 2011 receberão o benefício juntamente com os salários de fevereiroos empregados que apresentarem a comprovação de matrícula até o dia 15 de março de 2011 receberão o benefício juntamente com os salários de marçoos empregados e seus dependentes que estudam em entidades onde o ano letivo inicia-se no segundo semestre a comprovação da matrícula deverá ser entregue até o dia 15 de agosto de 2011 recebendo esse benefício juntamente com os salários de agosto parágrafo segundo o benefício decorrente dessa cláusula estará encerrado após 15 de março e 15 de agosto razão pela qual não será aceita qualquer comprovação que porventura venha a ser apresentada após as referidas datas parágrafo terceiro a concessão prevista nesta cláusula não tem cunho salarial para nenhum fim ou efeito
54|2014_038173|Other Assistances|A empresa fornecerá aos seus empregados, gratuitamente, uniformes obrigatórios, constituídos de 02 (duas) camisas, 02 (duas) calças e 01 (um) par de sapatos, mediante termo de responsabilidade, e para os empregados da manutenção, uniforme constituído de 01 (um) macacão e um par de botinas. Parágrafo Primeiro - Os uniformes são fornecidos mediante comprovante de fornecimento com cópia para o empregado. Caso o mesmo seja desligado do quadro de empregados da empresa, fica obrigado a devolver aqueles à empregadora, caso contrário, será cobrado na rescisão contratual de forma proporcional ao tempo de uso; Parágrafo Segundo - Sempre que alguma peça do uniforme se desgastar ou inutilizar pelo uso normal ou causa não provocada esta será reposta pela empresa.|a empresa fornecerá aos seus empregados gratuitamente uniformes obrigatórios constituídos de 02 duas camisas 02 duas calças e 01 um par de sapatos mediante termo de responsabilidade e para os empregados da manutenção uniforme constituído de 01 um macacão e um par de botinasparágrafo primeiro os uniformes são fornecidos mediante comprovante de fornecimento com cópia para o empregadocaso o mesmo seja desligado do quadro de empregados da empresa fica obrigado a devolver aqueles à empregadora caso contrário será cobrado na rescisão contratual de forma proporcional ao tempo de uso parágrafo segundo sempre que alguma peça do uniforme se desgastar ou inutilizar pelo uso normal ou causa não provocada esta será reposta pela empresa
