|contract_id|title|text|clean_text
73|2012_042462|Other Provisions|Faz parte integrante da presente CCT o ANEXO I que contém Cláusulas com direitos dos Trabalhadores previstos pela Legislação Laboral vigente.   ANEXO I CONVENÇÃO COLETIVA DE TRABALHO 2012/2013  1 - FERRAMENTAS a)                   É de responsabilidade das Empresas o fornecimento de todas as ferramentas necessárias para o desenvolvimento do trabalho, ficando proibida a exigência de qualquer ferramenta por parte do Empregador. b)                  Os Trabalhadores se obrigam ao uso devido, a manutenção e limpeza adequada das ferramentas que receberem. As ferramentas deverão ser substituídas pelas Empresas, sempre que apresentarem desgastes ou defeitos que possam comprometer a segurança do Trabalhador. c)                   Para solicitação de substituição das ferramentas, deverão os Trabalhadores devolver aquelas até então utilizadas, efetuando também a devolução por ocasião de rescisão ou extinção do contrato de trabalho. d)                  Não se permite o desconto salarial por quebra de ferramentas, salvo nas hipóteses de dolo, culpa ou recusa da apresentação das ferramentas danificadas.  2 - EQUIPAMENTOS DE PROTEÇÃO INDIVIDUAL (EPI's) a)                   A Empresa fornecerá aos Trabalhadores os EPI necessários, a serem utilizados nos locais de trabalho e serviços onde os Equipamentos de Proteção Coletiva não eliminem por completo os riscos e agressões ambientais. b)                  Os EPI's deverão ser adaptados de acordo com a necessidade do usuário, em caso de eventual deficiência física. c)                   Os Trabalhadores se obrigam ao uso devido, a manutenção e limpeza adequada dos EPI's. d)                  Os Equipamentos de Proteção Individual deverão ser substituídos pela Empresa, sempre que apresentarem desgastes ou defeitos que possam comprometer a segurança ou a saúde do Trabalhador. e)                   Para solicitação de substituição dos EPI's, deverão os Trabalhadores devolver aqueles até então utilizados efetuando também a devolução por ocasião da rescisão ou extinção do contrato de trabalho. f)                    Os EPI's fornecidos pela Empresa deverão possuir Certificado de Aprovação e possibilitar condições de conforto no uso pelos Trabalhadores. g)                  Não se permite o desconto salarial por dano nos EPI's, salvo nas hipóteses de dolo, culpa, ou recusa de apresentação dos equipamentos danificados.  3 - UNIFORMES a)                   A Empresa fornecerá ao Trabalhador, gratuitamente, o uniforme necessário para o desenvolvimento do trabalho. b)                  Os Trabalhadores se obrigam ao uso devido, a manutenção e limpeza adequada dos uniformes que receberem. c)                   Os Uniformes deverão ser substituídos pela Empresa, sempre que apresentarem desgastes ou defeitos que possam comprometer a segurança ou a saúde do Trabalhador. d)                  Para solicitação de substituição dos Uniformes, deverão os Trabalhadores devolver aqueles até então utilizados, efetuando também a devolução por ocasião da rescisão ou extinção do contrato de trabalho. e)                   Os uniformes deverão possibilitar aos Trabalhadores plenas condições de conforto. f)                    Não se permite o desconto salarial por dano nos uniformes, salvo nas hipóteses de dolo, culpa ou recusa de apresentação das peças danificadas. g)                  As empresas poderão, a seu critério, disponibilizar a seus empregados vestiários, que serão de uso facultativo. O tempo despendido pelos trabalhadores que optarem pelo uso destas instalações para troca de uniforme e higiene pessoal não será computado na jornada de trabalho.  4 - COMPROVANTES DE PAGAMENTO As Empresas fornecerão obrigatoriamente aos Trabalhadores, os comprovantes de pagamento (envelopes ou recibos), especificando o nome da Empresa, do Trabalhador, e as parcelas a qualquer título, de forma discriminada, o valor do recolhimento do FGTS e os descontos efetuados.  5 - RECEBIMENTO E ENTREGA DA CTPS As Empresas procederão às anotações na Carteira de Trabalho e Previdência Social dos Trabalhadores no prazo de 48 (quarenta e oito) horas, fornecendo recibo por ocasião de sua apresentação e entrega, bem como, de outros documentos.  6 - EXAMES MÉDICOS As despesas correspondentes aos exames médicos admissional, demissional ou periódico serão de responsabilidade das Empresas, devendo ser realizados preferencialmente por médicos do trabalho, não coincidindo com o gozo de férias do Trabalhador e nem com o período de redução do aviso prévio. Parágrafo Primeiro: Quando do retorno do Empregado afastado por mais de 30 (trinta) dias, independente do motivo de afastamento no regresso a Empresa deverá realizar o exame médico. Parágrafo Segundo: Cópia do resultado dos exames deverá ser fornecida ao Empregado, que confirmará o recebimento assinado os originais.  7 - CIPA Serão observadas as seguintes disposições relativas à CIPA. 1)                   As Empresas com mais de 20 (vinte) Trabalhadores deverão constituir CIPA, de acordo com o dimensionamento previsto no quadro I da NR.5. 2)                   As Empresas com menos de 20 (vinte) Trabalhadores deverão designar um responsável pelo cumprimento dos objetivos da NR.5. 3)                   A eleição da CIPA será convocada no prazo mínimo de 60 (sessenta) dias antes do término do mandato em curso. 4)                   A empresa remeterá ao Sindicato Laboral, em 03 (três) dias após a convocação, cópia do edital que convocou a eleição da CIPA, liberando à mesma participação no evento. 5)                   O presidente e o vice-presidente da CIPA constituirão dentre seus membros, no prazo mínimo de 55 (cinqüenta e cinco) dias antes do término do mandato em curso, a comissão eleitoral (CE), que será a responsável pela organização e acompanhamento do processo eleitoral. 6)                   Nos estabelecimentos onde não houver CIPA a comissão eleitoral será constituída conjuntamente pela Empresa e pelo Sindicato Laboral. 7)                   O processo eleitoral observará as seguintes condições: a)                   Publicação e divulgação do edital em locais de fácil acesso e visualização pelos Trabalhadores, no prazo mínimo de 60 (sessenta) dias antes do término do mandato em curso, contendo o local e o prazo para inscrição dos trabalhadores interessados. b)                  Inscrição e eleição individual, sendo que o período mínimo para inscrição será de 15 (quinze) dias. c)                   Liberdade de inscrição para todos os Trabalhadores do estabelecimento, independente de setores ou locais de trabalho, com fornecimento de comprovante. d)                  Garantia de emprego para todos os inscritos até a eleição. e)                   Realização da eleição no prazo mínimo de 30 (trinta) dias antes do término do mandato da CIPA, quando houver. f)                    Realização da eleição em dia normal de trabalho, respeitando os horários de turnos e em horário que possibilite a participação da maioria dos Trabalhadores. g)                  Voto secreto. h)                  Apurarão dos votos, em horário normal de trabalho, com acompanhamento de representante da Empresa e dos Trabalhadores, em número a ser definido pela comissão eleitoral. i)                    Faculdade de eleição por meios eletrônicos. j)                    Guarda pela Empresa, de todos os documentos relativos à eleição, por um período mínimo de 05 (cinco) anos. 8)                   Havendo participação inferior a 50% (cinqüenta por cento) dos Trabalhadores na votação, não haverá a apuração dos votos e a comissão eleitoral deverá organizar outra votação, a qual ocorrerá no prazo máximo de 10 (dez) dias. 9)                   A Empresa garantirá aos membros efetivos da CIPA, representantes dos Trabalhadores, em conjunto ou separadamente, 01 (uma) hora por semana, dentro do período normal de trabalho, para a realização de inspeção de higiene e segurança no trabalho, no âmbito da Empresa. 10)                A Empresa enviará ao Sindicato Laboral, após a eleição, cópia da ata de posse da nova diretoria, no prazo de 14 (quatorze) dias. 11)                A Empresa comunicará ao Sindicato Laboral, com antecedência mínima de 15 (quinze) dias, a realização da Semana Interna de Prevenção de Acidentes, liberando ao mesmo plena participação. 12)                É vedada a dispensa arbitrária ou sem justa causa do Trabalhador eleito como membro para cargo de direção da Comissão Interna de Prevenção de Acidentes, titular ou suplente, desde o registro de sua candidatura até um ano após o final de seu mandato.  8 - TRANSPORTES DE ACIDENTADOS, DOENTES E PARTURIENTES Obriga-se o empregador a transportar, de maneira adequada, o empregado, com urgência para local apropriado, em caso de acidente, mal súbito ou parto, desde que ocorra no horário de trabalho.  9 - TURNOS ININTERRUPTOS DE TRABALHO Ressalvada a não redução de salários, fica assegurado o trabalho em turnos ininterruptos de revezamento, com jornadas de 06 (seis) horas diárias. Alteração da referida jornada, deverá ser precedida de acordo entre as empresas e os trabalhadores diretamente atingidos, com assistência do Sindicato Laboral, para o estabelecimento das condições de trabalhos.  10 - AMAMENTAÇÃO Para a amamentação do próprio filho, de até 06 (seis) meses de idade, a mulher terá direito a 02 (dois) períodos de 30 (trinta) minutos diários, nos horários que melhor lhe convier.    |faz parte integrante da presente cct o anexo i que contém cláusulas com direitos dos trabalhadores previstos pela legislação laboral vigente anexo i convenção coletiva de trabalho 2012/2013 1 ferramentas a é de responsabilidade das empresas o fornecimento de todas as ferramentas necessárias para o desenvolvimento do trabalho ficando proibida a exigência de qualquer ferramenta por parte do empregadorb os trabalhadores se obrigam ao uso devido a manutenção e limpeza adequada das ferramentas que receberemas ferramentas deverão ser substituídas pelas empresas sempre que apresentarem desgastes ou defeitos que possam comprometer a segurança do trabalhadorc para solicitação de substituição das ferramentas deverão os trabalhadores devolver aquelas até então utilizadas efetuando também a devolução por ocasião de rescisão ou extinção do contrato de trabalhod não se permite o desconto salarial por quebra de ferramentas salvo nas hipóteses de dolo culpa ou recusa da apresentação das ferramentas danificadas 2 equipamentos de proteção individual epi's a a empresa fornecerá aos trabalhadores os epi necessários a serem utilizados nos locais de trabalho e serviços onde os equipamentos de proteção coletiva não eliminem por completo os riscos e agressões ambientaisb os epi's deverão ser adaptados de acordo com a necessidade do usuário em caso de eventual deficiência físicac os trabalhadores se obrigam ao uso devido a manutenção e limpeza adequada dos epi'sd os equipamentos de proteção individual deverão ser substituídos pela empresa sempre que apresentarem desgastes ou defeitos que possam comprometer a segurança ou a saúde do trabalhadore para solicitação de substituição dos epi's deverão os trabalhadores devolver aqueles até então utilizados efetuando também a devolução por ocasião da rescisão ou extinção do contrato de trabalhof os epi's fornecidos pela empresa deverão possuir certificado de aprovação e possibilitar condições de conforto no uso pelos trabalhadoresg não se permite o desconto salarial por dano nos epi's salvo nas hipóteses de dolo culpa ou recusa de apresentação dos equipamentos danificados 3 uniformes a a empresa fornecerá ao trabalhador gratuitamente o uniforme necessário para o desenvolvimento do trabalhob os trabalhadores se obrigam ao uso devido a manutenção e limpeza adequada dos uniformes que receberemc os uniformes deverão ser substituídos pela empresa sempre que apresentarem desgastes ou defeitos que possam comprometer a segurança ou a saúde do trabalhadord para solicitação de substituição dos uniformes deverão os trabalhadores devolver aqueles até então utilizados efetuando também a devolução por ocasião da rescisão ou extinção do contrato de trabalhoe os uniformes deverão possibilitar aos trabalhadores plenas condições de confortof não se permite o desconto salarial por dano nos uniformes salvo nas hipóteses de dolo culpa ou recusa de apresentação das peças danificadasg as empresas poderão a seu critério disponibilizar a seus empregados vestiários que serão de uso facultativoo tempo despendido pelos trabalhadores que optarem pelo uso destas instalações para troca de uniforme e higiene pessoal não será computado na jornada de trabalho 4 comprovantes de pagamento as empresas fornecerão obrigatoriamente aos trabalhadores os comprovantes de pagamento envelopes ou recibos especificando o nome da empresa do trabalhador e as parcelas a qualquer título de forma discriminada o valor do recolhimento do fgts e os descontos efetuados 5 recebimento e entrega da ctps as empresas procederão às anotações na carteira de trabalho e previdência social dos trabalhadores no prazo de 48 quarenta e oito horas fornecendo recibo por ocasião de sua apresentação e entrega bem como de outros documentos 6 exames médicos as despesas correspondentes aos exames médicos admissional demissional ou periódico serão de responsabilidade das empresas devendo ser realizados preferencialmente por médicos do trabalho não coincidindo com o gozo de férias do trabalhador e nem com o período de redução do aviso prévioparágrafo primeiro quando do retorno do empregado afastado por mais de 30 trinta dias independente do motivo de afastamento no regresso a empresa deverá realizar o exame médicoparágrafo segundo cópia do resultado dos exames deverá ser fornecida ao empregado que confirmará o recebimento assinado os originais 7 cipa serão observadas as seguintes disposições relativas à cipa1 as empresas com mais de 20 vinte trabalhadores deverão constituir cipa de acordo com o dimensionamento previsto no quadro i da nr52 as empresas com menos de 20 vinte trabalhadores deverão designar um responsável pelo cumprimento dos objetivos da nr53 a eleição da cipa será convocada no prazo mínimo de 60 sessenta dias antes do término do mandato em curso4 a empresa remeterá ao sindicato laboral em 03 três dias após a convocação cópia do edital que convocou a eleição da cipa liberando à mesma participação no evento5 o presidente e o vice-presidente da cipa constituirão dentre seus membros no prazo mínimo de 55 cinqüenta e cinco dias antes do término do mandato em curso a comissão eleitoral ce que será a responsável pela organização e acompanhamento do processo eleitoral6 nos estabelecimentos onde não houver cipa a comissão eleitoral será constituída conjuntamente pela empresa e pelo sindicato laboral7 o processo eleitoral observará as seguintes condições a publicação e divulgação do edital em locais de fácil acesso e visualização pelos trabalhadores no prazo mínimo de 60 sessenta dias antes do término do mandato em curso contendo o local e o prazo para inscrição dos trabalhadores interessadosb inscrição e eleição individual sendo que o período mínimo para inscrição será de 15 quinze diasc liberdade de inscrição para todos os trabalhadores do estabelecimento independente de setores ou locais de trabalho com fornecimento de comprovanted garantia de emprego para todos os inscritos até a eleiçãoe realização da eleição no prazo mínimo de 30 trinta dias antes do término do mandato da cipa quando houverf realização da eleição em dia normal de trabalho respeitando os horários de turnos e em horário que possibilite a participação da maioria dos trabalhadoresg voto secretoh apurarão dos votos em horário normal de trabalho com acompanhamento de representante da empresa e dos trabalhadores em número a ser definido pela comissão eleitorali faculdade de eleição por meios eletrônicosj guarda pela empresa de todos os documentos relativos à eleição por um período mínimo de 05 cinco anos8 havendo participação inferior a 50% cinqüenta por cento dos trabalhadores na votação não haverá a apuração dos votos e a comissão eleitoral deverá organizar outra votação a qual ocorrerá no prazo máximo de 10 dez dias9 a empresa garantirá aos membros efetivos da cipa representantes dos trabalhadores em conjunto ou separadamente 01 uma hora por semana dentro do período normal de trabalho para a realização de inspeção de higiene e segurança no trabalho no âmbito da empresa10 a empresa enviará ao sindicato laboral após a eleição cópia da ata de posse da nova diretoria no prazo de 14 quatorze dias11 a empresa comunicará ao sindicato laboral com antecedência mínima de 15 quinze dias a realização da semana interna de prevenção de acidentes liberando ao mesmo plena participação12 é vedada a dispensa arbitrária ou sem justa causa do trabalhador eleito como membro para cargo de direção da comissão interna de prevenção de acidentes titular ou suplente desde o registro de sua candidatura até um ano após o final de seu mandato 8 transportes de acidentados doentes e parturientes obriga-se o empregador a transportar de maneira adequada o empregado com urgência para local apropriado em caso de acidente mal súbito ou parto desde que ocorra no horário de trabalho 9 turnos ininterruptos de trabalho ressalvada a não redução de salários fica assegurado o trabalho em turnos ininterruptos de revezamento com jornadas de 06 seis horas diáriasalteração da referida jornada deverá ser precedida de acordo entre as empresas e os trabalhadores diretamente atingidos com assistência do sindicato laboral para o estabelecimento das condições de trabalhos 10 amamentação para a amamentação do próprio filho de até 06 seis meses de idade a mulher terá direito a 02 dois períodos de 30 trinta minutos diários nos horários que melhor lhe convier  
74|2012_042489|Other Provisions|As empresas complementarão na rescisão contratual de seus empregados eventuais diferenças do IGP-DI/FGV, acumuladas à partir da última data-base ou data de admissão, até o mês da rescisão contratual, os valores referentes às verbas rescisórias. |as empresas complementarão na rescisão contratual de seus empregados eventuais diferenças do igp-di/fgv acumuladas à partir da última data-base ou data de admissão até o mês da rescisão contratual os valores referentes às verbas rescisórias
75|2012_042489|Other Provisions|As entidades convenentes poderão renegociar durante a vigência desta Convenção Coletiva de Trabalho, as possíveis perdas salariais, e forma de reajuste do mesmo.  |as entidades convenentes poderão renegociar durante a vigência desta convenção coletiva de trabalho as possíveis perdas salariais e forma de reajuste do mesmo 
76|2012_042489|Other Provisions|As horas extraordinárias trabalhadas até o limite de 02 (duas) horas diárias, de segunda a sábado, terão acréscimo de 100% (cem por cento) Parágrafo Único: fica proibida a prorrogação da jornada de trabalho do empregado estudante. |as horas extraordinárias trabalhadas até o limite de 02 duas horas diárias de segunda a sábado terão acréscimo de 100% cem por cento parágrafo único fica proibida a prorrogação da jornada de trabalho do empregado estudante
77|2012_042489|Other Provisions|A cada 6 (seis) dias de trabalho, haverá uma folga (repouso remunerado) que recairá preferivelmente aos domingos. |a cada 6 seis dias de trabalho haverá uma folga repouso remunerado que recairá preferivelmente aos domingos
78|2012_042489|Other Provisions|Assegura-se a freqüência livre dos dirigentes sindicais para participarem de assembléias, reuniões, cursos e congressos sindicais.  |assegura-se a freqüência livre dos dirigentes sindicais para participarem de assembléias reuniões cursos e congressos sindicais 
79|2012_042489|Other Provisions|Não pode haver desconto de qualquer parcela  de salário do empregado correspondente a cheque não compensado ou sem fundos. |não pode haver desconto de qualquer parcela de salário do empregado correspondente a cheque não compensado ou sem fundos
80|2012_042489|Other Provisions|O empregado que rescindir espontaneamente seu contrato de trabalho, antes de completar 1(um) ano de serviço, será pago férias proporcionais na mesma proporção do décimo terceiro salário, ou seja 01/12 ao mês. |o empregado que rescindir espontaneamente seu contrato de trabalho antes de completar 1um ano de serviço será pago férias proporcionais na mesma proporção do décimo terceiro salário ou seja 01/12 ao mês
81|2012_042489|Other Provisions|O início das férias coletivas ou individuais, não poderá coincidir com sábado, domingo, feriados ou dia de compensação de repouso semanal. Parágrafo Primeiro – o empregado estudante, menor de 18 (dezoito) anos, terá direito a fazer coincidir suas férias com as férias escolares. Parágrafo Segundo – quando marido e mulher trabalharem na mesma empresa deverá esta conceder as férias a ambos de forma conjunta. |o início das férias coletivas ou individuais não poderá coincidir com sábado domingo feriados ou dia de compensação de repouso semanalparágrafo primeiro o empregado estudante menor de 18 dezoito anos terá direito a fazer coincidir suas férias com as férias escolaresparágrafo segundo quando marido e mulher trabalharem na mesma empresa deverá esta conceder as férias a ambos de forma conjunta
82|2012_042489|Other Provisions|Fica vedada a dispensa da gestante, desde a concepção até 120 (cento e vinte) dias após o término do benefício previdenciário |fica vedada a dispensa da gestante desde a concepção até 120 cento e vinte dias após o término do benefício previdenciário 
83|2012_042489|Other Provisions|É garantido as mulheres, no período de amamentação, o recebimento do salário sem prestação de serviços, quando o empregado não cumprir as determinações dos §§ 1 e 2 do art. 389 da CLT. |é garantido as mulheres no período de amamentação o recebimento do salário sem prestação de serviços quando o empregado não cumprir as determinações dos §§ 1 e 2 do art389 da clt
84|2012_042489|Other Provisions|Será garantido o emprego o salário ao trabalhador, durante os 48 meses, imediatamente anterior a sua aposentadoria. |será garantido o emprego o salário ao trabalhador durante os 48 meses imediatamente anterior a sua aposentadoria
85|2012_042489|Other Provisions|A partir do conhecimento pelo empregado, de seu alistamento ao serviço militar, terá o mesmo estabilidade no emprego até 90(noventa) dias após a dispensa ou baixa. |a partir do conhecimento pelo empregado de seu alistamento ao serviço militar terá o mesmo estabilidade no emprego até 90noventa dias após a dispensa ou baixa
86|2012_042489|Other Provisions|Será abonada as faltas do empregado estudante e vestibulandos nos horários de exames regulares ou vestibulares, quando coincidirem com o horário de trabalho para realização das provas. |será abonada as faltas do empregado estudante e vestibulandos nos horários de exames regulares ou vestibulares quando coincidirem com o horário de trabalho para realização das provas
87|2012_042489|Other Provisions|No caso de necessidade de consulta médica e filho(a) até 14 anos de idade ou inválido com qualquer idade, mediante comprovação médica, a mãe empregada terá sua falta abonada e remunerada. |no caso de necessidade de consulta médica e filhoa até 14 anos de idade ou inválido com qualquer idade mediante comprovação médica a mãe empregada terá sua falta abonada e remunerada
88|2012_042489|Other Provisions|Os atestados médicos e odontológicos fornecidos pôr profissionais do INSS, particularidades ou do sindicato profissional, serão aceitos pelas empresas. |os atestados médicos e odontológicos fornecidos pôr profissionais do inss particularidades ou do sindicato profissional serão aceitos pelas empresas
89|2012_042489|Other Provisions|Obriga-se o empregador a providenciar o transporte do empregado, com urgência e segurança, para local apropriado, em caso de acidente, mal súbito ou parto, desde que ocorram no horário de trabalho ou em conseqüência deste.   |obriga-se o empregador a providenciar o transporte do empregado com urgência e segurança para local apropriado em caso de acidente mal súbito ou parto desde que ocorram no horário de trabalho ou em conseqüência deste 
