2013_073410|Retirement|Ressalvadas as situações mais favoráveis já existentes, ao empregado com 4 (quatro) anos ou mais de serviços contínuos dedicados à mesma empresa, quando dela vier a desligar-se definitivamente por motivo de aposentadoria, será pago um abono a título de indenização, equivalente ao seu ultimo salário nominal, percebido na empresa. |ressalvadas situação favorável existente empregado ano serviço contínuo dedicar mesmo empresa de ela vier definitivamente motivo aposentadoria ser pagar abono título indenização equivalente ultimo salário nominal percebir empresa|0.1873243154424289|0.0|0.0|0.0|0.0|0.0|0.0|0.0|0.0|0.0|0.0|0.0|0.0|0.0|0.09360797672736532|0.0|0.0|0.0|0.0|0.0|0.0|0.0|0.0|0.08844677746158426|0.0|0.0|0.0|0.0|0.0|0.0|0.0|0.0|0.0|0.0|0.0|0.0|0.0|0.0|0.0|0.0|0.0|0.0|0.0|0.0|0.0|0.0|0.0|0.0|0.0|0.0|0.0|0.0|0.0|0.0|0.0|0.0|0.0|0.0|0.0|0.0|0.0|0.0|0.0|0.0|0.0|0.0|0.0|0.0|0.0|0.0|0.0|0.20884515475692705|0.0|0.0|0.0|0.0|0.0|0.20884515475692705|0.0|0.0|0.0|0.0|0.23917707417360887|0.0|0.0|0.23917707417360887|0.0|0.0|0.0|0.0|0.0|0.0|0.0|0.0|0.0|0.0|0.0|0.0|0.0|0.0|0.0|0.0|0.0|0.0|0.0|0.0|0.0|0.0|0.23917707417360887|0.0|0.08844677746158426|0.0|0.0|0.0|0.0|0.0|0.0|0.1672375959601378|0.0|0.0|0.0|0.20884515475692705|0.0|0.0|0.0|0.0|0.0|0.0|0.0|0.0|0.0|0.0|0.0|0.0|0.1873243154424289|0.0|0.0|0.0|0.0|0.0|0.20884515475692705|0.0|0.0|0.0|0.0|0.0|0.0|0.0|0.0|0.0|0.0|0.0|0.0|0.0|0.0|0.0|0.0|0.0|0.0|0.0|0.0|0.0|0.0|0.0|0.0|0.0|0.15699239602574708|0.0|0.0|0.0|0.0|0.0|0.0|0.0|0.0|0.0|0.0|0.0|0.0|0.0|0.0|0.0|0.0|0.0|0.0|0.0|0.0|0.14546073545854532|0.0|0.20884515475692705|0.0|0.0|0.0|0.0|0.0|0.23917707417360887|0.0|0.0|0.0|0.0|0.0|0.0|0.0|0.0|0.0|0.20884515475692705|0.0|0.0|0.0|0.0|0.0|0.0|0.0|0.0|0.0|0.23917707417360887|0.0|0.0|0.0|0.0|0.0|0.0|0.0|0.0|0.0|0.0|0.0|0.0|0.0|0.0|0.0|0.0|0.0|0.0|0.0|0.0|0.0|0.0|0.0|0.0|0.0|0.0|0.0|0.0|0.0|0.0|0.0|0.0|0.0|0.0|0.0|0.0|0.0|0.23917707417360887|0.0|0.0|0.0|0.0|0.0|0.0|0.0|0.10513963729456707|0.0|0.12666047660906526|0.11164875983657363|0.0|0.0|0.0|0.0|0.17063145560944604|0.0|0.0|0.0|0.0|0.0|0.0|0.0|0.0|0.0|0.0|0.0|0.0|0.0|0.0|0.0|0.0|0.0|0.0|0.0|0.0|0.23917707417360887|0.23917707417360887|0.0|0.0|0.0|0.0|0.20884515475692705|0.0|0.0|0.0|0.0|0.0|0.0|0.0
2013_073410|Retirement Assurances|Aos empregados que comprovadamente estiverem a um máximo de 12(doze) meses da aquisição do direito à aposentadoria em seus prazos mínimos, e contém com o mínimo de 04 (quatro) anos de serviço contínuo na empresa, fica assegurado o emprego ou salário durante o período que faltar para aposentar-se, ficando excluídas desta garantia de rescisões por justa causa, rescisões por acordo entre as partes e pedidos de demissão. |empregado comprovadamente estar aquisição direito aposentadoria prazo mínimo contém mínimo ano serviço contínuo empresa ficar assegurar emprego salário durante período faltar ficar excluír garantia rescisão justa causa rescisão acordo parte pedido demissão|0.0|0.0|0.0|0.0|0.0|0.17923536330007275|0.0|0.0|0.0|0.0|0.0|0.0|0.0|0.0|0.09832805830899369|0.0|0.0|0.0|0.0|0.0|0.0|0.0|0.0|0.09290661111942213|0.0|0.0|0.0|0.0|0.142302564302938|0.15279543664846304|0.0|0.0|0.0|0.0|0.0|0.0|0.0|0.0|0.0|0.1330471949600447|0.0|0.0|0.0|0.0|0.0|0.0|0.0|0.0|0.0|0.0|0.0|0.19676994264240733|0.0|0.0|0.0|0.0|0.0|0.0|0.0|0.0|0.0|0.0|0.0|0.0|0.0|0.0|0.0|0.0|0.0|0.0|0.2512373209818767|0.21937594714069533|0.0|0.0|0.0|0.0|0.0|0.0|0.0|0.0|0.0|0.0|0.0|0.0|0.0|0.0|0.0|0.142302564302938|0.0|0.0|0.0|0.0|0.0|0.0|0.0|0.0|0.0|0.1330471949600447|0.0|0.0|0.0|0.0|0.0|0.0|0.16490856880122604|0.0|0.0|0.0|0.0|0.0|0.09290661111942213|0.0|0.0|0.0|0.0|0.0|0.11727852850950554|0.08783518596346865|0.0|0.0|0.0|0.0|0.0|0.0|0.0|0.0|0.142302564302938|0.0|0.0|0.0|0.0|0.2512373209818767|0.0|0.0|0.0|0.0|0.0|0.0|0.0|0.142302564302938|0.0|0.0|0.284605128605876|0.0|0.0|0.0|0.0|0.0|0.0|0.0|0.15279543664846304|0.0|0.0|0.0|0.0|0.0|0.0|0.0|0.0|0.0|0.0|0.0|0.0|0.0|0.0|0.0|0.0|0.0|0.0|0.0|0.0|0.0|0.0|0.0|0.0|0.0|0.0|0.1330471949600447|0.0|0.0|0.0|0.0|0.0|0.0|0.0|0.0|0.0|0.0|0.0|0.0|0.0|0.284605128605876|0.0|0.0|0.0|0.0|0.0|0.0|0.0|0.0|0.0|0.0|0.0|0.0|0.0|0.0|0.0|0.0|0.21937594714069533|0.0|0.19676994264240733|0.0|0.0|0.0|0.0|0.0|0.0|0.0|0.10415144917095587|0.0|0.0|0.0|0.0|0.142302564302938|0.0|0.0|0.0|0.0|0.0|0.0|0.0|0.0|0.0|0.0|0.0|0.0|0.0|0.0|0.0|0.0|0.0|0.0|0.0|0.0|0.0|0.0|0.0|0.0|0.0|0.0|0.43875189428139066|0.0|0.0|0.0|0.0|0.0|0.0|0.0|0.0|0.0|0.0|0.11044119046175667|0.0|0.0|0.11727852850950554|0.0|0.0|0.0|0.0|0.0|0.0|0.0|0.0|0.0|0.0|0.0|0.0|0.0|0.0|0.0|0.0|0.0|0.0|0.0|0.0|0.0|0.0|0.0|0.0|0.0|0.0|0.0|0.0|0.0|0.0|0.0|0.0|0.0|0.0|0.0|0.0|0.0|0.0|0.0
2010_074884|Retirement|Aos empregados que comprovarem estar a um máximo de 24(vinte e quatro) meses da aquisição do direito à aposentadoria, seja ela por idade, a especial e ainda, a por tempo de serviço na empresa, nos seus prazos mínimos, ficará assegurado emprego ou indenização por aposentadoria, correspondente ao período que faltar para a aposentadoria, sem prejuízo de outros eventuais direitos porventura existentes.  Referida verba não terá cunho salarial, não integrando a remuneração para nenhum fim ou efeito. PARÁGRAFO PRIMEIRO - Caso o empregado dependa de documentação hábil para comprovação de tempo de serviço, terá 90(noventa) dias de prazo, a partir do término do aviso prévio legal, em qualquer modalidade da aposentadoria, para apresentá-lo à empresa. Este prazo poderá ser prorrogado mediante requerimento do empregado, justificando a dificuldade de obtenção dos documentos comprobatórios junto ao INSS, por sucessivos períodos de 90 dias, até o limite máximo de 360 dias; PARÁGRAFO SEGUNDO - O prazo aqui definido será solicitado por escrito pelo empregado, no prazo de 15 dias, após o recebimento da notificação de dispensa, não sendo devido o pagamento dos dias excedentes ao prazo do aviso prévio legal e acordado; PARÁGRAFO TERCEIRO - Entende-se como documento hábil para aprovação do tempo de serviço o documento fornecido pela previdência social que defere a contagem de tempo de serviço, anteriormente solicitada, pelo empregado. Não será aceito pela empresa em hipótese alguma o simples protocolo de requerimento da contagem de tempo de serviço; PARAGRAFO QUARTO - Caso o empregado deixe de exercer o direito a aposentadoria, de que trata essa cláusula, no momento de seu surgimento, não ocorrerá para ele nova garantia de emprego.|empregado comprovar aquisição direito aposentadoria ser idade especial serviço empresa prazo mínimo ficar assegurar emprego indenização aposentadoria correspondente período faltar aposentadoria prejuízo eventual direito porventura existente referida verba ter cunho salarial integrar remuneração nenhum efeito parágrafo caso empregado dependar documentação hábil comprovação serviço ter dia prazo término aviso prévio legal modalidade aposentadoria empresa prazo prorrogar mediante requerimento empregado justificar dificuldade obtenção documento comprobatório junto inss sucessivo período dia limite dia parágrafo prazo definir ser solicitar escrito empregado prazo dia recebimento notificação dispensa ser devido pagamento dia excedente prazo aviso prévio legal acordar parágrafo documento hábil aprovação serviço documento fornecer previdência social deferir contagem serviço anteriormente solicitar empregado ser aceger empresa hipótese algum simples protocolo requerimento contagem serviço paragrafo caso empregado deixar exercer direito aposentadoria tratar cláusula surgimento ocorrer garantia emprego|0.0|0.0|0.08584999983666909|0.0|0.08584999983666909|0.0|0.0|0.0|0.0|0.0|0.08584999983666909|0.0|0.0|0.0|0.0|0.0|0.0|0.0|0.0|0.08584999983666909|0.0|0.0|0.0|0.1587350262742857|0.0|0.0|0.0|0.08584999983666909|0.04862603642810729|0.05221154309419094|0.0|0.0|0.0|0.0|0.17169999967333818|0.0|0.0|0.0|0.09725207285621458|0.0|0.0|0.0|0.0|0.04862603642810729|0.0|0.0|0.0|0.0|0.0|0.0|0.08584999983666909|0.0|0.0|0.05221154309419094|0.0672380181323882|0.0|0.0|0.0|0.0|0.0|0.0|0.0|0.0|0.0|0.12249259664050118|0.0|0.0|0.0|0.0|0.0|0.0|0.0|0.05635070677127564|0.0|0.0|0.08584999983666909|0.0|0.0|0.0|0.0|0.0|0.0|0.0|0.08584999983666909|0.08584999983666909|0.0|0.07496268847555652|0.0|0.0|0.0|0.07496268847555652|0.0|0.0|0.08584999983666909|0.0|0.2610577154709547|0.08584999983666909|0.1363901862304892|0.0|0.0672380181323882|0.0|0.0|0.07496268847555652|0.2575499995100073|0.0|0.06124629832025059|0.0|0.0|0.0|0.0|0.19048203152914284|0.0|0.0|0.0|0.0|0.0|0.08015020709532351|0.09004216417147917|0.0|0.0|0.0|0.0|0.06124629832025059|0.0672380181323882|0.0|0.0|0.0|0.0|0.0|0.08584999983666909|0.08584999983666909|0.0|0.08584999983666909|0.0|0.0672380181323882|0.0|0.0|0.0|0.0|0.04862603642810729|0.0|0.0|0.04862603642810729|0.0|0.0|0.08584999983666909|0.0|0.0|0.0|0.0|0.05221154309419094|0.0|0.0|0.0|0.06124629832025059|0.0|0.0|0.17169999967333818|0.05635070677127564|0.0|0.0|0.0|0.0|0.0|0.0|0.0|0.05635070677127564|0.0|0.0|0.0672380181323882|0.08584999983666909|0.0|0.0|0.0|0.0|0.08584999983666909|0.0|0.0|0.08584999983666909|0.1344760362647764|0.0|0.0|0.08584999983666909|0.08584999983666909|0.0|0.0|0.0|0.0|0.08584999983666909|0.0|0.0|0.04862603642810729|0.0|0.0|0.08584999983666909|0.0|0.0|0.0|0.07496268847555652|0.0|0.0|0.08584999983666909|0.0672380181323882|0.0|0.07496268847555652|0.0|0.08584999983666909|0.0|0.0|0.1566346292825728|0.0|0.0|0.0|0.0|0.0|0.0|0.0|0.0|0.07117893041822723|0.0|0.0|0.08584999983666909|0.0|0.29175621856864375|0.0|0.08584999983666909|0.0|0.0|0.0|0.0|0.07496268847555652|0.08584999983666909|0.0|0.08584999983666909|0.0|0.0|0.17169999967333818|0.0|0.0|0.07496268847555652|0.0|0.08584999983666909|0.0|0.0|0.07496268847555652|0.0|0.17169999967333818|0.0|0.0|0.0|0.0|0.0|0.0|0.0|0.0|0.0|0.0|0.0|0.0|0.08584999983666909|0.0|0.0|0.0|0.1818535816406523|0.2003755177383088|0.0|0.0|0.07496268847555652|0.0|0.0|0.07496268847555652|0.17169999967333818|0.0|0.0|0.08584999983666909|0.0|0.0|0.08584999983666909|0.11270141354255128|0.0|0.0|0.0|0.0|0.0|0.0|0.07496268847555652|0.0|0.0|0.0|0.08584999983666909|0.0|0.0|0.0|0.0|0.08584999983666909|0.0|0.0|0.0|0.0|0.0|0.0|0.0|0.0|0.0
2012_042462|Retirement|Para os empregados aposentados até 31/07/2009, ficam ressalvadas as condições mais favoráveis existentes nas CCTs anteriores firmadas em relação a cláusula abono aposentadoria. A partir de 01/08/2009 os Trabalhadores que contarem com mais de 10 (dez) anos na mesma Empresa, e que vierem a se aposentar em qualquer situação receberão abono equivalente a 60 (sessenta) dias da respectiva remuneração. Fica facultado à empresa, quando da continuidade da relação de emprego, o pagamento do Abono Aposentadoria em até 02 (duas) parcelas mensais iguais e consecutivas, após a formalização e entrega do comunicado pelo empregado. |empregado aposentar ficar ressalvado condição favorável existente ccts anterior firmada cláusula abono aposentadoria trabalhadores contarir ano mesmo empresa vierem aposentar situação receber abono equivalente sessenta dia respectivo remuneração ficar facultar empresa continuidade emprego pagamento abono aposentadoria parcela mensal igual consecutivo formalização entrega comunicado empregado|0.4035692676691424|0.0|0.0|0.0|0.0|0.0|0.0|0.0|0.0|0.0|0.0|0.0|0.0|0.0|0.06722263564953157|0.0|0.0|0.0|0.13452308922304748|0.0|0.0|0.0|0.0|0.12703245393268153|0.22548169518764044|0.0|0.0|0.0|0.0|0.0|0.0|0.0|0.0|0.0|0.0|0.0|0.0|0.0|0.0|0.0|0.0|0.17176007723915718|0.0|0.09728610120693776|0.0|0.0|0.0|0.0|0.0|0.0|0.0|0.0|0.0|0.0|0.0|0.17176007723915718|0.0|0.0|0.0|0.11274084759382022|0.0|0.0|0.14997783560992992|0.0|0.0|0.0|0.17176007723915718|0.17176007723915718|0.0|0.0|0.0|0.0|0.0|0.0|0.0|0.0|0.0|0.0|0.0|0.0|0.0|0.0|0.0|0.0|0.0|0.0|0.0|0.0|0.0|0.0|0.0|0.0|0.0|0.0|0.0|0.10445962366564128|0.0|0.0|0.0|0.0|0.0|0.0|0.0|0.0|0.0|0.0|0.0|0.0|0.0|0.0|0.12703245393268153|0.0|0.0|0.0|0.0|0.0|0.08017825152951884|0.12009822638165608|0.0|0.0|0.17176007723915718|0.14997783560992992|0.0|0.0|0.0|0.0|0.0|0.0|0.0|0.0|0.0|0.0|0.0|0.0|0.13452308922304748|0.0|0.0|0.17176007723915718|0.0|0.0|0.14997783560992992|0.0|0.19457220241387552|0.17176007723915718|0.17176007723915718|0.0|0.0|0.0|0.0|0.0|0.0|0.0|0.0|0.0|0.0|0.0|0.0|0.0|0.0|0.17176007723915718|0.0|0.0|0.0|0.0|0.0|0.0|0.0|0.0|0.0|0.0|0.0|0.0|0.0|0.0|0.0|0.0|0.0|0.0|0.0|0.0|0.0|0.0|0.0|0.0|0.0|0.17176007723915718|0.0|0.10445962366564128|0.0|0.0|0.0|0.0|0.0|0.0|0.0|0.0|0.0|0.0|0.0|0.0|0.0|0.0|0.0|0.0|0.14997783560992992|0.0|0.0|0.17176007723915718|0.0|0.0|0.0|0.0|0.0|0.0|0.0|0.0|0.0|0.0|0.0|0.0|0.0|0.0|0.0|0.0|0.0|0.0|0.0|0.0|0.0|0.0|0.0|0.0|0.0|0.0|0.0|0.0|0.0|0.0|0.14997783560992992|0.0|0.0|0.0|0.0|0.0|0.14997783560992992|0.0|0.0|0.0|0.0|0.0|0.0|0.0|0.17176007723915718|0.0|0.17176007723915718|0.0|0.0|0.0|0.0|0.0|0.0|0.0|0.0|0.0|0.0|0.13452308922304748|0.0|0.0|0.0|0.12253545661167771|0.0|0.0|0.0|0.0|0.0|0.0|0.0|0.0|0.0|0.0|0.0|0.0|0.0|0.17176007723915718|0.0|0.0|0.0|0.0|0.0|0.0|0.0|0.0|0.0|0.0|0.0|0.0|0.0|0.17176007723915718|0.0|0.0|0.0|0.0|0.0|0.0
2016_082062|Retirement Assurances|GARANTIA DE EMPREGO DO FUTURO APOSENTADO: Fica assegurado aos empregados em geral, sejam homens ou mulheres, em vias de aposentadoria, nos prazos mínimos legais, de conformidade com o previsto nos termos do art. 188 do Decreto n.º 3.048/99, garantia de emprego, como segue:        TEMPO DE TRABALHO NA MESMA EMPRESA    ESTABILIDADE     20 anos ou mais   2 anos     10 anos ou mais   1 ano     5 anos ou mais   6 meses      Parágrafo 1º - Para a concessão das garantias acima, o (a) empregado (a) deverá apresentar comprovante fornecido pelo INSS,  nos  termos  do  art. 130  do  Decreto n.º   3.048/99, no prazo máximo de 30 dias após a sua emissão, que ateste, respectivamente, os períodos de 2 anos, 1 ano ou 6 meses restantes para a implementação do benefício. A contagem da estabilidade inicia-se a partir da apresentação dos comprovantes pelo empregado, limitada ao tempo que faltar para aposentar-se.  Parágrafo 2º - A concessão prevista nesta cláusula ocorrerá uma única vez, podendo a obrigação ser substituída por uma indenização correspondente aos salários do período não cumprido ou não implementado da garantia, não se aplicando nas hipóteses de encerramento das atividades da empresa e dispensa por justa causa ou pedido de demissão.  Parágrafo 3º - O empregado que deixar de apresentar o comprovante fornecido pelo INSS no prazo estipulado no parágrafo 1º, ou de pleitear a aposentadoria na data em que adquirir essa condição, não fará jus à garantia de emprego e/ou indenização correspondentes, previstas no parágrafo anterior.  Parágrafo 4º - Na hipótese de legislação superveniente que vier a alterar as condições para aposentadoria em vigor, esta cláusula ficará sem efeito. |garantia emprego futuro aposentado ficar assegurar empregado ser homem mulher vias aposentadoria prazo mínimo legal conformidade prever termos decreto garantia emprego seguir trabalho mesma empresa estabilidade ano ano ano ano ano parágrafo concessão garantia acima empregar apresentar comprovante fornecir inss termos decreto prazo dia emissão atestir respectivamente período ano ano restante implementação benefício contagem estabilidade apresentação comprovante empregado limitar faltar parágrafo concessão prever cláusula ocorrer único poder obrigação substituir indenização correspondente salário período cumprir implementar garantia aplicar hipótese encerramento atividade empresa dispensar justa causa pedir demissão parágrafo empregado deixar apresentar comprovante fornecir inss prazo estipular parágrafo pleitear aposentadoria data adquirir condição jus garantia emprego indenização correspondente prever parágrafo anterior parágrafo hipótese legislação superveniente vier alterar condição aposentadoria vigor cláusula ficar efeito|0.0|0.0|0.0|0.07246672842184285|0.0|0.0|0.0|0.0|0.07246672842184285|0.0|0.0|0.09252605588299458|0.0|0.0|0.2534868294123552|0.0|0.0|0.0|0.07246672842184285|0.0|0.0|0.06600906734755252|0.09252605588299458|0.1026473565958228|0.0|0.1449334568436857|0.0807921015285347|0.0|0.0|0.05627173166291675|0.0|0.0807921015285347|0.0807921015285347|0.0|0.0|0.0|0.09252605588299458|0.0|0.0|0.04899881971292311|0.0|0.0|0.0|0.10481480192138226|0.0|0.0|0.0|0.0|0.0|0.0|0.0|0.0|0.2423763045856041|0.0|0.0|0.0|0.0|0.0|0.1615842030570694|0.12146554813476597|0.0|0.0807921015285347|0.0|0.0|0.06600906734755252|0.0|0.0|0.0|0.0|0.0|0.0|0.0|0.12146554813476597|0.0|0.0807921015285347|0.0|0.07246672842184285|0.0|0.0|0.0|0.0|0.1615842030570694|0.0|0.0|0.0|0.0|0.0807921015285347|0.05240740096069113|0.0|0.0|0.0|0.0|0.0|0.0|0.0|0.05627173166291675|0.0|0.0|0.0|0.0|0.07246672842184285|0.0|0.0|0.0|0.0|0.06600906734755252|0.0|0.0|0.0|0.09252605588299458|0.1026473565958228|0.0|0.0|0.0|0.09252605588299458|0.0|0.12957453502931582|0.06469614699907882|0.0807921015285347|0.0|0.0|0.0|0.0|0.0|0.0|0.13201813469510504|0.0|0.0|0.09252605588299458|0.0|0.0|0.0|0.0|0.0|0.0|0.0|0.0|0.0|0.0|0.05240740096069113|0.0|0.0|0.10481480192138226|0.0|0.0|0.0|0.1615842030570694|0.0|0.0|0.09252605588299458|0.28135865831458373|0.0|0.0|0.0|0.13201813469510504|0.0807921015285347|0.0|0.0|0.0|0.0|0.0|0.0|0.0|0.07246672842184285|0.0807921015285347|0.0|0.12146554813476597|0.0|0.0|0.1449334568436857|0.0|0.0|0.0|0.0|0.0|0.0|0.09252605588299458|0.04899881971292311|0.0|0.07246672842184285|0.0807921015285347|0.0807921015285347|0.0|0.0|0.0|0.0|0.0807921015285347|0.0|0.0|0.0|0.0807921015285347|0.05240740096069113|0.0|0.0|0.0|0.0|0.0|0.0|0.0|0.0807921015285347|0.0|0.0|0.07246672842184285|0.0|0.0|0.0|0.0|0.0|0.0|0.33763038997750044|0.0|0.07246672842184285|0.0|0.0|0.0|0.0|0.0|0.0|0.0767141025754043|0.09252605588299458|0.060732774067382984|0.0|0.0|0.15722220288207336|0.0|0.0|0.0|0.0|0.0|0.21740018526552854|0.0|0.0|0.0|0.0|0.0|0.0|0.0|0.0|0.0|0.0|0.0|0.0|0.0|0.0|0.0|0.0|0.0|0.0|0.0|0.0|0.0|0.0807921015285347|0.0|0.0|0.0|0.0807921015285347|0.0|0.0|0.0|0.0|0.0|0.040673446606231255|0.0807921015285347|0.04899881971292311|0.0|0.0|0.0|0.0|0.0|0.0|0.0|0.0|0.0|0.0807921015285347|0.0|0.0|0.09252605588299458|0.0|0.0|0.0|0.1615842030570694|0.0|0.0|0.0|0.05627173166291675|0.0|0.0|0.0|0.0|0.0|0.0|0.0|0.0|0.0|0.0|0.07246672842184285|0.0807921015285347|0.0|0.0807921015285347|0.0|0.0|0.0|0.0|0.06600906734755252
2010_075192|Retirement|As empresas empregadoras não poderão efetuar a dispensa de empregado-jornalista que tenha mais que cinco anos consecutivos de serviço prestado à mesma empresa, no período de 18 meses que antecedem à data de aquisição do direito à aposentadoria por tempo de serviço. Na hipótese em que essas condições não se cumpram, o contrato de trabalho poderá ser rescindido, a pedido do empregado-jornalista, por justa causa ou acordo. Parágrafo Primeiro – Completado o tempo de serviço e adquirido o direito à aposentadoria, cessam os efeitos desta cláusula. Parágrafo Segundo – Em caso de dispensa, o empregado-jornalista deverá notificar a empresa empregadora sobre o seu enquadramento na presente cláusula, sob pena de decair seu direito. |empresa empregadoro poder efetuar dispensa ter ano consecutivo serviço prestar mesmo empresa período anteceder data aquisição direito aposentadoria serviço hipótese condição cumpr contrato trabalho rescinder pedido justa causa acordo parágrafo completado serviço adquirir direito aposentadoria cessar efeito cláusula parágrafo caso dispensa notificar empresa empregadora enquadramento presente cláusula pena decair direito|0.0|0.0|0.0|0.0|0.0|0.12475509100030616|0.0|0.0|0.13695987024268544|0.0|0.0|0.0|0.0|0.0|0.06844032135379916|0.0|0.1748713773034455|0.0|0.0|0.0|0.0|0.0|0.0|0.1293335479263523|0.0|0.0|0.0|0.0|0.09904836318192539|0.0|0.0|0.0|0.0|0.0|0.0|0.0|0.0|0.0|0.09904836318192539|0.0926062502899455|0.0|0.0|0.1748713773034455|0.19809672636385078|0.0|0.0|0.0|0.1748713773034455|0.0|0.0|0.0|0.0|0.0|0.0|0.0|0.0|0.0|0.0|0.0|0.11478306026631549|0.0|0.0|0.1526945673270755|0.0|0.0|0.0|0.0|0.0|0.13695987024268544|0.0|0.0|0.0|0.0|0.1748713773034455|0.0|0.0|0.13695987024268544|0.0|0.1748713773034455|0.0|0.0|0.0|0.0|0.0|0.0|0.0|0.0|0.0|0.0|0.0|0.0|0.0|0.0|0.0|0.0|0.0|0.0|0.27781875086983654|0.0|0.2739197404853709|0.0|0.0|0.0|0.0|0.0|0.12475509100030616|0.0|0.1748713773034455|0.0|0.0|0.0|0.0|0.1748713773034455|0.1748713773034455|0.0|0.0|0.0|0.18341056836349598|0.0|0.1748713773034455|0.0|0.0|0.0|0.0|0.0|0.0|0.0|0.0|0.0|0.0|0.0|0.0|0.0|0.0|0.0|0.0|0.0|0.0|0.0|0.0|0.0|0.0|0.0|0.0|0.0|0.0|0.0|0.0|0.0|0.0|0.0|0.0|0.0|0.0|0.12475509100030616|0.0|0.0|0.0|0.0|0.0|0.0|0.0|0.0|0.0|0.0|0.0|0.0|0.0|0.0|0.0|0.0|0.0|0.0|0.0|0.0|0.0|0.0|0.0926062502899455|0.0|0.0|0.0|0.0|0.0|0.0|0.0|0.0|0.0|0.1063518284145592|0.0|0.0|0.0|0.0|0.0|0.0|0.0|0.0|0.0|0.1748713773034455|0.0|0.0|0.0|0.0|0.0|0.0|0.0|0.0|0.0|0.0|0.0|0.2127036568291184|0.13695987024268544|0.0|0.1526945673270755|0.0|0.0|0.0|0.0|0.0|0.0724936378619826|0.0|0.11478306026631549|0.0|0.0|0.0|0.0|0.0|0.1526945673270755|0.1526945673270755|0.0|0.0|0.0|0.0|0.0|0.0|0.0|0.0|0.0|0.0|0.0|0.0|0.0|0.0|0.0|0.0|0.0|0.0|0.0|0.0|0.1526945673270755|0.0|0.0|0.0|0.0|0.0|0.0|0.0|0.0|0.0|0.0|0.0|0.0|0.0|0.0|0.0|0.24489185438406322|0.0|0.0|0.0|0.0|0.0|0.0|0.0|0.0|0.0|0.0|0.0|0.0|0.0|0.11478306026631549|0.0|0.0|0.0|0.0|0.0|0.1063518284145592|0.0|0.0|0.0|0.0|0.0|0.0|0.0|0.0|0.0|0.0|0.0|0.0|0.0|0.0|0.0|0.0|0.0|0.0|0.0
2015_043120|Retirement Assurances|Aos empregados que comprovarem estar a um máximo de 24 (vinte quatro) meses da aquisição do direito a aposentadoria por tempo de serviço ou idade, em seus prazos mínimos e, que contem com um mínimo de 5 (cinco) anos na empresa, ficará assegurado emprego ou salário durante o período que faltar para completar o período de aquisição; |empregado comprovar aquisição direito aposentadoria serviço idade prazo mínimo contar mínimo ano empresa ficar assegurar emprego salário durante período faltar completar período aquisição|0.0|0.0|0.0|0.0|0.0|0.0|0.0|0.0|0.0|0.0|0.0|0.0|0.0|0.0|0.13504860787934211|0.0|0.0|0.0|0.0|0.0|0.0|0.0|0.0|0.1276025247548059|0.0|0.0|0.0|0.0|0.39089072920327494|0.2098567933157667|0.0|0.0|0.0|0.0|0.0|0.0|0.0|0.0|0.0|0.0|0.0|0.0|0.0|0.0|0.0|0.0|0.0|0.0|0.24617069341853332|0.0|0.0|0.0|0.0|0.2098567933157667|0.0|0.0|0.0|0.0|0.0|0.0|0.0|0.0|0.0|0.0|0.0|0.27025355003806206|0.0|0.0|0.0|0.0|0.0|0.0|0.0|0.0|0.0|0.0|0.0|0.0|0.0|0.0|0.0|0.0|0.0|0.0|0.0|0.0|0.0|0.0|0.0|0.0|0.0|0.0|0.0|0.0|0.0|0.0|0.0|0.18273358358345626|0.0|0.0|0.0|0.0|0.0|0.0|0.2264935668107592|0.0|0.0|0.0|0.0|0.0|0.1276025247548059|0.0|0.0|0.0|0.0|0.0|0.16107611887926185|0.1206371791652129|0.0|0.0|0.0|0.0|0.0|0.0|0.0|0.0|0.0|0.0|0.0|0.0|0.0|0.0|0.0|0.0|0.0|0.0|0.0|0.0|0.0|0.19544536460163747|0.0|0.0|0.19544536460163747|0.0|0.0|0.0|0.0|0.0|0.0|0.0|0.0|0.0|0.0|0.0|0.0|0.0|0.0|0.0|0.2264935668107592|0.0|0.0|0.0|0.0|0.0|0.0|0.0|0.0|0.0|0.0|0.0|0.0|0.0|0.0|0.0|0.0|0.0|0.0|0.0|0.0|0.0|0.0|0.0|0.0|0.0|0.0|0.0|0.0|0.0|0.0|0.0|0.0|0.39089072920327494|0.0|0.0|0.0|0.0|0.0|0.0|0.0|0.0|0.0|0.0|0.0|0.0|0.0|0.0|0.0|0.0|0.0|0.0|0.0|0.0|0.0|0.0|0.0|0.0|0.0|0.0|0.2860934805598034|0.0|0.0|0.0|0.0|0.19544536460163747|0.0|0.0|0.0|0.0|0.0|0.0|0.0|0.0|0.0|0.0|0.0|0.0|0.0|0.0|0.0|0.0|0.0|0.0|0.0|0.0|0.0|0.0|0.0|0.0|0.0|0.0|0.0|0.0|0.0|0.0|0.0|0.0|0.0|0.0|0.0|0.0|0.0|0.15168538137433457|0.0|0.0|0.16107611887926185|0.0|0.0|0.0|0.0|0.0|0.0|0.0|0.0|0.0|0.0|0.0|0.0|0.0|0.0|0.0|0.0|0.0|0.0|0.0|0.0|0.0|0.0|0.0|0.0|0.0|0.0|0.0|0.0|0.0|0.0|0.0|0.0|0.0|0.0|0.0|0.0|0.0|0.0|0.0
2012_032551|Retirement|A(s) empresa(s) pagará (ão) ao empregado que se aposentar, um abono de 01 (um) salário normativo correspondente na época, nos casos de aposentadoria por invalidez permanente, por tempo de serviço ou por idade. |pagar ão empregado aposentar abono salário normativo correspondente época caso aposentadoria invalidez permanente serviço idade|0.26593094893426017|0.0|0.0|0.0|0.0|0.0|0.0|0.0|0.0|0.0|0.0|0.0|0.0|0.0|0.0|0.0|0.0|0.0|0.0|0.0|0.0|0.0|0.0|0.12556157167842505|0.22287088972932093|0.0|0.0|0.0|0.0|0.0|0.0|0.0|0.0|0.0|0.0|0.0|0.0|0.0|0.19231929151715435|0.0|0.0|0.0|0.0|0.0|0.0|0.0|0.0|0.0|0.0|0.0|0.0|0.0|0.0|0.0|0.0|0.0|0.0|0.0|0.0|0.0|0.0|0.0|0.0|0.0|0.0|0.0|0.0|0.0|0.0|0.0|0.0|0.0|0.22287088972932093|0.0|0.0|0.0|0.0|0.0|0.0|0.0|0.0|0.0|0.0|0.0|0.0|0.0|0.0|0.0|0.0|0.0|0.0|0.0|0.0|0.0|0.0|0.0|0.0|0.0|0.0|0.0|0.0|0.0|0.0|0.0|0.0|0.0|0.0|0.0|0.0|0.0|0.12556157167842505|0.0|0.0|0.0|0.0|0.0|0.0|0.0|0.0|0.0|0.0|0.0|0.0|0.0|0.0|0.0|0.0|0.0|0.0|0.0|0.0|0.0|0.0|0.0|0.0|0.0|0.0|0.0|0.0|0.0|0.0|0.0|0.0|0.0|0.0|0.0|0.0|0.0|0.0|0.0|0.0|0.0|0.0|0.0|0.0|0.0|0.0|0.0|0.22287088972932093|0.0|0.0|0.0|0.0|0.0|0.0|0.0|0.0|0.0|0.0|0.0|0.0|0.339542606351366|0.0|0.0|0.0|0.0|0.0|0.0|0.0|0.0|0.0|0.0|0.0|0.0|0.0|0.0|0.0|0.0|0.0|0.0|0.0|0.0|0.0|0.0|0.0|0.0|0.339542606351366|0.0|0.0|0.0|0.0|0.0|0.0|0.0|0.0|0.2964825471464267|0.0|0.0|0.0|0.0|0.0|0.0|0.0|0.0|0.0|0.0|0.339542606351366|0.0|0.0|0.0|0.0|0.0|0.0|0.0|0.0|0.0|0.0|0.0|0.0|0.0|0.0|0.0|0.0|0.0|0.0|0.0|0.0|0.0|0.0|0.0|0.0|0.0|0.0|0.0|0.0|0.0|0.0|0.0|0.0|0.0|0.0|0.0|0.0|0.0|0.0|0.0|0.0|0.0|0.0|0.0|0.0|0.1492592323122151|0.0|0.0|0.15849976859943923|0.0|0.0|0.0|0.0|0.0|0.0|0.0|0.0|0.0|0.0|0.0|0.0|0.0|0.0|0.0|0.0|0.0|0.0|0.0|0.0|0.0|0.0|0.0|0.0|0.0|0.0|0.0|0.0|0.0|0.0|0.0|0.0|0.0|0.0|0.0|0.0|0.339542606351366|0.339542606351366|0.0
