contract_id|title|text|clean_text|abono|abrangir|aceger|acima|acordar|acordo|acrescer|admitir|adquirir|alegar|algum|alterar|aludido|alínea|ano|anos|anteceder|antecedência|anterior|anteriormente|análise|aplicar|aposentado|aposentadoria|aposentar|apresentar|apresentação|aprovação|aquisição|assegurar|assistência|atestir|atividade|avisar|aviso|beneficio|benefício|caber|caso|causa|causar|ccts|cessar|cláusula|cometimento|complementação|complemento|completado|completar|compreendido|comprobatório|comprovadamente|comprovante|comprovar|comprovação|comunicado|comunicar|comunicação|concessão|condição|configurar|conformidade|consecutivo|contado|contagem|contar|contarir|continuidade|contrato|contribuição|contém|contínuo|correspondente|cumpr|cumprir|cunho|data|de|decair|decisão|decorrência|decreto|dedicar|deferir|definir|definitivamente|deixar|demissão|demitido|demitir|dependar|dever|devidamente|devido|devir|dia|dificuldade|direito|discussão|dispensa|dispensar|documental|documentação|documento|durante|efeito|efetivo|efetuar|ela|emissão|empregado|empregador|empregadora|empregadoro|empregar|empregatício|emprego|empresa|encerramento|enquadramento|entrega|equivalente|escrito|especial|estabelecimento|estabilidade|estar|este|estipular|eventual|excedente|excluír|exercer|exigir|existente|extinguir|extinção|facultar|faltante|faltar|favorável|fazer|ficar|firmada|formalização|fornecer|fornecir|força|fração|futuro|garantia|garantido|garantir|grave|hipótese|homem|homologar|hábil|idade|igual|igualmente|ii|imediatamente|implementar|implementação|implemento|indenização|inexistente|ininterrupto|inss|integrar|invalidez|judice|judicial|julgado|junto|jus|justa|justificar|legal|legislação|limitar|limite|mediante|mencionado|mensal|mesma|mesmo|modalidade|motivo|mulher|mínimo|mútuo|necessário|nenhum|nominal|normativo|notificar|notificação|obrigação|observar|obtenção|ocorrer|ocorrência|pagamento|pagar|paragrafo|parcela|parte|parágrafo|pedido|pedir|pena|pequeno|perante|percebir|permanente|permanência|período|pleitear|poder|porventura|postular|prazo|preenchimento|prejuízo|presente|prestar|prevalecer|prever|previdência|prorrogar|protocolar|protocolo|provisório|proximidade|prévio|quarenta|receber|recebimento|reconhecer|referida|referir|reintegração|remuneração|renúncia|requerimento|requerir|rescinder|rescindir|rescisão|respectivamente|respectivo|ressalvadas|ressalvado|restante|retro|retroativo|reunir|salarial|salvo|salário|seguir|ser|serviço|sessenta|signatário|simples|sindicato|situação|social|solicitar|sub|substituir|sucessivo|superior|superveniente|surgimento|ter|termo|termos|tiver|trabalhador|trabalhadores|trabalho|tratar|trinto|trânsito|tácito|término|título|ultimo|ultrapassar|velhice|verba|vias|vier|vierem|vigor|vinculação|vínculo|ão|época|único
2016_082054|Senior Workforce|- INDENIZAÇÃO AO EMPREGADO DEMITIDO COM 45 ANOS DE IDADE OU MAIS  Os empregados com 45 (quarenta e cinco) anos de idade ou mais, quando forem demitidos sem justa causa receberão uma indenização correspondente a 20 (vinte) dias de salário, acrescido de 1 (um) dia de salário por ano ou fração superior a 6 meses a partir de 45 anos de idade.  Parágrafo Único: Esta cláusula não se aplica aos empregados admitidos a partir de 01.11.98.   |indenização empregado demitido anos idade empregado quarenta ano idade ser demitir justa causa receber indenização correspondente dia salário acrescer dia salário ano fração superior ano idade parágrafo único cláusula aplicar empregado admitir|0.0|0.0|0.0|0.0|0.0|0.0|0.21451713335564646|0.21451713335564646|0.0|0.0|0.0|0.0|0.0|0.0|0.2518700619132189|0.18731253431569792|0.0|0.0|0.0|0.0|0.0|0.1530387928864399|0.0|0.0|0.0|0.0|0.0|0.0|0.0|0.0|0.0|0.0|0.0|0.0|0.0|0.0|0.0|0.0|0.0|0.11360136604026849|0.0|0.0|0.0|0.12150399488468458|0.0|0.0|0.0|0.0|0.0|0.0|0.0|0.0|0.0|0.0|0.0|0.0|0.0|0.0|0.0|0.0|0.0|0.0|0.0|0.0|0.0|0.0|0.0|0.0|0.0|0.0|0.0|0.0|0.14080596508021703|0.0|0.0|0.0|0.0|0.0|0.0|0.0|0.0|0.0|0.0|0.0|0.0|0.0|0.0|0.0|0.21451713335564646|0.21451713335564646|0.0|0.0|0.0|0.0|0.0|0.2609265130797745|0.0|0.0|0.0|0.0|0.0|0.0|0.0|0.0|0.0|0.0|0.0|0.0|0.0|0.0|0.23798287383303143|0.0|0.0|0.0|0.0|0.0|0.0|0.0|0.0|0.0|0.0|0.0|0.0|0.0|0.0|0.0|0.0|0.0|0.0|0.0|0.0|0.0|0.0|0.0|0.0|0.0|0.0|0.0|0.0|0.0|0.0|0.0|0.0|0.0|0.0|0.0|0.0|0.0|0.21451713335564646|0.0|0.0|0.0|0.0|0.0|0.0|0.0|0.0|0.0|0.42241789524065104|0.0|0.0|0.0|0.0|0.0|0.0|0.0|0.28161193016043407|0.0|0.0|0.0|0.0|0.0|0.0|0.0|0.0|0.0|0.0|0.11360136604026849|0.0|0.0|0.0|0.0|0.0|0.0|0.0|0.0|0.0|0.0|0.0|0.0|0.0|0.0|0.0|0.0|0.0|0.0|0.0|0.0|0.0|0.0|0.0|0.0|0.0|0.0|0.0|0.0|0.0|0.0|0.0|0.13046325653988725|0.0|0.0|0.0|0.0|0.0|0.0|0.0|0.0|0.0|0.0|0.0|0.0|0.0|0.0|0.0|0.0|0.0|0.0|0.0|0.0|0.0|0.0|0.0|0.0|0.0|0.0|0.0|0.18731253431569792|0.18731253431569792|0.0|0.0|0.0|0.0|0.0|0.0|0.0|0.0|0.0|0.0|0.0|0.0|0.0|0.0|0.0|0.0|0.0|0.0|0.0|0.0|0.0|0.0|0.18859879168947213|0.0|0.11360136604026849|0.0|0.0|0.0|0.0|0.0|0.0|0.0|0.0|0.0|0.0|0.0|0.21451713335564646|0.0|0.0|0.0|0.0|0.0|0.0|0.0|0.0|0.0|0.0|0.0|0.0|0.0|0.0|0.0|0.0|0.0|0.0|0.0|0.0|0.0|0.0|0.0|0.0|0.0|0.0|0.0|0.1530387928864399
2016_082054|Retirement Assurances|- GARANTIA AO EMPREGADO EM VIAS DE APOSENTADORIA  A) Aos empregados que comprovadamente estiverem a um máximo de 14 (catorze) meses da aquisição do direito à aposentadoria em seus prazos mínimos, e que contem com um mínimo de 5 (cinco) anos de trabalho na mesma empresa, fica assegurado o emprego ou salário durante o período que faltar para aposentarem-se;  B) Aos empregados que comprovadamente estiverem a um máximo de 20 (vinte) meses da aquisição do direito a aposentadoria em seus prazos mínimos, e que contem com mais de 10 (dez) anos de trabalho na mesma empresa, ficará assegurado o emprego ou salário, durante o período que faltar para aposentarem-se;  C) Caso o empregado dependa de documentação para comprovação do tempo de serviço, terá 40 (quarenta) dias de prazo a partir da notificação de dispensa, no caso de aposentadoria simples e de 60 (sessenta) dias no caso de aposentadoria especial;  D) O contrato de trabalho destes empregados somente poderá ser rescindido por mútuo acordo entre o empregado e a empresa ou por pedido de demissão, ambos com assistência do sindicato signatário. |garantia empregado vias aposentadoria empregado comprovadamente estar aquisição direito aposentadoria prazo mínimo contar mínimo ano trabalho mesmo empresa ficar assegurar emprego salário durante período faltar b empregado comprovadamente estar aquisição direito aposentadoria prazo mínimo contar ano trabalho mesmo empresa ficar assegurar emprego salário durante período faltar c caso empregado dependar documentação comprovação serviço ter quarenta dia prazo notificação dispensa caso aposentadoria simples sessenta dia caso aposentadoria especial d contrato trabalho de este empregado rescinder mútuo acordo empregado empresa pedido demissão assistência sindicato signatário|0.0|0.0|0.0|0.0|0.0|0.09352983591525107|0.0|0.0|0.0|0.0|0.0|0.0|0.0|0.0|0.10262045380083415|0.0|0.0|0.0|0.0|0.0|0.0|0.0|0.0|0.24240584931037618|0.0|0.0|0.0|0.0|0.14851461502371785|0.1594655413441404|0.13110239505516516|0.0|0.0|0.0|0.0|0.0|0.0|0.0|0.22277192253557673|0.0|0.0|0.0|0.0|0.0|0.0|0.0|0.0|0.0|0.0|0.0|0.0|0.2053597025670241|0.0|0.0|0.10267985128351205|0.0|0.0|0.0|0.0|0.0|0.0|0.0|0.0|0.0|0.0|0.2053597025670241|0.0|0.0|0.10267985128351205|0.0|0.0|0.0|0.0|0.0|0.0|0.0|0.0|0.11447627277364243|0.0|0.0|0.0|0.0|0.0|0.0|0.0|0.0|0.0|0.07425730751185892|0.0|0.0|0.11447627277364243|0.0|0.0|0.0|0.0|0.1594655413441404|0.0|0.13885521344093316|0.0|0.10267985128351205|0.0|0.0|0.11447627277364243|0.0|0.17210745800397864|0.0|0.0|0.0|0.0|0.0|0.29088701917245136|0.0|0.0|0.0|0.0|0.0|0.1223981844421178|0.1375042912206174|0.0|0.0|0.0|0.0|0.0|0.10267985128351205|0.0|0.0|0.14851461502371785|0.13110239505516516|0.0|0.0|0.0|0.0|0.0|0.0|0.0|0.0|0.0|0.0|0.0|0.14851461502371785|0.0|0.0|0.14851461502371785|0.0|0.0|0.0|0.0|0.0|0.0|0.0|0.0797327706720702|0.0|0.0|0.0|0.0|0.0|0.0|0.0|0.0|0.0|0.0|0.0|0.0|0.0|0.0|0.0|0.0|0.0|0.0|0.0|0.0|0.0|0.0|0.0|0.0|0.0|0.0|0.0|0.0|0.0|0.0|0.0|0.0|0.0|0.0|0.0|0.0|0.1594655413441404|0.0|0.0|0.0|0.22277192253557673|0.13110239505516516|0.0|0.0|0.0|0.0|0.0|0.11447627277364243|0.0|0.0|0.0|0.0|0.0|0.0|0.0|0.0|0.0|0.0|0.0|0.10267985128351205|0.0|0.0|0.0|0.0|0.0|0.0|0.0|0.10869805792717871|0.0|0.0|0.0|0.0|0.22277192253557673|0.0|0.0|0.0|0.0|0.0|0.0|0.0|0.0|0.0|0.0|0.0|0.0|0.0|0.11447627277364243|0.0|0.0|0.0|0.0|0.0|0.0|0.0|0.0|0.0|0.0|0.11447627277364243|0.0|0.0|0.0|0.0|0.0|0.0|0.0|0.0|0.0|0.0|0.0|0.0|0.11526237046067238|0.0|0.0|0.0611990922210589|0.10267985128351205|0.13110239505516516|0.11447627277364243|0.13110239505516516|0.0|0.0|0.0|0.0|0.0|0.0|0.0|0.0|0.0|0.08605372900198932|0.0|0.0|0.0|0.0|0.0|0.23919831201621058|0.0|0.0|0.0|0.0|0.0|0.0|0.0|0.0|0.0|0.0|0.10267985128351205|0.0|0.0|0.0|0.0|0.0|0.0|0.0|0.0
2012_002993|Retirement Assurances|Fica assegurado aos empregados em geral, sejam homens ou mulheres, em vias de aposentadoria nos prazos mínimos legais, de conformidade com o previsto nos termos do art.188 do Decreto nº. 3.048/99 garantia de emprego, como segue:      TEMPO DE TRABALHO NA MESMA EMPRESA  ESTABILIDADE   20 ANOS OU MAIS  02 ANOS   10 ANOS OU MAIS  01 ANO   05 ANOS OU MAIS  06 MESES   § 1º.: Para concessão das garantias acima, o empregado deverá apresentar comprovante fornecido pelo INSS, nos termos do art.130 do Decreto 3.048/99, que ateste, respectivamente, os períodos de 2 anos, 1 ano ou 6 meses restantes para a implementação do beneficio. A contagem da estabilidade inicia-se a partir da apresentação dos comprovantes pelo empregado, limitada ao tempo que faltar para aposentar-se.   § 2º.: A concessão prevista nesta cláusula, ocorrerá uma única vez, podendo a obrigação ser substituída por uma indenização correspondente aos salários do período não cumprido ou não implementado da garantia, não se aplicando nas hipóteses de encerramento das atividades da empresa e dispensa por justa causa ou pedido de demissão. |ficar assegurar empregado ser homem mulher vias aposentadoria prazo mínimo legal conformidade prever termos decreto garantia emprego seguir trabalho mesma empresa estabilidade anos anos anos ano anos concessão garantia acima empregado apresentar comprovante fornecir inss termos decreto atestir respectivamente período ano ano restante implementação beneficio contagem estabilidade apresentação comprovante empregado limitar faltar concessão prever cláusula ocorrer único poder obrigação substituir indenização correspondente salário período cumprir implementar garantia aplicar hipótese encerramento atividade empresa dispensar justa causa pedir demissão|0.0|0.0|0.0|0.09877889081017184|0.0|0.0|0.0|0.0|0.0|0.0|0.0|0.0|0.0|0.0|0.14808262488948404|0.4405085947170181|0.0|0.0|0.0|0.0|0.0|0.08997649815304518|0.0|0.046639298015075235|0.0|0.09877889081017184|0.11012714867925452|0.0|0.0|0.07670360396668767|0.0|0.11012714867925452|0.11012714867925452|0.0|0.0|0.12612161981369815|0.0|0.0|0.0|0.06678994854128456|0.0|0.0|0.0|0.07143616180664553|0.0|0.0|0.0|0.0|0.0|0.0|0.0|0.0|0.22025429735850904|0.0|0.0|0.0|0.0|0.0|0.22025429735850904|0.0|0.0|0.11012714867925452|0.0|0.0|0.08997649815304518|0.0|0.0|0.0|0.0|0.0|0.0|0.0|0.08278441967572821|0.0|0.11012714867925452|0.0|0.0|0.0|0.0|0.0|0.0|0.22025429735850904|0.0|0.0|0.0|0.0|0.0|0.07143616180664553|0.0|0.0|0.0|0.0|0.0|0.0|0.0|0.0|0.0|0.0|0.0|0.0|0.09877889081017184|0.0|0.0|0.0|0.0|0.0|0.0|0.0|0.0|0.0|0.1399178940452257|0.0|0.0|0.0|0.0|0.0|0.05887404756259446|0.08818686560623841|0.11012714867925452|0.0|0.0|0.0|0.0|0.0|0.0|0.17995299630609035|0.0|0.0|0.0|0.0|0.0|0.0|0.0|0.0|0.0|0.0|0.0|0.0|0.0|0.07143616180664553|0.0|0.0|0.07143616180664553|0.0|0.0|0.0|0.11012714867925452|0.0|0.0|0.0|0.230110811900063|0.0|0.0|0.0|0.08997649815304518|0.11012714867925452|0.0|0.0|0.0|0.0|0.0|0.0|0.0|0.09877889081017184|0.11012714867925452|0.0|0.08278441967572821|0.0|0.0|0.09877889081017184|0.0|0.0|0.0|0.0|0.0|0.0|0.0|0.06678994854128456|0.0|0.09877889081017184|0.0|0.11012714867925452|0.0|0.0|0.0|0.0|0.11012714867925452|0.0|0.0|0.0|0.11012714867925452|0.07143616180664553|0.0|0.0|0.0|0.0|0.0|0.0|0.0|0.11012714867925452|0.0|0.0|0.09877889081017184|0.0|0.0|0.0|0.0|0.0|0.0|0.0|0.0|0.09877889081017184|0.0|0.0|0.0|0.0|0.0|0.0|0.10456845682041457|0.0|0.08278441967572821|0.0|0.0|0.07143616180664553|0.0|0.0|0.0|0.0|0.0|0.19755778162034368|0.0|0.0|0.0|0.0|0.0|0.0|0.0|0.0|0.0|0.0|0.0|0.0|0.0|0.0|0.0|0.0|0.0|0.0|0.0|0.0|0.0|0.11012714867925452|0.0|0.0|0.0|0.11012714867925452|0.0|0.0|0.0|0.0|0.0|0.055441690672201886|0.11012714867925452|0.06678994854128456|0.0|0.0|0.0|0.0|0.0|0.0|0.0|0.0|0.0|0.11012714867925452|0.0|0.0|0.0|0.0|0.0|0.0|0.22025429735850904|0.0|0.0|0.0|0.07670360396668767|0.0|0.0|0.0|0.0|0.0|0.0|0.0|0.0|0.0|0.0|0.09877889081017184|0.0|0.0|0.0|0.0|0.0|0.0|0.0|0.08997649815304518
2012_002943|Retirement Assurances|O trabalhador que estiver completando o período para se aposentar deverá comunicar a empresa por escrito com antecedência mínima de 12(Doze) meses para que possa ser feita análise da situação do trabalhador pela empresa. |trabalhador estar completar período aposentar comunicar empresa escrito antecedência pequeno poder fazer análise situação trabalhador empresa|0.0|0.0|0.0|0.0|0.0|0.0|0.0|0.0|0.0|0.0|0.0|0.0|0.0|0.0|0.0|0.0|0.0|0.2749840544166035|0.0|0.0|0.2749840544166035|0.0|0.0|0.0|0.20671011315528312|0.0|0.0|0.0|0.0|0.0|0.0|0.0|0.0|0.0|0.0|0.0|0.0|0.0|0.0|0.0|0.0|0.0|0.0|0.0|0.0|0.0|0.0|0.0|0.2246685087288858|0.0|0.0|0.0|0.0|0.0|0.0|0.0|0.2749840544166035|0.0|0.0|0.0|0.0|0.0|0.0|0.0|0.0|0.0|0.0|0.0|0.0|0.0|0.0|0.0|0.0|0.0|0.0|0.0|0.0|0.0|0.0|0.0|0.0|0.0|0.0|0.0|0.0|0.0|0.0|0.0|0.0|0.0|0.0|0.0|0.0|0.0|0.0|0.0|0.0|0.0|0.0|0.0|0.0|0.0|0.0|0.0|0.0|0.0|0.0|0.0|0.0|0.0|0.0|0.0|0.0|0.0|0.0|0.0|0.0|0.22019985209390713|0.0|0.0|0.0|0.0|0.2246685087288858|0.0|0.0|0.0|0.17837386730827398|0.0|0.0|0.0|0.0|0.0|0.0|0.0|0.0|0.0|0.0|0.0|0.0|0.0|0.0|0.2749840544166035|0.0|0.0|0.0|0.0|0.0|0.0|0.0|0.0|0.0|0.0|0.0|0.0|0.0|0.0|0.0|0.0|0.0|0.0|0.0|0.0|0.0|0.0|0.0|0.0|0.0|0.0|0.0|0.0|0.0|0.0|0.0|0.0|0.0|0.0|0.0|0.0|0.0|0.0|0.0|0.0|0.0|0.0|0.0|0.0|0.0|0.0|0.0|0.0|0.0|0.0|0.0|0.0|0.0|0.0|0.0|0.0|0.0|0.0|0.0|0.0|0.0|0.0|0.0|0.0|0.0|0.0|0.0|0.0|0.0|0.0|0.0|0.24664780856959442|0.0|0.0|0.0|0.0|0.13055208713481323|0.0|0.20671011315528312|0.0|0.0|0.0|0.0|0.0|0.0|0.0|0.0|0.0|0.0|0.0|0.0|0.0|0.0|0.0|0.0|0.0|0.0|0.0|0.0|0.0|0.0|0.0|0.0|0.0|0.0|0.0|0.0|0.0|0.0|0.0|0.0|0.0|0.0|0.0|0.0|0.0|0.0|0.0|0.0|0.0|0.0|0.0|0.0|0.0|0.0|0.0|0.0|0.2246685087288858|0.0|0.0|0.0|0.0|0.0|0.0|0.0|0.0|0.0|0.0|0.0|0.0|0.549968108833207|0.0|0.0|0.0|0.0|0.0|0.0|0.0|0.0|0.0|0.0|0.0|0.0|0.0|0.0|0.0|0.0|0.0|0.0|0.0|0.0|0.0
2016_082084|Retirement Assurances|1. Aos empregados que, contando com mais de 6 (seis) anos de serviços na empresa, estejam a 22 (vinte e dois) meses ou menos para o implemento da aposentadoria, por velhice, tempo de contribuição ou especial, ser-lhes-á garantido o emprego durante o aludido período, salvo cometimento de justa causa devidamente comprovada, ou acordo homologado.  2. Os empregados que, nas condições acima mencionadas, tiverem seus contratos rescindidos sem justa causa, deverão apresentar ao empregador a comprovação documental das condições para aposentadoria por tempo de serviço no prazo de 30 (trinta) dias e para aposentadoria especial no prazo de 60 (sessenta) dias, contados da rescisão do contrato de trabalho, sob pena de não mais poder postular quanto à permanência no emprego e/ou salários do período de garantia, entendendo-se esta como inexistente em decorrência da renúncia tácita configurada. |empregado contar ano serviço empresa estar implemento aposentadoria velhice contribuição especial garantir emprego durante aludido período salvo cometimento justa causar devidamente comprovar acordo homologar empregado condição acima mencionado tiver contrato rescindir justa causa dever apresentar empregador comprovação documental condição aposentadoria serviço prazo trinto dia aposentadoria especial prazo sessenta dia contado rescisão contrato trabalho pena postular permanência emprego salário período garantia inexistente decorrência renúncia tácito configurar|0.0|0.0|0.0|0.11535423192014482|0.0|0.10507477610023995|0.0|0.0|0.0|0.0|0.0|0.0|0.14728513817889025|0.0|0.05764375132764136|0.0|0.0|0.0|0.0|0.0|0.0|0.0|0.0|0.16339646119825807|0.0|0.11535423192014482|0.0|0.0|0.0|0.0|0.0|0.0|0.0|0.0|0.0|0.0|0.0|0.0|0.0|0.07799746636932776|0.12860675540348168|0.0|0.0|0.0|0.14728513817889025|0.0|0.0|0.0|0.0|0.0|0.0|0.0|0.0|0.08957465758638676|0.11535423192014482|0.0|0.0|0.0|0.0|0.1933516982894726|0.14728513817889025|0.0|0.0|0.14728513817889025|0.0|0.11535423192014482|0.0|0.0|0.23070846384028965|0.14728513817889025|0.0|0.0|0.0|0.0|0.0|0.0|0.0|0.0|0.0|0.0|0.14728513817889025|0.0|0.0|0.0|0.0|0.0|0.0|0.0|0.0|0.0|0.0|0.14728513817889025|0.12860675540348168|0.0|0.0|0.17914931517277352|0.0|0.0|0.0|0.0|0.0|0.14728513817889025|0.0|0.0|0.0966758491447363|0.0|0.0|0.0|0.0|0.0|0.10893097413217205|0.11535423192014482|0.0|0.0|0.0|0.0|0.13750651542877643|0.051492419402654005|0.0|0.0|0.0|0.0|0.0|0.23070846384028965|0.0|0.0|0.08342332566139941|0.0|0.0|0.0|0.0|0.0|0.0|0.0|0.0|0.0|0.0|0.0|0.0|0.0|0.0|0.0|0.0|0.0|0.0|0.0|0.0|0.0|0.0|0.0|0.08957465758638676|0.0|0.12860675540348168|0.0|0.0|0.0|0.14728513817889025|0.0|0.0|0.0|0.0|0.0|0.0|0.0|0.0|0.14728513817889025|0.0|0.14728513817889025|0.0|0.0|0.0|0.0|0.0|0.0|0.0|0.0|0.0|0.15599493273865553|0.0|0.0|0.0|0.0|0.0|0.0|0.14728513817889025|0.0|0.0|0.0|0.0|0.0|0.0|0.0|0.0|0.0|0.0|0.0|0.0|0.0|0.0|0.0|0.0|0.0|0.0|0.0|0.0|0.0|0.0|0.0|0.0|0.0|0.0|0.0|0.12860675540348168|0.0|0.0|0.0|0.0|0.14728513817889025|0.12211530136306831|0.0|0.0|0.0|0.14728513817889025|0.16684665132279883|0.0|0.0|0.0|0.0|0.0|0.0|0.0|0.0|0.0|0.0|0.0|0.0|0.0|0.0|0.0|0.0|0.0|0.0|0.0|0.0|0.0|0.14728513817889025|0.0|0.0|0.0|0.14728513817889025|0.12860675540348168|0.0|0.0|0.0|0.0|0.0|0.0|0.0|0.0|0.0|0.14728513817889025|0.06474494288599089|0.0|0.0|0.13750651542877643|0.11535423192014482|0.0|0.0|0.0|0.0|0.0|0.0|0.0|0.0|0.0|0.0|0.0|0.0|0.0|0.0|0.0|0.12860675540348168|0.0|0.0|0.08957465758638676|0.0|0.14728513817889025|0.0|0.14728513817889025|0.0|0.0|0.0|0.0|0.14728513817889025|0.0|0.0|0.0|0.0|0.0|0.0|0.0|0.0|0.0|0.0
2012_003082|Retirement Assurances|O trabalhador que estiver completando o período para se aposentar deverá comunicar a  empresa por escrito com antecedência mínima de 12(Doze) meses para que possa ser feita análise da situação do trabalhador pela empresa. |trabalhador estar completar período aposentar comunicar empresa escrito antecedência pequeno poder fazer análise situação trabalhador empresa|0.0|0.0|0.0|0.0|0.0|0.0|0.0|0.0|0.0|0.0|0.0|0.0|0.0|0.0|0.0|0.0|0.0|0.2749840544166035|0.0|0.0|0.2749840544166035|0.0|0.0|0.0|0.20671011315528312|0.0|0.0|0.0|0.0|0.0|0.0|0.0|0.0|0.0|0.0|0.0|0.0|0.0|0.0|0.0|0.0|0.0|0.0|0.0|0.0|0.0|0.0|0.0|0.2246685087288858|0.0|0.0|0.0|0.0|0.0|0.0|0.0|0.2749840544166035|0.0|0.0|0.0|0.0|0.0|0.0|0.0|0.0|0.0|0.0|0.0|0.0|0.0|0.0|0.0|0.0|0.0|0.0|0.0|0.0|0.0|0.0|0.0|0.0|0.0|0.0|0.0|0.0|0.0|0.0|0.0|0.0|0.0|0.0|0.0|0.0|0.0|0.0|0.0|0.0|0.0|0.0|0.0|0.0|0.0|0.0|0.0|0.0|0.0|0.0|0.0|0.0|0.0|0.0|0.0|0.0|0.0|0.0|0.0|0.0|0.22019985209390713|0.0|0.0|0.0|0.0|0.2246685087288858|0.0|0.0|0.0|0.17837386730827398|0.0|0.0|0.0|0.0|0.0|0.0|0.0|0.0|0.0|0.0|0.0|0.0|0.0|0.0|0.2749840544166035|0.0|0.0|0.0|0.0|0.0|0.0|0.0|0.0|0.0|0.0|0.0|0.0|0.0|0.0|0.0|0.0|0.0|0.0|0.0|0.0|0.0|0.0|0.0|0.0|0.0|0.0|0.0|0.0|0.0|0.0|0.0|0.0|0.0|0.0|0.0|0.0|0.0|0.0|0.0|0.0|0.0|0.0|0.0|0.0|0.0|0.0|0.0|0.0|0.0|0.0|0.0|0.0|0.0|0.0|0.0|0.0|0.0|0.0|0.0|0.0|0.0|0.0|0.0|0.0|0.0|0.0|0.0|0.0|0.0|0.0|0.0|0.24664780856959442|0.0|0.0|0.0|0.0|0.13055208713481323|0.0|0.20671011315528312|0.0|0.0|0.0|0.0|0.0|0.0|0.0|0.0|0.0|0.0|0.0|0.0|0.0|0.0|0.0|0.0|0.0|0.0|0.0|0.0|0.0|0.0|0.0|0.0|0.0|0.0|0.0|0.0|0.0|0.0|0.0|0.0|0.0|0.0|0.0|0.0|0.0|0.0|0.0|0.0|0.0|0.0|0.0|0.0|0.0|0.0|0.0|0.0|0.2246685087288858|0.0|0.0|0.0|0.0|0.0|0.0|0.0|0.0|0.0|0.0|0.0|0.0|0.549968108833207|0.0|0.0|0.0|0.0|0.0|0.0|0.0|0.0|0.0|0.0|0.0|0.0|0.0|0.0|0.0|0.0|0.0|0.0|0.0|0.0|0.0
2017_039341|Retirement Assurances|"a)       por 12 (doze) meses imediatamente anteriores à complementação de tempo mínimo para aposentadoria pela Previdência Social, os que tiveram o mínimo de 5 (cinco) anos de vinculação empregatícia com a Empresa. b)       por 18 (dezoito) meses imediatamente anteriores à complementação do tempo para aposentadoria pela Previdência Social, os que tiverem o mínimo de 20 (vinte) anos de vínculo ininterrupto com o mesmo empregador. Parágrafo Único: Quanto aos empregados na proximidade de aposentadoria, de que trata esta cláusula, deve-se observar que: I.            os compreendidos nas alíneas ""a"" e ""b"", a estabilidade provisória será adquirida a partir do recebimento, pela Empresa, de comunicação do empregado, por escrito, devidamente protocolada, sem efeito retroativo, de reunir ele as condições previstas. II.            aos abrangidos pelas alíneas ""a"" e ""b"", a estabilidade não se aplica aos casos de demissão por força maior comprovada, dispensa por justa causa ou pedido de demissão, e se extinguirá se não for requerida a aposentadoria imediatamente após completado o tempo mínimo necessário à aquisição do direito a ela. Entende-se por complemento de tempo mínimo para aposentadoria o preenchimento das condições mínimas exigidas pela Previdência Social. "|imediatamente anterior complementação pequeno aposentadoria previdência social mínimo ano vinculação empregatício empresa b imediatamente anterior complementação aposentadoria previdência social tiver mínimo ano vínculo ininterrupto empregador parágrafo único empregado proximidade aposentadoria tratar cláusula observar compreendido alínea b estabilidade provisório ser adquirir recebimento empresa comunicação empregado escrito devidamente protocolar efeito retroativo reunir condição prever ii abrangir alínea b estabilidade aplicar caso demissão força comprovar dispensar justa causa pedir demissão extinguir requerir aposentadoria imediatamente completar pequeno necessário aquisição direito complemento pequeno aposentadoria preenchimento condição mínimo exigir previdência social|0.0|0.1094558476219327|0.0|0.0|0.0|0.0|0.0|0.0|0.08572620012930889|0.0|0.0|0.0|0.0|0.2189116952438654|0.0856766098696467|0.0|0.0|0.0|0.17145240025861777|0.0|0.0|0.07808695991965982|0.0|0.20238179244259638|0.0|0.0|0.0|0.0|0.06199655263668507|0.0|0.0|0.0|0.0|0.0|0.0|0.0|0.0|0.0|0.06199655263668507|0.05796429225227541|0.0|0.0|0.0|0.06199655263668507|0.0|0.2189116952438654|0.1094558476219327|0.0|0.07808695991965982|0.1094558476219327|0.0|0.0|0.0|0.06656795242744716|0.0|0.0|0.0|0.1094558476219327|0.0|0.1436904923815843|0.0|0.0|0.0|0.0|0.0|0.0|0.0|0.0|0.0|0.0|0.0|0.0|0.0|0.0|0.0|0.0|0.0|0.0|0.0|0.0|0.0|0.0|0.0|0.0|0.0|0.0|0.0|0.12399310527337014|0.0|0.0|0.0|0.0|0.09557489368341596|0.0|0.0|0.0|0.0|0.05796429225227541|0.0|0.0|0.08572620012930889|0.0|0.0|0.0|0.0|0.07808695991965982|0.0|0.0|0.0|0.0|0.08095271697703856|0.08572620012930889|0.0|0.0|0.0|0.1094558476219327|0.0|0.07653381028812252|0.0|0.0|0.0|0.0|0.07808695991965982|0.0|0.0|0.15617391983931964|0.0|0.0|0.0|0.0|0.0|0.0|0.0|0.1094558476219327|0.0|0.1094558476219327|0.0|0.0|0.0|0.0|0.0|0.0|0.0|0.0|0.0|0.0|0.0|0.09557489368341596|0.0|0.0|0.0|0.0|0.0|0.0|0.0|0.0|0.0|0.0|0.0|0.0|0.0|0.1094558476219327|0.32836754286579806|0.0|0.0|0.0|0.0|0.0|0.09557489368341596|0.0|0.0|0.0|0.0|0.0|0.0|0.0|0.0|0.05796429225227541|0.0|0.0|0.0|0.0|0.0|0.0|0.0|0.0|0.0|0.0|0.0|0.0|0.0|0.1859896579100552|0.0|0.1094558476219327|0.0|0.0|0.0|0.0|0.0|0.0|0.1094558476219327|0.0|0.0|0.0|0.0|0.0|0.0|0.0|0.0|0.06656795242744716|0.0|0.08572620012930889|0.0|0.2571786003879266|0.0|0.0|0.0|0.0|0.0|0.0|0.0|0.0|0.0|0.0|0.1094558476219327|0.0|0.0|0.0|0.0|0.08572620012930889|0.28672468105024784|0.0|0.1094558476219327|0.0|0.09557489368341596|0.1094558476219327|0.0|0.0|0.0|0.09557489368341596|0.0|0.0|0.0|0.0|0.0|0.0|0.0|0.1094558476219327|0.0|0.0|0.0|0.0|0.0|0.0|0.0|0.0|0.0|0.1094558476219327|0.1094558476219327|0.0|0.0|0.0|0.0|0.05796429225227541|0.0|0.0|0.0|0.0|0.0|0.0|0.28672468105024784|0.0|0.0|0.0|0.0|0.0|0.0|0.0|0.0|0.0|0.0|0.09557489368341596|0.0|0.0|0.0|0.09557489368341596|0.0|0.0|0.0|0.0|0.0|0.0|0.0|0.0|0.0|0.0|0.0|0.0|0.0|0.1094558476219327|0.1094558476219327|0.0|0.0|0.07808695991965982
