contract_id|title|text|clean_text
2016_082084|Injury / Disability Assistance|1. O empregado em gozo de auxílio-doença pelo INSS, do 16º (décimo sexto) ao 105º (centésimo quinto) dia do afastamento, receberá da empresa uma importância que, somada ao valor do Benefício Previdenciário, atinja o valor do seu salário contratual integral, vigente à época, e limitada a um único evento durante a vigência do presente Acordo.  2. Na hipótese de o Auxílio-Doença decorrer de acidente de trabalho, o complemento mencionado no item 1 será concedido do 16º (décimo sexto) ao 135º (centésimo trigésimo quinto) dia.  3. Do mesmo modo, se o afastamento tiver sido por período inferior a 6 (seis) meses durante o ano, a empresa complementará, como auxílio-doença, até o valor integral do 13º (décimo terceiro) salário a que fizer jus o empregado.  4. Se até a data do pagamento da folha salarial o empregado afastado por acidente de trabalho, doença profissional, ou doença comum ainda não tiver recebido a prestação previdenciária, a empresa adiantará a ele o valor correspondente ao seu salário base. O valor será devolvido à empresa quando do recebimento da prestação previdenciária, limitada a um único evento durante o prazo de vigência do presente Acordo Coletivo. Caso a comprovação a que se refere o item “6” desta cláusula seja feita pelo empregado até 48 horas antes do fechamento da folha da quinzena, lhe será assegurado o adiantamento quinzenal previsto na cláusula 8ª deste instrumento, deduzido do adiantamento acima referido, proporcional aos dias afastados, a ser igualmente devolvido à empresa na forma prevista acima.  5. Em se tratando de benefício por doença comum, o empregado, para fazer jus ao adiantamento/complemento, terá de se apresentar à empresa até o 15º dia do afastamento, quando será procedido o devido encaminhamento.  6. A fim de propiciar à empresa a efetivação do complemento e o adiantamento previstos nesta cláusula, o empregado deverá comprovar o requerimento do benefício, mediante a entrega do seu protocolo à empresa. |empregado gozo inss décimo centésimo dia afastamento receber empresa importância somar benefício previdenciário atinja salário contratual integral vigente época limitar único evento durante vigência presente acordo hipótese decorrer acidente trabalho complemento mencionar item ser concedir décimo centésimo trigésimo dia modo afastamento ter ser período inferior durante ano empresa complementar integral décimo salário fizer jus empregado data pagamento folha salarial empregado afastar acidente trabalho doença profissional doença comum ter receber prestação previdenciário empresa adiantar correspondente salário base ser devolver empresa recebimento prestação previdenciário limitar único evento durante prazo vigência presente acordo coletivo caso comprovação referir item cláusula ser fazer empregado hora fechamento folha quinzena ser assegurar adiantamento quinzenal prever cláusula instrumento deduzer adiantamento acima referir proporcional dia afastar igualmente devolver empresa prever acima tratar benefício doença comum empregado jus adiantamento complemento ter apresentar empresa dia afastamento ser proceder devido encaminhamento propiciar empresa efetivação complemento adiantamento prever cláusula empregado comprovar requerimento benefício mediante entrega protocolo empresa
2016_082084|Individual Safety Equipment|1. A empresa se obriga ao fornecimento gratuito de fardamento, quando por ela exigido, bem como de equipamentos de proteção individual (EPIs), quando exigidos por lei, inclusive óculos de segurança com grau para as funções em que haja risco para a visão, obedecidas às normas internas quanto a prazos e condições de fornecimento.  2. A empresa deve fornecer calçados e uniformes especiais, também gratuitos, quando a função exigir.  3. Deve haver treinamento do empregado antes do uso do EPI e campanhas educativas.  4. A empresa deve dar ciência ao empregado sobre os programas de prevenção existentes.  5. Antes de qualquer tarefa sujeita a riscos, o empregado deve receber instruções quanto a métodos de trabalho seguros, natureza e efeitos dos riscos profissionais, medidas de prevenção, uso correto da proteção, dentre outros, nos termos da NR 26 e seus itens 26.6.5 e 26.6.6.  6. Extinto ou rescindido o contrato de trabalho, deverá o empregado devolver os equipamentos e/ou uniforme de seu uso e que continuarão de propriedade da empresa empregadora.  7. A empresa fornecerá os EPIs mediante recibo, ficando o empregado obrigado ao seu uso, salvo as hipóteses de inadequação ou imprestabilidade comprovada dos equipamentos.  8. Somente serão fornecidos EPIs aprovados pelo MTE e fabricados por empresas cadastradas no DNSST/MTE.  9. Os EPIs inadequados ou imprestáveis deverão ser imediatamente substituídos. |empresa obrigar fornecimento gratuito fardamento exigir equipamento proteção individual epis exiger lei óculos segurança grau função haver risco visão obedecir norma interno prazo condição fornecimento empresa fornecer calçado uniforme especial gratuito função exigir haver treinamento empregar uso epi campanha educativo empresa ciência empregado programa prevenção existente tarefa sujeitar risco empregado receber instrução método trabalho seguro natureza efeito risco profissional medida prevenção uso correto proteção dentre termo nr item extinto rescinder contrato trabalho empregado devolver equipamento uniforme uso continuar propriedade empresa empregadora empresa fornecer epis mediante recibo ficar empregado uso salvo hipótese inadequação imprestabilidade comprovar equipamento ser fornecir epis aprovar mte fabricar empresa cadastrar dnsst mte epis inadequar imprestável dever imediatamente substituir
2016_082084|Machine and Equipment Maintenance|1. A empresa se obriga a manter sinalização visível com relação às situações de risco e prevenção no que diz respeito a máquinas que operam com movimentos repetitivos constantes ou quando estiverem em manutenção e conserto, nos termos previstos na NR – 26, aprovada pela Portaria nº 3.214/78 do Ministério do Trabalho e Emprego. |empresa obrigar manter sinalização visível situação risco prevenção respeito máquina operar movimento repetitivo constante estar manutenção conserto termos prever nr aprovar portaria nº ministério trabalho emprego
2016_082084|Internal Committee on Accident Prevention - composition, election, assignments, guarantees |1. As fiscalizações do Ministério do Trabalho e Emprego e da CPRH, quando pertinentes à saúde e segurança do trabalhador, serão acompanhadas pelo presidente e pelo vice-presidente da Cipa, ou, em substituição a este último, por um outro membro representante dos empregados na Cipa. |fiscalização ministério trabalho emprego cprh pertinente saúde segurança trabalhador ser acompanhar presidente cipa substituição outro membro representante empregado cipa
2016_082084|Internal Committee on Accident Prevention - composition, election, assignments, guarantees |1. A empresa convocará as eleições de sua Cipa por edital afixado em local de fácil acesso, preferencialmente em Quadro de Aviso, num prazo mínimo de 60 (sessenta) dias do término do mandato vincendo.  2. A empresa remeterá cópia do edital de convocação para o sindicato profissional até 5 (cinco) dias após a afixação do mesmo;  3. O edital deverá conter data e hora da eleição; prazo e local para inscrição de candidatos; data, hora e local da apuração.  4. Os candidatos deverão receber, no ato de suas inscrições, comprovantes com a data e a hora em que se habilitaram ao processo eletivo.  5. Os candidatos serão inscritos pelo nome e, quando solicitarem, pelo apelido, o qual constará da cédula eleitoral.  6. O prazo para inscrição de candidatos não poderá ser inferior a 15 (quinze) dias.  7. O processo eleitoral da Cipa será coordenado pelo Serviço de Medicina e Segurança do Trabalho da Empresa e acompanhado pelo vice-presidente, representante dos empregados na Cipa existente, facultando-se, ainda, o acompanhamento previsto no item 9 abaixo.  8. A eleição transcorrerá durante a jornada de trabalho, inclusive durante os intervalos, e sua apuração será procedida de imediato, logo após o encerramento da coleta de votos, facultando-se o seu acompanhamento por todos os candidatos inscritos, observando-se, ainda, o previsto no item 9 abaixo.  9. Caso haja na empresa dirigentes sindicais empregados, um deles deverá fazer o acompanhamento das eleições e da apuração. Se não houver, a empresa se obriga a oficiar o sindicato, sob pena de nulidade da eleição, a fim de que a entidade possa acompanhar a eleição e apuração. O presidente do sindicato profissional, mesmo que haja na empresa dirigente sindical empregado, poderá ter acesso ao evento, devendo o mesmo comunicar previamente sua presença.  10. As urnas receptoras deverão ficar em locais fixos, de fácil acesso e previamente determinados no edital. Caso exista mais de uma urna em locais diversos, será assegurado que haja a fiscalização de cada uma delas por dirigente do sindicato profissional, observando-se as disposições constantes no item anterior.  11. Caso o empregador, por qualquer motivo, não providencie a nova eleição da Cipa, os Cipeiros, titulares e suplentes, continuarão no mandato até a posse dos eleitos. Nessa situação, o período de carência será iniciado após a posse dos novos membros da Cipa. |empresa convocar eleição cipa edital afixar fácil acesso preferencialmente quadro aviso prazo mínimo sessenta dia término mandato vincer empresa remeter cópia edital convocação sindicato profissional dia afixação edital conter data hora eleição prazo inscrição candidato data hora apuração candidato dever receber ato inscrição comprovante data hora habilitar processo eletivo candidato ser inscrito nome solicitar apelido constar cédula eleitoral prazo inscrição candidato inferior dia processo eleitoral cipa ser coordenar serviço medicina segurança trabalho empresa acompanhar representante empregado cipa existente acompanhamento prever item abaixo eleição transcorrer durante jornada trabalho durante intervalo apuração ser proceder imediato encerramento coleta voto acompanhamento candidato inscrito prever item abaixo caso haja empresa dirigente sindical empregado de ele acompanhamento eleição apuração haver empresa obrigar oficiar sindicato pena nulidade eleição entidade poder acompanhar eleição apuração presidente sindicato profissional haver empresa dirigente sindical empregar acesso evento dever comunicar previamente presença urna receptora dever ficar local fixo fácil acesso previamente determinar edital caso exista urna local diverso ser assegurar haver fiscalização de ele dirigente sindicato profissional disposição constante item anterior caso empregador motivo providenciar eleição cipa cipeiros titular suplente continuar mandato posse eleito situação período carência ser iniciar posse membro cipa
2016_082084|Internal Committee on Accident Prevention - composition, election, assignments, guarantees |1. As reuniões ordinárias da Cipa serão precedidas por reuniões das duas partes constitutivas, realizadas, no mínimo, uma hora antes da previsão de instalação da Comissão.  2. A pauta de tais reuniões preparatórias respeitará a ordem do dia da convocação da Comissão.  3. As horas em que a Cipa estiver reunida, se fora da jornada ordinária de trabalho, serão remuneradas como extra. |reunião ordinário cipa ser precedir reunião parte constitutivo realizar pequeno hora previsão instalação comissão pauta reunião preparatório respeitar ordem dia convocação comissão hora cipa estar reunir jornada ordinário trabalho ser remunerar extra
2016_082084|Other Rules for the Prevention of Accidents and Occupational Injuries|1. O empregado, à vista de situação de potencial risco à sua vida ou à sua saúde nos postos de trabalho, deverá comunicar o fato à sua chefia imediata, diretamente ou por meio de um representante na Cipa, mediante formulário próprio, o qual deverá ser disponibilizado para tal fim pela empresa.  2. O empregador, por sua vez, após a comunicação acima referida, se compromete a proceder à imediata verificação da situação de risco, acionando, para tanto, o seu SESMT ou a Cipa, propiciando, ainda, condições e prazos para a solução do problema, se vier a ser constatado.  3. Fica pactuado o prazo de 30 (trinta) dias, a contar da data da assinatura do presente acordo coletivo, para as empresas providenciarem os formulários previstos no item 1 desta cláusula. |empregado vista situação potencial risco vida saúde posto trabalho comunicar fato chefia imediato diretamente representante cipa mediante formulário disponibilizar empresa empregador comunicação acima referir comprometar proceder imediato verificação situação risco acionar sesmt cipa propiciar condição prazo solução problema vier constatar ficar pactuado prazo trinto dia contar data assinatura presente acordo coletivo empresa providenciar formulário prever item cláusula
2016_082084|Other Rules for the Prevention of Accidents and Occupational Injuries|1. A empresa permitirá aos seus empregados o livre acesso às informações do PPRA – Programa de Prevenção de Riscos Ambientais – a fim de permitir aos mesmos o conhecimento dos riscos inerentes aos seus locais de trabalho. |empresa permitir empregado livre acesso informação ppra programa prevenção riscos ambientais permitir mesmo conhecimento risco inerente local trabalho
2009_016731|Individual Safety Equipment|Para cada trabalhador que for flagrado sem o uso de EPI, quando devidamente disponibilizado pela empresa e entregue ao mesmo, a frente de serviço onde este está lotado perde 1/3 (um terço) da PLR semestral.  |trabalhador flagrar uso epi devidamente disponibilizar empresa entregar frente serviço lotado perder terço plr semestral
2009_016731|Other Rules for Protection Against Accidents and Injuries|A cada ocorrência de acidente com afastamento, no período, acarretará a perda de 15% da PLR para todos os empregados, somente nos casos de culpa exclusiva do empregado.  |ocorrência acidente afastamento período acarretar perda plr empregado caso culpa exclusivo empregado
2015_043073|Other Rules for the Prevention of Accidents and Occupational Injuries|É vedado às empresas a exigência de tarefas de lavagem, limpeza e lubrificação de veículos a motoristas e cobradores. Com relação aos demais trabalhadores fica proibida a exigência injustificada de trabalhos estranhos a sua função, salvo os que sejam inerentes a ela. |vedar empresa exigência tarefa lavagem limpeza lubrificação veículo motorista cobrador trabalhador ficar proiber exigência injustificar trabalho estranho função salvo ser inerente
2012_003082|Individual Safety Equipment|A empresa ficará obrigada a fornecer gratuitamente E.P.I. (Equipamento de proteção individual) e material necessário ao trabalhador quando exigisdo por lei ou pelo empregador, serão fornecidos gratuitamente ao empregado e devolvido ao empregador quando do desligamento da empresa. PARÁGRAFO ÚNICO - Em caso de perda ou uso inadequado dos E.P.I.(Equipamento de proteção  individual), o empregado deverá arcar com o custos dos mesmos. |empresa ficar fornecer gratuitamente equipamento proteção individual material necessário trabalhador exigisdo lei empregador ser fornecir gratuitamente empregado devolver empregador desligamento empresa parágrafo único caso perda uso inadequar proteção individual empregado arcar custos mesmo
2012_003082|Internal Committee on Accident Prevention - composition, election, assignments, guarantees |A empresa se compromete enviar a entidade sindical a relação dos membros da CIPA eleitos no prazo de 15(Quinze) dias após a posse. |empresa comprometar enviar entidade sindical membro cipa eleito prazo dia posse
2017_039341|Injury / Disability Assistance|Em caso de concessão de auxílio-doença previdenciário ou de auxílio-doença acidentário pela Previdência Social, fica assegurada ao empregado complementação salarial em valor equivalente à diferença entre a importância recebida do INSS e o somatório das verbas fixas por ele percebidas mensalmente, atualizadas. Parágrafo Primeiro: A concessão do benefício previsto nesta cláusula observa as seguintes condições: a)       Será devida pelo período máximo de 24 (vinte e quatro) meses, para cada licença concedida a partir de 01/03/2017. b)       Os empregados que, em 01/03/2017, já estavam afastados e percebendo a complementação, farão jus ao benefício até completar 24 (vinte e quatro) meses. c)        A cada período de 6 (seis) meses de licença é facultado à empresa submeter o empregado à junta médica, devendo, para isto, notificar o empregado, por escrito, através de carta registrada ou telegrama e, simultaneamente, dar ciência do fato, por escrito, ao sindicato profissional, solicitando-lhe, ainda, a indicação do médico para compor a junta. d)       Desde que decorridos 12 (doze) meses da concessão da complementação e constatado pela junta médica que o empregado está em condições de exercer normalmente suas funções, a complementação deixará de ser paga pela empresa, mesmo que não tenha recebido alta médica do INSS. e)       Recusando o empregado a se submeter à junta médica, a complementação deixará de ser paga pela empresa, mesmo que não tenha recebido alta do INSS. Parágrafo Segundo: A junta médica será composta por 2 (dois) médicos, sendo um de livre escolha da empresa e outro, por este escolhido, dentre o mínimo de 2 (dois) médicos indicados pelo sindicato profissional. Decorridos 20 (vinte) dias da solicitação por escrito da formação da junta médica, a não indicação de médico para compor a junta, por uma das partes, resultará no reconhecimento, para todos os efeitos, do laudo do médico indicado pela outra parte. Parágrafo Terceiro: Além de pagar o profissional por ele indicado, a empresa arcará com as despesas do médico por ele escolhido dentre os indicados pelo sindicato profissional, até o limite da tabela da Associação Médica Brasileira – AMB. Parágrafo Quarto: Na ocorrência de pareceres divergentes entre os médicos da junta, será indicado, de comum acordo entre a empresa e o sindicato, um terceiro médico, para o desempate, cujas despesas de contratação serão de responsabilidade da empresa, até o limite da tabela da Associação Médica Brasileira – AMB. Parágrafo Quinto: Quando o empregado não fizer jus à concessão do auxílio-doença, por não ter ainda completado o período da carência exigido pela Previdência Social, receberá a complementação salarial das condições dos parágrafos 1º e 2º, desde que constatada a doença por médico indicado pela empresa. Parágrafo Sexto: A complementação prevista nesta cláusula será devida também quanto ao 13º salário. Parágrafo Sétimo: A empresa que já concede o benefício supra, quer diretamente, quer através da entidade de Previdência privada da qual seja patrocinador, fica desobrigado de sua concessão respeitando-se os critérios mais vantajosos. Parágrafo Oitavo: A empresa fará o adiantamento do auxílio-doença previdenciário ou auxílio doença acidentário ao empregado, enquanto este não receber da previdência Social o valor a ele devido, procedendo ao acerto quando do respectivo pagamento pelo órgão previdenciário, que deverá ser comunicado, imediatamente, pelo empregado. Na ocorrência da rescisão do contrato de trabalho, por iniciativa do empregado ou por iniciativa da empresa, respeitado os períodos de estabilidades provisórias, e, havendo débito decorrentes do adiantamento referido, a empresa efetuará a correspondente compensação nas verbas rescisórias. Parágrafo Nono: Não sendo conhecido o valor básico do auxílio-doença a ser concedido pela Previdência Social, a complementação salarial deverá ser paga em valores estimados. Se ocorrerem diferenças, a mais ou a menos, deverão ser compensadas no pagamento imediatamente posterior. Parágrafo Décimo: O pagamento previsto nesta cláusula deverá ocorrer junto com o dos demais empregados. |caso concessão previdenciário acidentário previdência social ficar assegurado empregado complementação salarial equivalente diferença importância receber inss somatório verba fixo perceber mensalmente atualizar parágrafo concessão benefício prever cláusula observar seguinte condição ser devir período licença conceder b empregado estar afastado perceber complementação fazer jus benefício completar c período licença facultar empresa submeter empregado junta médico dever notificar empregado escrito carta registrar telegrama simultaneamente ciência fato escrito sindicato profissional indicação médico compor junta d decorrir concessão complementação constatar junta médico empregado condição exercer normalmente função complementação deixar pagar empresa ter receber alta médico inss recusando empregado submeter junta médico complementação deixar pagar empresa ter receber alta inss parágrafo junta médico ser compor médico ser livre escolha empresa outro escolher de entre mínimo médico indicar sindicato profissional decorridos dia solicitação escrito formação junta médico indicação médico compor junta parte resultar reconhecimento efeito laudo médico indicar parágrafo pagar profissional indicar empresa arcar despesa médico escolher dentre indicar sindicato profissional limite tabela associação médica brasileira amb parágrafo ocorrência parecer divergente médico junta ser indicar comum acordo empresa sindicato médico desempate cujo despesa contratação ser responsabilidade empresa limite tabela associação médica brasileira amb parágrafo empregado fizer jus concessão completar período carência exigir previdência social receber complementação salarial condição parágrafo constatar doença médico indicar empresa parágrafo complementação prever cláusula ser devir salário parágrafo empresa conceder benefício supra diretamente entidade previdência privado ser patrocinador ficar desobrigado concessão critério vantajoso parágrafo empresa adiantamento previdenciário auxílio doença acidentário empregado receber previdência social devido proceder acerto respectivo pagamento órgão previdenciário comunicar imediatamente empregado ocorrência rescisão contrato trabalho iniciativa empregado iniciativa empresa respeitar período estabilidades provisório haver débito decorrente adiantamento referir empresa efetuar correspondente compensação verba rescisório parágrafo nono ser básico concedir previdência social complementação salarial pagar valor estimar ocorrer diferença dever compensadas pagamento imediatamente posterior parágrafo décimo pagamento prever cláusula ocorrer junto empregado
2017_039341|Other Rules Regarding Working Conditions|No período de vigência desta Convenção Coletiva de Trabalho, a empresa arcará com despesas realizadas pelos seus empregados dispensados sem justa causa, a partir de 01/03/2017, até o limite de R$ 1.378,79 (mil trezentos e setenta e oito reais e setenta e nove centavos), com Cursos de Qualificação e/ou Requalificação Profissional, ministrados por empresa, entidade de ensino ou entidade sindical profissional, respeitados critérios mais vantajosos. Esta cláusula tem caráter excepcional e transitória. Parágrafo Primeiro: O ex-empregado terá o prazo de 90 (noventa) dias, contados da data da dispensa, para requerer a empresa a vantagem estabelecida. Parágrafo Segundo: A empresa efetuará o pagamento, diretamente à empresa ou entidade, após receber, dos empregados as seguintes informações: identificação da entidade promotora do curso, natureza, duração, valor e forma de pagamento do curso. Parágrafo Terceiro: A empresa poderá optar por fazer o reembolso ao ex-empregado. |período vigência convenção coletiva trabalho empresa arcar despesa realizar empregado dispensar justa causa limite trezento setenta real setenta centavo cursos qualificação requalificação profissional ministrar empresa entidade ensino entidade sindical profissional respeitar critério vantajoso cláusula caráter excepcional transitório parágrafo ter prazo noventa dia contado data dispensa requerer empresa vantagem estabelecer parágrafo empresa efetuar pagamento diretamente empresa entidade receber empregado seguinte informação identificação entidade promotora curso natureza duração pagamento curso parágrafo empresa optar reembolso
