contract_id|title|text|clean_text
2016_082054|Guarantees to Union Officers|A) DIRIGENTE SINDICAL  O dirigente sindical, no exercício de sua função, desejando manter contato com empresa de sua base territorial, terá garantido o atendimento pelo representante que a empresa designar.  O dirigente sindical poderá fazer-se acompanhar de assessor quando o assunto a ser exposto referir-se à segurança e medicina do trabalho.  B) SINDICALIZAÇÃO  Com o objetivo de incrementar a sindicalização dos empregados, a empresa colocará a disposição do sindicato signatário, 2 (duas) vezes por ano, local e meios para esse fim.  Os períodos serão convencionados de comum acordo pelas partes e a atividade será desenvolvida no recinto da empresa, fora do ambiente de produção, em locais previamente autorizados e, preferencialmente, nos períodos de descanso da jornada normal de trabalho.  C) PARTICIPAÇÃO EM CURSOS E/OU ENCONTROS SINDICAIS  I) Os dirigentes sindicais não afastados de suas funções na empresa poderão ausentar-se do serviço até 12 (doze) dias por ano, sem prejuízo nos salários nas férias, 13º salário, PPR/PLR, feriado e descanso remunerado, desde que pré- avisada a empresa, por escrito, pelo respectivo sindicato signatário, com antecedência mínima de 48 (quarenta e oito) horas;  I.1. Garantidas as condições acima, ficarão estendidas também ao dirigente da FEM-CUT/SP e ou da CNM, que poderão afastar-se do serviço até o limite de mais 12 (doze) dias por ano, mediante solicitação impressa da respectiva entidade.  II) Este benefício será estendido aos empregados em geral, até o limite de 09 (nove) dias por ano, desde que as ausências não sejam simultâneas, conforme abaixo:  1 – Contando a empresa com mais de 50 (cinqüenta) e até 500 (quinhentos) empregados, limitado a 1 (um) empregado por ano;  2 – Contanto a empresa com mais de 500 (quinhentos) e até 1.000 (mil) empregados, limitado a 3 (três) empregados por ano;  3 – Contando a empresa com mais de 1.000 (mil) empregados, limitado a 5 (cinco) empregados por ano.  |dirigent sindical dirigent sindical exercíci funçã desej mant contat empres bas territorial garant atend represent empres design dirigent sindical pod fazers acompanh assessor assunt expost referirs segur medicin trabalh b sindicaliz objet increment sindicaliz empreg empres coloc disposiçã sindicat signatári duas vez ano local mei fim períod convencion comum acord part ativ desenvolv recint empres ambient produçã loc previ autoriz preferencial períod descans jorn normal trabalh c particip curs eou encontr sindic i dirigent sindic afast funçõ empres pod ausentars servic doz dias ano prejuíz salári fér salári pprplr feri descans remuner desd pré avis empres escrit respect sindicat signatári antecedent mínim quarent oit hor garant condiçõ acim fic estend dirigent femcutsp cnm pod afastars servic limit doz dias ano mediant solicit impress respect entidad ii benefíci estend empreg geral limit nov dias ano desd ausênc simultân conform abaix cont empres cinquent quinhent empreg limit empreg ano contant empres quinhent mil empreg limit três empreg ano cont empres mil empreg limit cinc empreg ano
2016_082054|Access to Company Information|RELAÇÃO ANUAL DE INFORMAÇÕES  A) Relação Mensal de Empregados - Quando solicitado por escrito, a empresa fornecerá ao sindicato signatário no prazo de 5 (cinco) dias úteis informação sobre o número de empregados existentes, admitidos e demitidos no mês, no estabelecimento da base territorial. A informação abrangerá os empregados horistas e mensalistas, separadamente, com os respectivos salários médios.  B) Relação Anual de Informações – Contando a empresa com mais de 200 (duzentos) empregados fornecerá ao sindicato signatário, até 31 de agosto de 2017, as informações relativas à mão-de-obra operacional do estabelecimento fabril da base territorial, contidas na RAIS entregue do exercício de 2016.  As informações supra poderão ser fornecidas através de suporte magnético, mediante entendimento prévio com o sindicato signatário do presente instrumento.  |relaçã anual inform relaçã mensal empreg solicit escrit empres fornec sindicat signatári praz cinc dias úte inform sobr númer empreg existent admit demit mês estabelec bas territorial inform abrang empreg horist mensal separ respect salári médi b relaçã anual inform cont empres duzent empreg fornec sindicat signatári agost inform relat mãodeobr operacional estabelec fabril bas territorial cont rais entreg exercíci inform supr pod fornec através suport magnét mediant entend prévi sindicat signatári present instrument
2016_082054|Union Contributions|CONTRIBUIÇÕES ASSOCIATIVAS  A) ATRASO NO RECOLHIMENTO Na hipótese de a empresa deixar de recolher ao sindicato, dentro do prazo de 10 (dez) dias após o pagamento, as contribuições associativas mensais, incorrerá em multa no valor correspondente a 5% (cinco por cento) do montante não recolhido, por mês de atraso, revertida em favor da entidade sindical.  B) RECIBOS  A empresa deverá efetuar a entrega dos recibos de mensalidades, já descontadas dos associados do sindicato juntamente com o pagamento geral dos empregados, ou no prazo máximo de 10 (dez) dias a contar da data da entrega protocolada dos mesmos pelo sindicato.  |contribuiçõ assoc atras recolh hipótes empres deix recolh sindicat dentr praz dez dias após pagament contribuiçõ assoc mens incorr mult valor correspondent cinc cent montant recolh mês atras revert favor entidad sindical b recib empres dev efetu entreg recib mensal descont assoc sindicat junt pagament geral empreg praz máxim dez dias cont dat entreg protocol mesm sindicat
2016_082054|Union Contributions|TAXA NEGOCIAL/ASSISTENCIAL OU CONFEDERATIVA  A) Em cumprimento a deliberação da respectiva Assembleia Geral do sindicato signatário, e sob a inteira responsabilidade do mesmo, a empresa descontará dos salários já reajustados de todos os empregados abrangidos por este Acordo Coletivo de Trabalho, a contribuição negocial/assistencial ou confederativa, de que trata o artigo 8º, inciso IV, da Constituição Federal, conforme condições já comunicadas, na proporção de 4% (quatro vírgula por cento), incidentes sobre o salário nominal do mês de outubro de 2016.  B) A empresa repassará os valores referentes a contribuição negocial/assistencial e ou confederativa até o quinto dia após o pertinente desconto da folha de pagamento.  C) O não repasse da mencionada contribuição no prazo estabelecido, acarretará à empresa a obrigação da atualização monetária e multa de 5% (cinco por cento) sobre o montante não repassado, além de juros de mora de 1% (um por cento) ao mês.  D) A responsabilidade pela instituição, percentuais de cobrança e abrangência do desconto é inteiramente do sindicato signatário, ficando isenta a empresa de quaisquer ônus ou conseqüências perante seus empregados, sendo garantido aos não associados, o direito de oposição aos descontos, desde que feito de próprio punho, exercido de única vez, no prazo de 10 dias a contar a assinatura do presente Acordo.   |tax negocialassistencial confeder cumpriment deliber respect assembl geral sindicat signatári sob inteir respons empres descont salári reajust tod empreg abrang acord colet trabalh contribuiçã negocialassistencial confeder trat artig incis iv constituiçã federal conform condiçõ comunic proporçã quatr vírgul cent incident sobr salári nominal mês outubr b empres repass valor referent contribuiçã negocialassistencial confeder quint dia após pertinent descont folh pagament c rep mencion contribuiçã praz estabelec acarret empres obrig atualiz monetár mult cinc cent sobr montant repass além jur mor cent mês d respons instituiçã percentu cobranc abrangent descont inteir sindicat signatári fic isent empres quaisqu ônus consequent perant empreg send garant assoc direit oposiçã descont desd feit própri punh exerc únic vez praz dias cont assinatur present acord
2016_082054|Other Provisions on the Relationship between Union and Company|"COMUNICAÇÃO DE ACIDENTE DO TRABALHO  A empresa enviará ao respectivo sindicato signatário, nos meses de abril, julho, outubro e janeiro, cópia do Anexo 1, completo, previsto no item 5.22, letra ""E"" da NR-05, para fins estatísticos. No caso de acidente com mutilação ou fatal, ocorrido nas dependências da empresa, o respectivo sindicato deverá ser comunicado no prazo de 48 (quarenta e oito) horas, com descrição sumária do acidente.  Na ocorrência de acidente de trajeto com mutilação ou fatal, a comunicação ao sindicato deverá ser feita no mesmo prazo, a partir da data em que a empresa tomou conhecimento do fato.  "|comunic acident trabalh empres envi respect sindicat signatári mes abril julh outubr janeir cóp anex complet previst item letr fins estatíst cas acident mutil fatal ocorr dependent empres respect sindicat dev comunic praz quarent oit hor descriçã sumár acident ocorrent acident trajet mutil fatal comunic sindicat dev feit praz part dat empres tom conhec fat
2016_082054|Other Provisions on the Relationship between Union and Company|- QUADROS DE AVISOS  Contando a empresa com mais de 50 (cinquenta) empregados, colocará a disposição do sindicato signatário, quadros de avisos para afixação de comunicados oficiais de interesse da categoria, que serão encaminhados ao setor competente da empresa, para os devidos fins, incumbindo-se este de sua afixação dentro das 04 (quatro) horas de trabalho posteriores ao recebimento, pelo prazo sugerido pelo sindicato signatário.  |quadr avis cont empres cinquent empreg coloc disposiçã sindicat signatári quadr avis afix comunic ofic inter categor encaminh setor competent empres dev fins incumbindos afix dentr quatr hor trabalh posterior receb praz suger sindicat signatári
2012_002993|Union Access to Workplace|O Empregador permitirá que o Sindicato da Categoria Profissional promova Campanha de Sindicalização a seus empregados, no estabelecimento de trabalho e em data previamente estabelecida por consenso entre as partes e no horário de expediente. |empreg permit sindicat categor profissional promov campanh sindicaliz empreg estabelec trabalh dat previ estabelec consens part horári expedient
2012_002993|Union Contributions|A Mensalidade Sindical devida pelo Empregado, Sócio do Sindicato, será descontada em folha de pagamento e o recolhimento deverá ser efetuado em Agência Bancária por impresso próprio que será fornecido ao Empregador, pela Entidade Profissional, até o quinto dia útil do mês subseqüente. |mensal sindical dev empreg sóci sindicat descont folh pagament recolh dev efetu agênc bancár impress própri fornec empreg entidad profissional quint dia útil mês subsequent
2012_002993|Union Contributions|O Empregador descontará da remuneração do empregado, sindicalizado ou não, a Contribuição assistencial, de acordo com a Assembléia Geral da Categoria, da seguinte forma:  Para ser aplicada a partir da divulgação deste acordo.  A Contribuição assistencial será dividida em (11) onze parcelas iguais, de (2%) dois por cento, incidindo respectivamente sobre os salários de Janeiro, Fevereiro, Abril, Maio, Junho, Julho, Agosto, Setembro, Outubro, Novembro e Dezembro de 2011, devendo ser recolhida até o quinto dia útil do mês subseqüente ao desconto.  O recolhimento deverá ser efetuado em Agência Bancária por impresso próprio que será fornecido ao empregador pela Entidade Profissional.  O recolhimento da Contribuição assistencial efetuado pelo Empregador fora do prazo será acrescido de multa de (2%) Dois por cento nos (30) trinta primeiros dias, mais (1%) um por cento por mês subseqüente de atraso além de juros de mora de (1%) um por cento ao mês.|empreg descont remuner empreg sindicaliz contribuiçã assistencial acord assembl geral categor seguint form aplic part divulg dest acord contribuiçã assistencial divid onze parcel igu dois cent incid respect sobr salári janeir fevereir abril mai junh julh agost setembr outubr novembr dezembr dev recolh quint dia útil mês subsequent descont recolh dev efetu agênc bancár impress própri fornec empreg entidad profissional recolh contribuiçã assistencial efetu empreg praz acresc mult dois cent trint primeir dias cent mês subsequent atras além jur mor cent mês
2012_002993|Union Contributions|O empregador se obriga a descontar e repassar ao Sindicato dos Trabalhadores a Contribuição Assistencial proporcional ao período trabalhado no exercício do ano em curso referente ao empregado Demitido por ocasião da Homologação de Demissão, caso as mesmas não tenham sido recolhidas anteriormente, com as multa estipulada pelo atraso. |empreg obrig descont repass sindicat trabalh contribuiçã assistencial proporcional períod trabalh exercíci ano curs referent empreg demit ocasiã homolog demissã cas mesm sid recolh anterior mult estipul atras
2012_002993|Union Contributions|No caso do empregador não receber a guia para pagamento das contribuições devidas é de responsabilidade do Sindicato dos Trabalhadores disponibilizarem a emissão da 2ª via da guia e enviá-la pelo correio.. |cas empreg receb gui pagament contribuiçõ dev respons sindicat trabalh disponibiliz emissã via gui enviál correi
2012_002993|Right of Opposition to the Discount of Union Contributions| Será dado ao empregado (20) vinte dias, para opor-se ao desconto das Contribuições Assistenciais, a partir da data base da categoria, conforme deliberação em Assembléia, devendo se manifestar por escrito e entregar o documento, pessoalmente e individualmente, na Sede ou Sub Sede da entidade Sindical. |dad empreg vint dias opors descont contribuiçõ assistenc part dat bas categor conform deliber assembl dev manifest escrit entreg document pessoal individual sed sub sed entidad sindical
2012_002993|Right of Opposition to the Discount of Union Contributions|O Empregador esclarecerá a seu empregado sobre os descontos das Contribuições Confederativa , Assistencial que são obrigatórias por imposição de Lei.  Salvo quanto a contribuição sindical, cujo desconto independe dessas formalidades. |empreg esclarec empreg sobr descont contribuiçõ confeder assistencial obrigatór imposiçã lei salv quant contribuiçã sindical cuj descont independ dess formal
2012_042451|Union Contributions| MENSALIDADE ASSOCIATIVA Serão descontados 3% ( três ) por cento  dos seus salários dos empregados que tenha carteira de trabalho assinada ( CTPS ) que tenha autorizado o desconto, a mensalidade associativa afixada em assembléia da categoria. A empresa obriga-se a repassar até o 15º ( décimo quinto ) dia útil de cada mês ou depositar na conta corrente, operação 03 agência 029 conta nº 051-8 ( Caixa Econômica - Conselheiro Saraiva ), repassando a entidade sindical a relação de todos os empregados com os respectivos descontos e cópia da guia de recolhimento bancário. CONTRIBUÍÇÃO ASSISTENCIAL Fica a empresa obrigada a descontar a título da Contribuição do Acordo para o Sindicato Laboral do salário de MAIO - 2012  de todos os trabalhadores devidamente sindicalizados, a importância de 3% ( três por cento ). |mensal assoc descont três cent salári empreg carteir trabalh assin ctps autoriz descont mensal assoc afix assembl categor empres obrigas repass décim quint dia útil cad mês deposit cont corrent oper agênc cont nº caix econôm conselheir saraiv repass entidad sindical relaçã tod empreg respect descont cóp gui recolh bancári contribuíçã assistencial fic empres obrig descont títul contribuiçã acord sindicat laboral salári mai tod trabalh devid sindicaliz import três cent
2012_042451|Negotiation Rules|NOVA NEGOCIAÇÃO As partes se comprometem a se reunirem, assim que uma delas o desejar para reavaliação das condições  aqui acordadas. PENALIDADES A parte integrante deste acordo coletivo de trabalho, que infringir quaisquer das cláusulas do mesmo obrigam-se a pagar multa diária no valor de 05 ( tres) pisos da categoria ,  em favor da outra. REGISTRO E ARQUIVAMENTO As partes assinarão, conjuntamente, requerimento para registro e arquivamento do processo e do presente ACT - Acordo Coletivo de Trabalho na SRTE/PI – Superintendência Regional do Trabalho e emprego no Piauí|nov negoc part compromet reun assim desej reavali condiçõ aqu acord penal part integr dest acord colet trabalh infring quaisqu cláusul obrigams pag mult diár valor tres pis categor favor outr registr arquiv part assin conjunt requer registr arquiv process present act acord colet trabalh srtep superintendent regional trabalh empreg piau
2012_002943|Unionization (campaigns and hiring of union members)|A empresa prestará informações sobre como sindicalizar a todos trabalhadores que for admitidos a partir da data de homologação deste Acordo Coletivo de Trabalho. E a empresa descontará o valor de 01(Um) por cento sobre o salario de cada trabalhador sindicalizado e repassará ao sindicato até 10(Décimo) dia de cada mês. PARÁGRAFO PRIMEIRO - A empresa permitirá acesso de pessoas credenciadas pela entidade sindical  para entrega de documentos ou prestar serviços de informações. PARÁGRAFO SEGUNDO -  A empresa permitirá ao sindicato colocar em seu quadro de avisos cópias do presente Acordo Coletivo de Trabalho, e cartazes com aviso referente ao sindicato. |empres prest inform sobr sindicaliz tod trabalh admit part dat homolog dest acord colet trabalh empres descont valor cent sobr salari cad trabalh sindicaliz repass sindicat décim dia cad mês parágraf primeir empres permit acess pesso credenc entidad sindical entreg document prest servic inform parágraf segund empres permit sindicat coloc quadr avis cóp present acord colet trabalh cartaz avis referent sindicat
2012_002943|Guarantees to Union Officers|Será concedida licença renumerada aos dirigentes titulares do sindicato para participação em congresso, conferências, seminarios e sempre que houver necessidade do sindicato com prévia comunicação a empresa desde seja solicitada pelo presidente da entidade com antecedência mínima de 05(Cinco) dias. |conced licenc renumer dirigent titul sindicat particip congress conferent seminari sempr necess sindicat prév comunic empres desd solicit president entidad antecedent mínim cinc dias
2012_002943|Union Contributions|Por deliberação de Assembléia do s empregados realizada em 14/10/2011, os empregadores se comprometem a descontar da renumeração mensal de seus empregados, em duas oportunidades: a)   No mês de novembro de 2011, a importância  equivalente 1/30(Um trinta avos) que equivale a um dia de trabalho da folha de pagamento. b)     No mês de junho de 2012, a importância equivalente 1/30(um trinta avos) que equivale a um dia de trabalho da de pagamento. PARÁGRAFO PRIMEIRO - As importâncias descontadas serão pagas pela empresa até o dia 10(Décimo ) do mês seguinte ao do referido desconto, na folha de pagamento, através de guias fornecidas pelo Sindicato dos Trabalhadores nas Indústrias de Fiação e Tecelagem de Anápolis-GO. PARÁGRAFO SEGUNDO- A empresa que não efetuar o pagamento no prazo especificado no parágrafo primeiro, fica convencionada a uma multa por atraso, da ordem de 5%(Cinco por cento) ao mês. PARÁGRAFO TERCEIRO - Será garantido o direito de oposição ao desconto das contribuições ao empregado não associado devendo ele manifestar-se individualmente e por escrito, de próprio punho, perante aoSTIFTA ou por carta registrada, até 15(Quinze) dias após a efetivação do referido desconto(Procedente n. 74 do TST e enunciado 119),  mediante a apresentação dos  seguintes documentos: carta de oposição com dados do contribuinte e do empregador; cópia do contra-cheque com o devido desconto e número da conta bancária para devida restituição. |deliber assembl s empreg realiz empreg compromet descont renumer mensal empreg duas oportun mês novembr import equivalent trint avos equival dia trabalh folh pagament b mês junh import equivalent trint avos equival dia trabalh pagament parágraf primeir importânc descont pag empres dia décim mês seguint refer descont folh pagament através gui fornec sindicat trabalh indústr fiaçã tecelag anápolisg parágraf segundo empres efetu pagament praz especific parágraf primeir fic convencion mult atras ordem cinc cent mês parágraf terceir garant direit oposiçã descont contribuiçõ empreg assoc dev manifestars individual escrit própri punh perant aostift cart registr quinz dias após efetiv refer descont procedent n tst enunc mediant apresent seguint document cart oposiçã dad contribuint empreg cóp contrachequ dev descont númer cont bancár dev restituiçã
2012_002943|Mechanisms for Conflict Resolution|As controvérsias resultantes da aplicação deste Acordo Coletivo de Trabalho de acordo com os artigos 625 e 644 letra C da CLT, serão dirinidas pela justiça do trabalho fórum nesta cidade. |controvérs result aplic dest acord colet trabalh acord artig letr c clt dirin justic trabalh fórum nest cidad
2012_002943|Mechanisms for Conflict Resolution|Fica cominada multa no valor equivalente a 1/10(Um décimo) do piso salarial por infração e por trabalhador a parte acordante que infrigiu as normas pactuadas neste acordo. E, por estarem justas e acordadas firmam, o presente Acordo Coletivo de Trabalho em três vias de igual teor para que produza seus legais efeitos observando o disposto no artigo 614 da CLT. Anápolis, 20 de janeiro de 2012.|fic comin mult valor equivalent décim pis salarial infraçã trabalh part acord infrig norm pactu nest acord estar just acord firm present acord colet trabalh três vias igual teor produz leg efeit observ dispost artig clt anápol janeir
2016_082084|Unionization (campaigns and hiring of union members)|1. Semestralmente, a empresa disponibilizará uma data, local e condições para o sindicato representativo da categoria profissional acessar suas dependências no intuito de fazer a sindicalização dos trabalhadores. Os períodos serão convencionados de comum acordo entre as partes, sendo a atividade desenvolvida no recinto da empresa, fora do ambiente de produção, nos períodos de descanso e alimentação (art. 71 da CLT) e saída dos turnos, assegurando o contato com os trabalhadores de todas as turmas e turnos de trabalho, ficando, ainda, vedado o trato de matéria estranha à sindicalização. Fica esclarecido que, existindo regime de escala de revezamento, a sindicalização será realizada em cada um dos turnos, em dias consecutivos  2. A ação de sindicalização poderá ser efetivada por até dois representantes sindicais, preferencialmente pelos dirigentes internos, empregados da empresa, quando houver, complementado, quando for o caso, por dirigente externo.  |semestral empres disponibiliz dat local condiçõ sindicat represent categor profissional acess dependent intuit faz sindicaliz trabalh períod convencion comum acord part send ativ desenvolv recint empres ambient produçã períod descans aliment art clt saíd turn assegur contat trabalh tod turm turn trabalh fic aind ved trat matér estranh sindicaliz fic esclarec exist regim escal revez sindicaliz realiz cad turn dias consecut açã sindicaliz pod efetiv dois represent sindic preferencial dirigent intern empreg empres complement cas dirigent extern
2016_082084|Union Access to Workplace| 1. A empresa se compromete a afixar em quadros de avisos, instalados em locais visíveis e de fácil acesso, comunicados de interesses dos trabalhadores, constante de papel timbrado e subscrito pelo presidente do sindicato da categoria profissional convenente, ou seu eventual substituto legal, os quais serão encaminhados ao setor competente da empresa incumbindo-se este de sua afixação, dentro do prazo de 24 (vinte e quatro) horas, ou primeiro dia útil subsequente, desde que não se trate de matéria de cunho político-partidário e não seja ofensiva à moral de terceiros (pessoas físicas ou jurídicas). |empres compromet afix quadr avis instal loc visív fácil acess comunic inter trabalh constant papel timbr subscrit president sindicat categor profissional convenent eventual substitut legal qua encaminh setor competent empres incumbindos afix dentr praz vint quatr hor primeir dia útil subsequent desd trat matér cunh políticopartidári ofens moral terceir pesso físic juríd
