contract_id|title|text|clean_text
2016_082084|Union Access to Workplace|1. Assegura-se o acesso do dirigente sindical à empresa para o desempenho de suas funções, após ajuste prévio entre as partes, observadas as seguintes condições:  a)    Comunicação e ajuste prévio com o representante legal da empresa, com antecedência de 48 (quarenta e oito) horas, incluindo a pauta a ser tratada; b)    Limite de um acesso por bimestre e por estabelecimento; c)    A empresa indicará o local do encontro e combinará o horário com o sindicato; d)    Faculdade da empresa de indicar um representante para presenciar o encontro; e)    Proibição de utilização do acesso para a realização de assembleia; f)     Duração máxima de 30 (trinta) minutos por acesso; g)    Proibição de divulgação de matéria político-partidária ou ofensiva ao empregador ou seus representantes legais; h)   Contato limitado a 10% (dez por cento) do número de empregados em atividade. Assegura-se que, pelo menos, 50% (cinquenta por cento) dos empregados sejam do setor produtivo; i)     Caso haja na empresa diretores do sindicato empregados, todos poderão participar, juntamente com o presidente do Sindicato Profissional. Se não houver dirigentes internos, mas caso haja representante dos trabalhadores, o acesso será efetivado por esse indivíduo e pelo presidente do Sindicato Profissional. Se não houver dirigente  interno nem representante dos trabalhadores, o acesso poderá ser realizado pelo presidente do Sindicato Profissional. |asseguras acess dirigent sindical empres desempenh funçõ após ajust prévi part observ seguint condiçõ comunic ajust prévi represent legal empres antecedent quarent oit hor inclu paut trat b limit acess bimestr estabelec c empres indic local encontr combin horári sindicat d faculdad empres indic represent presenc encontr proibiçã utiliz acess realiz assembl f duraçã máxim trint minut acess g proibiçã divulg matér políticopartidár ofens empreg represent leg h contat limit dez cent númer empreg ativ asseguras men cinquent cent empreg setor produt i cas empres diretor sindicat empreg tod pod particip junt president sindicat profissional dirigent intern cas represent trabalh acess efetiv indivídu president sindicat profissional dirigent intern represent trabalh acess pod realiz president sindicat profissional
2016_082084|Employee Accommodation for Union Activities|1. A ausência ao trabalho do dirigente sindical, para desempenho das funções que lhe são próprias, deverá ser comunicada ao empregador com antecedência mínima de 48 (quarenta e oito) horas, por meio de correspondência ou e-mail do seguinte endereço: sindmetalurgicos.pe@gmail.com.  2. Nas hipóteses excepcionais de compromissos sindicais urgentes, admite-se a comunicação ao empregador com antecedência de 24 (vinte e quatro) horas. |ausênc trabalh dirigent sindical desempenh funçõ própr dev comunic empreg antecedent mínim quarent oit hor mei correspondent email seguint enderec sindmetalurgicosp gmailcom hipótes excepcion compromiss sindic urgent admites comunic empreg antecedent vint quatr hor
2016_082084|Access to Company Information|1. A empresa se compromete a entregar ao empregado acidentado e a enviar ao Sindicato Profissional, no prazo de 7 (sete) dias úteis após a emissão, as cópias das Comunicações de Acidentes de Trabalho (CATs), expedidas mediante protocolo pessoal ou, preferencialmente, por via eletrônica (e-mail) para o seguinte endereço eletrônico: sindmetalurgicos.pe@gmail.com. |empres compromet entreg empreg acident envi sindicat profissional praz set dias úte após emissã cóp comunic acident trabalh cats exped mediant protocol pessoal preferencial via eletrôn email seguint enderec eletrôn sindmetalurgicosp gmailcom
2016_082084|Union Contributions| 1. Sem prejuízo das sanções previstas no parágrafo único do Artigo 545 da CLT, as mensalidades para o Sindicato, descontadas dos empregados associados, deverão ser recolhidas até o 3º (terceiro) dia útil do mês subsequente ao mês a que se refere o desconto, sob pena de os valores serem corrigidos, a partir de então, com base na taxa Selic, até a data do efetivo recolhimento.  2. A empresa se compromete a remeter para o Sindicato Profissional, até 10 (dez) dias após o recolhimento da mensalidade sindical, a relação nominal dos contribuintes com os valores descontados, em papel timbrado do empregador, juntamente com a cópia do depósito efetivado junto à instituição bancária, mediante protocolo pessoal ou, preferencialmente, por via eletrônica (e-mail) para o seguinte endereço eletrônico: sindmetalurgicos.pe@gmail.com.  3. As importâncias descontadas deverão ser depositadas na conta corrente nº 2.722-7, do Banco do Brasil, agência 1850-3, Av. Dantas Barreto nº 541. A cópia do comprovante de depósito deve ser encaminhada mediante protocolo pessoal ou, preferencialmente, via endereço eletrônico (e-mail)  para o seguinte endereço eletrônico: sindmetalurgicos.pe@gmail.com. É necessário constar expressamente no documento o número do CNPJ da empresa depositante.  4. Caso o associado esteja em benefício previdenciário, a empresa se compromete a voltar a descontar em folha a contribuição associativa, quando do retorno do empregado. |prejuíz sançõ previst parágraf únic artig clt mensal sindicat descont empreg assoc dev recolh terceir dia útil mês subsequent mês refer descont sob pen valor ser corrig part entã bas tax selic dat efet recolh empres compromet remet sindicat profissional dez dias após recolh mensal sindical relaçã nominal contribuint valor descont papel timbr empreg junt cóp depósit efetiv junt instituiçã bancár mediant protocol pessoal preferencial via eletrôn email seguint enderec eletrôn sindmetalurgicosp gmailcom importânc descont dev deposit cont corrent nº banc brasil agênc av dant barret nº cóp comprov depósit dev encaminh mediant protocol pessoal preferencial via enderec eletrôn email seguint enderec eletrôn sindmetalurgicosp gmailcom necessári const express document númer cnpj empres deposit cas assoc benefíci previdenciári empres compromet volt descont folh contribuiçã assoc retorn empreg
2016_082084|Union Contributions| 1. A empresa descontará do salário básico dos trabalhadores, observado o disposto no item 2, a título de CONTRIBUIÇÃO ASSISTENCIAL, 4 (quatro) parcelas, cada uma no valor de R$ 18,22 (dezoito reais e vinte e dois centavos), dos que recebem piso salarial, nos meses de dezembro de 2016 a março de 2017, e 4 (quatro) parcelas, cada uma no valor de R$ 24,84 (vinte e quatro reais e oitenta e quatro centavos), dos que percebem salários superiores ao piso salarial, nos meses de dezembro de 2016 a março de 2017, conforme autorização da assembleia realizada no mês de setembro de 2016, para qual foram convocados os associados e os não associados ao Sindicato Profissional.   2. O direito de oposição ao desconto acima mencionado será assegurado a todos os trabalhadores associados e não associados, nos termos da decisão unânime da primeira turma do STF, no processo RE nº 220.700-1/RS, e poderá ser exercido pelo período de 10 (dez) dias, a partir da data da transmissão do presente instrumento para o MTE, para fins de registro, sob pena de admissão tácita, devendo operar-se na sede do sindicato profissional ou na subsede de Goiana/PE, durante os horários normais de expediente das entidades, comprometendo-se o órgão classista a encaminhar tais comprovantes à empresa.  3. As importâncias descontadas deverão ser depositadas, com a identificação do CNPJ da empresa, na conta corrente nº 2722-7, do Banco do Brasil, agência 1850-3, Av. Dantas Barreto nº 541, até o 3º (terceiro) dia útil do mês subsequente ao desconto. A cópia do comprovante de depósito deve ser encaminhada mediante protocolo pessoal ou, preferencialmente, por via eletrônica (e-mail) para o seguinte endereço eletrônico: sindmetalurgicos.pe@gmail.com.  4. Juntamente com o recolhimento, deverá ser enviada para o sindicato a relação nominal dos contribuintes com os valores descontados, em papel timbrado do empregador, mediante protocolo pessoal ou, preferencialmente, por via eletrônica (e-mail) para o seguinte endereço eletrônico: sindmetalurgicos.pe@gmail.com.  5. A inobservância pela empresa dos prazos previstos nesta cláusula acarretará à organização, sanções previstas na cláusula 74ª (septuagésima quarta).  6. Em caso de término do contrato de trabalho do empregado antes de vencida a totalidade das parcelas a que se refere o item 1 dessa cláusula, não serão devidas as parcelas posteriores ao término do contrato de trabalho. |empres descont salári básic trabalh observ dispost item títul contribuiçã assistencial quatr parcel cad valor r dezoit rea vint dois centav receb pis salarial mes dezembr marc quatr parcel cad valor r vint quatr rea oitent quatr centav perceb salári superior pis salarial mes dezembr marc conform autoriz assembl realiz mês setembr convoc assoc assoc sindicat profissional direit oposiçã descont acim mencion assegur tod trabalh assoc assoc term decisã unânim primeir turm stf process re nº pod exerc períod dez dias part dat transmissã present instrument mte fins registr sob pen admissã tácit dev operars sed sindicat profissional subsed goianap durant horári norm expedient entidad comprometendos órgã classist encaminh tais comprov empres importânc descont dev deposit identific cnpj empres cont corrent nº banc brasil agênc av dant barret nº terceir dia útil mês subsequent descont cóp comprov depósit dev encaminh mediant protocol pessoal preferencial via eletrôn email seguint enderec eletrôn sindmetalurgicosp gmailcom junt recolh dev envi sindicat relaçã nominal contribuint valor descont papel timbr empreg mediant protocol pessoal preferencial via eletrôn email seguint enderec eletrôn sindmetalurgicosp gmailcom inobserv empres praz previst nest cláusul acarret organiz sançõ previst cláusul septuagésim quart cas términ contrat trabalh empreg antes venc total parcel refer item dess cláusul dev parcel posterior términ contrat trabalh
2016_082084|Other provisions on Representation and Organization|1. O tema da representação dos empregados será objeto de apreciação da comissão paritária prevista na cláusula septuagésima sétima. |tem represent empreg objet aprec comissã paritár previst cláusul septuagésim sétim
2016_082084|Mechanisms for Conflict Resolution|1. Qualquer divergência sobre a aplicação dos benefícios consignados neste acordo coletivo será dirimida pela Comissão Paritária que será implantada na vigência deste instrumento coletivo e cuja operacionalidade será definida pelas partes.  2. Essa mesma Comissão Paritária será competente para apreciar questões que envolvam matéria pertinente a segurança e saúde dos trabalhadores, crise econômica do setor, conflitos entre empresa e sindicato profissional e forma de adoção do PPE (Programa de Preservação do Emprego). Deve ser composta de membros da empresa e do Sindicato Profissional. |qualqu divergent sobr aplic benefíci consign nest acord colet dirim comissã paritár implant vigênc dest instrument colet cuj operacional defin part mesm comissã paritár competent aprec questõ envolv matér pertinent segur saúd trabalh cris econôm setor conflit empres sindicat profissional form adoçã ppe program preserv empreg dev compost membr empres sindicat profissional
2016_082084|Mechanisms for Conflict Resolution|1. Quaisquer dúvidas, controvérsias ou litígios que resultem da interpretação ou aplicação deste acordo coletivo serão conciliados ou dirimidos pelos órgãos jurisdicionais trabalhistas. |quaisqu dúv controvérs litígi result interpret aplic dest acord colet concili dirim órgã jurisdicion trabalh
2014_009174|Union Access to Workplace|A empresa se compromete a disponibilizar espaço e horario ao Sindicato Profissional para que  o mesmo promova campanhas de sindicalização para os funcionarios que desejarem, desde que sejam feitas de forma discreta, sem comprometer ou atrapalhar o funcionamento das lojas. |empres compromet disponibiliz espac horari sindicat profissional promov campanh sindicaliz funcionari desej desd feit form discret compromet atrapalh funcion loj
2014_009174|Negotiation Rules|O presente Termo Aditivo à Convenção Coletiva da Categoria registrada no Ministerio do Trabalho e Emprego em Petropolis, sob o nº RJ002188/2013,  passa a integrar a Convenção Coletiva e tem por escolpo autorizar o trabalho dos empregados da Empresa Corpo e Ação de Teresópolis Comércio e Confecções Ltda., aos feriados, a partir de 14 de Novembro de 2013 à 31 de Outubro de 2014, salientando-se que seus efeitos juridicos e legais estão estendidos a todos os empregados. PARAGRAFO UNICO: Os empregados da empresa foram ouvidos em reunião, concordando com a assinatura do presente termo aditivo, conforme lista de participação. |present term adit convençã colet categor registr ministeri trabalh empreg petropol sob nº pass integr convençã colet escolp autoriz trabalh empreg empres corp açã teresópol comérci confecçõ ltda feri part novembr outubr salientandos efeit jurid leg estend tod empreg paragraf unic empreg empres ouv reuniã concord assinatur present term adit conform list particip
2014_009174|Mechanisms for Conflict Resolution|Consoante Art. 625 da Lei Consolidada as partes convencionam que as controversias resultantes da aplicação deste Acordo Coletivo de Trabalho serão dirimidas pela Justiça do Trabalho. |consoant art lei consolid part convencion controvers result aplic dest acord colet trabalh dirim justic trabalh
2009_016731|Negotiation Rules|8.1- O empregado demitido por justa causa, devidamente comprovada, perderá o direito ao recebimento da PLR. O empregado desligado por iniciativa própria sem justa causa, receberá a PLR proporcional ao tempo trabalhado na empresa.  8.2- Nos recibos salariais ficará destacado, especificamente, o pagamento referente a PLR.  8.3- Os empregados acometidos de acidentes de trabalho, doenças ou moléstias, que resultem em afastamentos, ou estando em gozo de férias terão suas ausências abonadas, para o efeito do pagamento da PLR.  8.4- A ocorrência de greves ou paralisações implicará na perda da PLR para todos os empregados, caso seja considerada ilegal pela justiça.  8.5- No caso de paralisação da obra por motivo alheio a vontade da empresa, por iniciativa dos órgãos ou por falta de verbas, implicará na perda pelos trabalhadores da PLR.  8.6- A empresa deverá entregar para o SINTEPAV-CE, relação de todos os empregados com discriminação dos valores devidos a título de PLR relativo ao ano de 2009 e 2010, inclusive dos empregados já desligados da empresa.  8.7- Em relação aos empregados ainda vinculados á empresa, caberá a empresa pagar diretamente a cada empregado o valor devido a título de PLR, já em relação aos empregados desligados/demitidos deverão os respectivos valores serem entregues ao SINTEPAV-CE que se encarregará de repassar os valores aos trabalhadores. .  8.8 - O período de vigência inicial do presente acordo é de dois anos, ou seja, de 01 de Janeiro de 2009 à 31 de dezembro de 2010, podendo ser renovado nos termos do parágrafo l° da cláusula 12° da CONVENÇÃO COLETIVA DE TRABALHO 2008/2009.  Por assim justas e acordadas, firma as partes o presente instrumento.  Fortaleza, 11 de Maio de 2009.     ___________________________________________________ JOSÉ WEBSTON NOGUEIRA PINHEIRO CPF 318.155.373-53 SÓCIO DA EMPRESA RG2 TERRAPLENAGEM LTDA    ____________________________________________________ RAIMUNDO NONATO GOMES CPF: 145.549.443-15 REPRESENTANTE DO SINTEPAV/CE|empreg demit just caus devid comprov perd direit receb plr empreg deslig inic própr just caus receb plr proporcional temp trabalh empres recib salari fic destac especif pagament referent plr empreg acomet acident trabalh doenc molést result afast estand goz fér ausênc abon efeit pagament plr ocorrent grev paralis implic perd plr tod empreg cas consider ilegal justic cas paralis obra motiv alhei vontad empres inic órgã falt verb implic perd trabalh plr empres dev entreg sintepavc relaçã tod empreg discrimin valor dev títul plr relat ano inclusiv empreg deslig empres relaçã empreg aind vincul á empres cab empres pag diret cad empreg valor dev títul plr relaçã empreg desligadosdemit dev respect valor ser entregu sintepavc encarreg repass valor trabalhadores períod vigênc inicial present acord dois anos janeir dezembr pod renov term parágraf cláusul convençã colet trabalh assim just acord firm part present instrument fortal mai jos webston nogueir pinheir cpf sóci empres terraplenag ltda raimund nonat gom cpf represent sintepavc
2015_043073|Union Access to Workplace|Obedecidas rigorosamente as regras do comando diretivo de cada empresa e não havendo interferência em trabalho urgente que esteja sendo efetuado por qualquer empregado, terá livre acesso às dependências das empresas qualquer diretor do Sindicato Profissional para exercer sua atividade sindical, desde que haja um aviso prévio de 24 horas para a visita. |obedec rigor regr com diret cad empres hav interferent trabalh urgent send efetu qualqu empreg livr acess dependent empres qualqu diretor sindicat profissional exerc ativ sindical desd avis prévi hor visit
2015_043073|Union Contributions|O desconto das mensalidades sociais dos associados do Sindicato Profissional, no percentual de 3,5% (três virgula cinco por cento) sobre o salário-base dos mesmos, será feito diretamente em folha de pagamento, desde que devidamente autorizadas as empresas pelos trabalhadores, por escrito, e notificadas pela entidade sindical obreira, caso em que os contracheques ou envelopes de pagamento servem como recibo de pagamento das mensalidades, desobrigando o Sindicato Profissional do fornecimento do recibo de quitação das mensalidades, somente poderão cessar após devidamente comprovada a exclusão do quadro social do associado, mediante notificação da entidade sindical, ou após o desligamento do empregado por demissão, transferência ou aposentadoria, ficando terminantemente proibidos os pedidos de exclusão apresentados através do setor de pessoal das empresas. |descont mensal soc assoc sindicat profissional percentual três virgul cinc cent sobr saláriobas mesm feit diret folh pagament desd devid autoriz empres trabalh escrit notific entidad sindical obreir cas contrachequ envelop pagament serv recib pagament mensal desobrig sindicat profissional fornec recib quitaçã mensal soment pod cess após devid comprov exclusã quadr social assoc mediant notific entidad sindical após deslig empreg demissã transferent aposentador fic termin proib ped exclusã apresent através setor pessoal empres
2015_043073|Union Contributions|Os descontos relativos às Mensalidades Sociais (cláusula 40ª), em favor do Sindicato Profissional, terá o seu montante recolhido à Conta n.º 23229-7 e o repasse do Custeio Assistencial (Clausula 3ª, parágrafo quarto) terá seu montante recolhido à Conta 23940-9, ambas da Agência 0936 do BANCO ITAÚ S.A., nesta cidade, até o 5º (quinto) dia útil do mês subseqüente ao desconto, sob pena de multa de 5% (cinco por cento) por cada mês de atraso, calculada sobre o montante a ser recolhido, além de juros de 1% (um por cento) ao mês, correção monetária à base do índice de inflação do mês do desconto e demais cominações convencionais. As empresas deverão comprovar tais recolhimentos no prazo de 5 (cinco) dias, através de relação nominal dos empregados e de valores descontados, bem como a guia de depósito bancário. Incumbe à entidade sindical profissional fornecimento às empresas das guias de recolhimento da aludida mensalidade sindical. |descont relat mensal soc cláusul favor sindicat profissional montant recolh cont nº rep custei assistencial clausul parágraf quart montant recolh cont ambas agênc banc itaú sa nest cidad quint dia útil mês subsequent descont sob pen mult cinc cent cad mês atras calcul sobr montant recolh além jur cent mês correçã monetár bas índic inflaçã mês descont dem comin convencion empres dev comprov tais recolh praz cinc dias através relaçã nominal empreg valor descont bem gui depósit bancári incumb entidad sindical profissional fornec empres gui recolh alud mensal sindical
2015_043073|Union Contributions|As empresas remeterão ao Sindicato Profissional, no prazo de 15 (quinze) dias contados da data do recolhimento da contribuição sindical dos empregados pertencentes à categoria profissional, relação nominal dos empregados contribuintes, indicando a função de cada um e o salário do mês a que corresponder o valor recolhido, bem como cópia da guia de recolhimento da referida contribuição. |empres remet sindicat profissional praz quinz dias cont dat recolh contribuiçã sindical empreg pertencent categor profissional relaçã nominal empreg contribuint indic funçã cad salári mês correspond valor recolh bem cóp gui recolh refer contribuiçã
2015_043073|Union Contributions|As empresas pela presente Norma Coletiva de Trabalho descontará mensalmente de todos os seus trabalhadores pertencentes à Categoria Profissional Acordante, inclusive durante as férias, à título de contribuição assistencial, conforme fixado e aprovado em assembleia Geral realizada em 20, 23, 25, 27 e 29 de março de 2015, conforme edital de publicado e de acordo com o MEMO CIRCULAR SIT/SRT-TEM Nº 1/2005 DE 20.01.2008, a importância equivalente a 1% (um por cento) do salário base de cada trabalhador, não alcançando os trabalhadores associados. PARÁGRAFO PRIMEIRO: O trabalhador que não concordar com a efetivação dos referidos descontos manifestará, por escrito a sua discordância no prazo de 10 (dez) dias, a contar da data da realização da Assembleia que aprovou a presente NORMA COLETIVA DE TRABALHO, implicando sua oposição na cessação dos descontos. PARÁGRAFO SEGUNDO: O sindicato profissional ficará responsável por qualquer implicância neste sentido isentando o sindicato patronal ou empresas: que fará o desconto em folha de pagamento. PARÁGRAFO TERCEIRO: As mensalidades sindicais onde o trabalhador autoriza o desconto que será 3,5 (três e meio por cento) sobre os salários. PARÁGRAFO  QUARTO: O desconto mencionado no caput da (cláusula 42ª) será depositado na conta Banco ITAÚ AG – 0936 C/C 06413-8 desta entidade, até o 5º dia útil de cada mês, sob pena de multa de 5% ( cinco por centro), juros e correção |empres present norm colet trabalh descont mensal tod trabalh pertencent categor profissional acord inclusiv durant fér títul contribuiçã assistencial conform fix aprov assembl geral realiz marc conform edital public acord mem circul sitsrtt nº import equivalent cent salári bas cad trabalh alcanc trabalh assoc parágraf primeir trabalh concord efetiv refer descont manifest escrit discord praz dez dias cont dat realiz assembl aprov present norm colet trabalh implic oposiçã cessaçã descont parágraf segund sindicat profissional fic respons qualqu implic nest sent isent sindicat patronal empres far descont folh pagament parágraf terceir mensal sindic onde trabalh autoriz descont três mei cent sobr salári parágraf quart descont mencion caput cláusul deposit cont banc itaú ag cc dest entidad dia útil cad mês sob pen mult cinc centr jur correçã
2012_003082|Unionization (campaigns and hiring of union members)|A empresa prestará imformações sobre como sindicalizar a todos trabalhadores interessados que for admitidos a partir da data de homologação deste Acordo Coletivo de Trabalho. E a empresa descontará o valor de 01(Um) por cento sobre o salário de cada trabalhador sindicalizado e repassará ao sindicato até 10(Décimo) dia de cada m~es. PARÁGRAFO  PRIMEIRO - A empresa permitirá acesso de pessoas credenciadas pela entidade sindical para entrega de documentos ou prestar serviços de informações. PARÁGRAFO SEGUNDO - A  empresa permitirá ao sindicato ccolocar em seu quadro de avisos cópias do  presente Acordo Coletivo de Trabalho, e cartazes com aviso referente ao sindicato. |empres prest imform sobr sindicaliz tod trabalh interess admit part dat homolog dest acord colet trabalh empres descont valor cent sobr salári cad trabalh sindicaliz repass sindicat décim dia cad mes parágraf primeir empres permit acess pesso credenc entidad sindical entreg document prest servic inform parágraf segund empres permit sindicat ccoloc quadr avis cóp present acord colet trabalh cartaz avis referent sindicat
2012_003082|Guarantees to Union Officers|Será concedida licença renumerada aos dirigentes titulares do sindicato para participação em congressos , confer~encias, seminários e sempre que houver necessidade do sindicato com prévia comunicação a empresa desde seja solicitada pelo presidente da entidade com antecedência mínima de 05(Cinco) dias. |conced licenc renumer dirigent titul sindicat particip congress conferenc seminári sempr necess sindicat prév comunic empres desd solicit president entidad antecedent mínim cinc dias
